Subreddit Name, Author, Author Fullname, Name, Parent ID, Created Time, Depth, Score, Upvote Ratio, Body, 
worldnews, dutchgypsy, t2_km637, t3_yr0d48, , 11/09/22 19:29, 0, 42894, 0.94, "https://www.theguardian.com/world/2022/nov/10/brazil-military-finds-no-evidence-of-election-dashing-hopes-of-bolsonaro-supporters ", 
worldnews, thewhiteflame1987, t2qri5bxqi, t1ivs41yo, t1ivrsui0, 11/10/22 00:13, 3, 1067, 0, "I take it youre from Brazil, so correct me if you disagree with my take here, but given this outcome with the military and the fact he was completely silent after the result leads me to believe he was holding out hope the military would make some sort of indication of support or move to support him, and when he realized it wasnt forthcoming he realized he had no choice but to concede.", 
worldnews, MightyDickTwist, t250ork8ae, t1ivrsui0, t1ivrea7l, 11/09/22 22:17, 2, 3292, 0, "1. His own allies abandoned ship fairly quickly. 2. Everyone was really fucking quick to recognize Lula. Leaders from all over the world congratulated Lula right after he won, and the same happened with political leaders within our country (even some of Bolsonaro’s allies). 3. Bolsonaro is (not yet confirmed) going through health issues, related to a leg infection. Still unclear, but some suspect Erysipelas. I don’t think it’s life threatening at all, but he’ll need to go through a recovery period. He’s not been doing much as of late.", 
worldnews, [deleted], , t1ivs7uk2, t3yr0d48, , 1, 3708, 0, "I was really surprised by how easily he bowed out after he lost.", 
worldnews, ffdfawtreteraffds, t2ev638hiy, t1ivrbxws, t3yr0d48, 11/09/22 20:07, 1, 3373, 0, "Monitors, investigators, and lawyers found no evidence of election fraud in the US, but Trump supporters hopes have never been dashed.", 
