Name,Affiliation,Number of Followers,Before Corpus,Before List of Likes,Before List of Retweets,After Corpus,After List of Likes,After List of Retweets
SabbySabs2,Democratic Party,75700,"['Every resident in East Palestine, OH should receive Medicare For All. Libby, Montana, was able to do this due to asbestos. Their property value has also decreased and theyve experienced pain and suffering.  FYI, Norfolk Southern donates to BOTH parties!', 'Every resident in East Palestine, OH should receive Medicare For All. Libby, Montana, was able to do this due to asbestos. Their property value has also decreased and theyve experienced pain and suffering.  FYI, Norfolk Southern donates to BOTH parties!', 'Israels right to exist? Here we go again.', 'Every resident in East Palestine, OH should receive Medicare For All. Libby, Montana, was able to do this due to asbestos. Their property value has also decreased and theyve experienced pain and suffering.  FYI, Norfolk Southern donates to BOTH parties!']","[934, 230, 259, 934]","[343, 91, 104, 343]","['This is what Ive been saying for months. Its double speak when you hear Kamala say she wants a ceasefire but she wont stop or condition aid to Israel. The ceasefire rhetoric is just a campaign sale to get your vote.', 'Ilhan Omar: ""If you really wanted a ceasefire, youd just stop sending the weapons. It is that simple""  Spot on.', 'For years, Palestinians have been treated like animals, and our government was silent. Occupied ppl have the right to resist!', '“Palestinians have been murdered by the thousands & we say nothing. And suddenly Joe Biden pops up & starts teaching us about morality & humanity. Well screw your morality!”  —Dr. Osama Abu Irshaid at DC Rally to #FreePalestine End #IsraeliApartheid', 'They were not Israelis. They were Arab Druze. You need to issue a retraction.', 'Whats laughable is that you choose to prioritize the oppressor instead of the people being BOMBED! How they hell do you BOTH SIDES a genocide? How the hell do you attack protesters calling out a genocidal supremacist state? Youre an opportunist.', 'It is laughable.  We can mobilize to end the atrocities in Gaza and combat the rise of antisemitism at the same time. Bigotry in organizing spaces imperils everyone’s work.   I work to end the war, protect ALL my constituents, and fight AIPAC. Believe it or not, you can do all 3. x.com/YairRosenberg…', 'HAARETZ  finally admitting IDF was ordered to use Hannibal Directive on October 7th!', 'ISRAEL ORDERS ALL PALESTINIANS TO LEAVE GAZA. They have nowhere to go. Along with the approval of the annexation of the West Bank, this is full-scale ethnic cleansing. And our government is funding it.', 'BREAKING NEWS: ICJ SAYS ISRAEL MUST HALT MILITARY OPERATION IN RAFAH!', 'Israel vows to continue war after hostages are released. As I said before they want to ethnically cleanse the land.', 'Israeli host threatened genocide of Gaza, Lebanon and Iran. The US government is backing this every time they send weapons to Israel. @POTUS is the face of genocide.', 'Israeli host threatens the Arabic world with\xa0 genocide, live on TV', 'ICJ RULES ISRAELS TREATMENT OF PALESTINIANS SHOWS DISCRIMINATION & THE OCCUPATION IS ILLEGAL. @joebiden @realDonaldTrump @RepJeffries @tedcruz sold their souls to AIPAC for a political career. Contact your representatives and tell them they support an illegal occupation!', 'JUST IN: ICJ Rules by a vote of 14-1 that Israels occupation of Palestinian territory is illegal and must evacuate settlers/immediately halt all new settlement activities', 'Hes right. A ceasefire also doesnt stop land expansion in the West Bank. Doesnt stop the torture of Palestinian prisoners. Doesnt stop apartheid either. This is why politicians are trying to limit the discussion to October 7th.', 'Calling for a ceasefire or arms embargo at this point is farcical.  Then what? We go back to ""normal"" i.e. occupation until the next slaughter?  The only fair and legal remedy under intl law is decolonization. Anything else denies Palestinians, Syrians and Lebanese their land,', 'Israel just killed an American activist in the West Bank, and Trump is worried about Israel being doomed. I dont care if Israel is doomed. They spent decades dooming Palestinians.', 'TRUMP: “If I dont win this election.  Israel is doomed. Thats a tough statement. Israel will be gone. ”', 'Biden has announced that Israel is LOSING Support due to indiscriminate bombing. Even CNN is admitting Gaza is a disaster. I have no doubt that had it not been public pressure, these statement would not exist.', 'Israeli minister is calling for the replacement of Palestinians in Gaza with Israelis. This is so blatant and yet our government pretends Israel is doing everything to protect civilians.', 'Khamenei, has issued an order for Iran to strike Israel directly, in retaliation for the killing in Tehran of Hamass leader. SHIT JUST HIT THE FAN!', 'HAARETZ  finally admitting IDF was ordered to use Hannibal Directive on October 7th!', 'BREAKING NEWS: ICJ SAYS ISRAEL MUST HALT MILITARY OPERATION IN RAFAH!', 'ISRAEL ORDERS ALL PALESTINIANS TO LEAVE GAZA. They have nowhere to go. Along with the approval of the annexation of the West Bank, this is full-scale ethnic cleansing. And our government is funding it.', 'Israel vows to continue war after hostages are released. As I said before they want to ethnically cleanse the land.']","[694, 1275, 201, 638, 2264, 256, 366, 579, 271, 508, 676, 226, 206, 273, 389, 588, 275, 472, 401, 322, 235, 311, 579, 509, 270, 676]","[223, 429, 14, 166, 681, 110, 24, 255, 161, 194, 300, 111, 78, 115, 112, 212, 135, 162, 186, 142, 78, 136, 257, 194, 158, 299]"
RonFilipkowski,Democratic Party,1000000,"['Dershowitz said Trump asked him at dinner why only 27% of Jews voted for him when he strongly supported Israel. Dersh said he told Trump Jews also care about gay rights, abortion, climate change, gun control and separation of church and state, and he was terrible on those.', 'Rep. Troy Nehls is in E. Palestine and assures everyone that the city’s water is safe to drink, then demonstrates it by drinking a cup of tap water from the China Cafe. “The Fire Chief, everybody says the water is clean to drink.”', 'For every Repub trying to blame the Admin for E. Palestine, I continue to cite Steve Bannon, who again today placed the blame every step of the way on DeWine & Norfolk Southern. Says the RR and DeWine did release & burn of chems because they wanted to clear tracks ASAP to get', 'Right-wing “independent journalist” who flew in to Maui (he also went into E. Palestine) after the fire is confronted by angry residents while live on Steve Bannon’s show, who said he is exploiting them for politics and using up precious resources.', 'Dershowitz said Trump asked him at dinner why only 27% of Jews voted for him when he strongly supported Israel. Dersh said he told Trump Jews also care about gay rights, abortion, climate change, gun control and separation of church and state, and he was terrible on those.', 'For every Repub trying to blame the Admin for E. Palestine, I continue to cite Steve Bannon, who again today placed the blame every step of the way on DeWine & Norfolk Southern. Says the RR and DeWine did release & burn of chems because they wanted to clear tracks ASAP to get', 'Rep. Troy Nehls is in E. Palestine and assures everyone that the city’s water is safe to drink, then demonstrates it by drinking a cup of tap water from the China Cafe. “The Fire Chief, everybody says the water is clean to drink.”', 'Right-wing “independent journalist” who flew in to Maui (he also went into E. Palestine) after the fire is confronted by angry residents while live on Steve Bannon’s show, who said he is exploiting them for politics and using up precious resources.', 'Dershowitz said Trump asked him at dinner why only 27% of Jews voted for him when he strongly supported Israel. Dersh said he told Trump Jews also care about gay rights, abortion, climate change, gun control and separation of church and state, and he was terrible on those.', 'For every Repub trying to blame the Admin for E. Palestine, I continue to cite Steve Bannon, who again today placed the blame every step of the way on DeWine & Norfolk Southern. Says the RR and DeWine did release & burn of chems because they wanted to clear tracks ASAP to get', 'Rep. Troy Nehls is in E. Palestine and assures everyone that the city’s water is safe to drink, then demonstrates it by drinking a cup of tap water from the China Cafe. “The Fire Chief, everybody says the water is clean to drink.”', 'Right-wing “independent journalist” who flew in to Maui (he also went into E. Palestine) after the fire is confronted by angry residents while live on Steve Bannon’s show, who said he is exploiting them for politics and using up precious resources.']","[1337, 7409, 1012, 25397, 7377, 1331, 1578, 25253, 7417, 1338, 2024, 25418]","[303, 1887, 208, 6635, 1882, 305, 420, 6617, 1888, 305, 485, 6637]","['Trump, 4 days after the Hamas attack on Israel, decided to rip Netanyahu over the Soleimani strike: “I’ll never forget that Bibi Netanyahu let us down. That was a very terrible thing .  We were disappointed by that - very disappointed. Then Bibi tried to take credit for it.”', 'How odd for Trump to Blame America First for an act of terrorism in Israel, without a word of accountability instead for his good friend Benjamin Netanyahu, who actually runs that country.', 'The Republican Party wants to give Benjamin Netanyahu a blank check to do whatever he wants in Gaza with no oversight or questions asked. The fact that most Democrats disagree with that does not make them anti-Semitic. A large percentage of Jewish Democrats disagree with that.', 'MAGA, Trump & Vance have been telling us that the U.S. shouldn’t police the world and solve issues happening in other countries. But I guess this attack inside Israel is now America’s fault, and not Benjamin Netanyahu’s. I’m struggling to understand this ‘America First’ thing.', 'Trump to Netanyahu today: “No president has done what I’ve done for Israel.”', 'The Republican Party wants to give Benjamin Netanyahu a blank check to do whatever he wants in Gaza with no oversight or questions asked. The fact that most Democrats disagree with that does not make them anti-Semitic. A large percentage of Jewish Democrats disagree with that.', 'On US peace negotiations between Israel and Gaza: “The reporting is that former President Trump is on the phone with the PM of Israel urging him not to cut a deal right now because it’s believed that would help the Harris campaign.”', 'In Israel with a bipartisan delegation of US Senators, Lindsey Graham goes off on a Newsmax reporter asking him to condemn Rashida Tlaib: “You’re not going to screw this up! Get this guy out of here!”', 'How odd for Trump to Blame America First for an act of terrorism in Israel, without a word of accountability instead for his good friend Benjamin Netanyahu, who actually runs that country.', 'Trump, 4 days after the Hamas attack on Israel, decided to rip Netanyahu over the Soleimani strike: “I’ll never forget that Bibi Netanyahu let us down. That was a very terrible thing .  We were disappointed by that - very disappointed. Then Bibi tried to take credit for it.”', 'Trump to Netanyahu today: “No president has done what I’ve done for Israel.”', 'On US peace negotiations between Israel and Gaza: “The reporting is that former President Trump is on the phone with the PM of Israel urging him not to cut a deal right now because it’s believed that would help the Harris campaign.”', 'In Israel with a bipartisan delegation of US Senators, Lindsey Graham goes off on a Newsmax reporter asking him to condemn Rashida Tlaib: “You’re not going to screw this up! Get this guy out of here!”', 'The Republican Party wants to give Benjamin Netanyahu a blank check to do whatever he wants in Gaza with no oversight or questions asked. The fact that most Democrats disagree with that does not make them anti-Semitic. A large percentage of Jewish Democrats disagree with that.', 'Javanka on scene to negotiate an end to the conflict in Israel.', 'Kushner Kleanup Time: Please ignore my previous comments that waterfront property in Gaza “could be very valuable.” I’m all about the welfare of the Palestinian people. Thank you. End of statement.', 'In a few more hours, MAGA can come out of their bunkers, take off the camo, put their AR-15s, flamethrowers and grenades up, because the global day of jihad will be over.', 'This is a very thoughtful, measured and perfect statement to make. Delivering it in Israel makes it even more powerful. It is inconceivable that Trump could ever make such a statement.', 'Biden: I caution this while you feel that rage, dont be consumed by it. After 9/11, we were enraged in the US. While we sought justice and got justice, we also made mistakes… The vast majority of Palestinians are not Hamas. Hamas does not represent the Palestinian people.', 'The pro-Hamas account ‘Iran Observer’ is promoting Trump’s speech last night where he called Hezbollah “a very smart organization.” Story …', 'MAGA, Trump & Vance have been telling us that the U.S. shouldn’t police the world and solve issues happening in other countries. But I guess this attack inside Israel is now America’s fault, and not Benjamin Netanyahu’s. I’m struggling to understand this ‘America First’ thing.', 'With Israel hurting and reeling after a massive terrorist attack, Trump continues to trash Netanyahu, the Israeli government, and intelligence services today, doubling-down on his comments from last night.', 'MAGA ‘Prophet’ Julie Green is holding a prayer session on her podcast where she says God will then stop the Hamas rockets or cause them to misfire.', 'Rudy says we should have sent Navy SEALs and Army Rangers into Gaza to rescue the hostages.']","[813, 1520, 2370, 1244, 1440, 2369, 34866, 3056, 1523, 813, 1442, 34702, 3040, 2359, 4799, 1106, 2005, 5266, 1402, 1236, 1049, 954, 780, 5784]","[317, 363, 703, 229, 476, 702, 18715, 597, 363, 318, 477, 18719, 599, 701, 762, 315, 228, 1039, 712, 226, 344, 217, 186, 1435]"
mmpadellan,Democratic Party,1300000,"['Even Fox News knows that the deregulation by the trump admin were the cause of the disaster in East Palestine, OH. And Elaine Chao never visited train derailment sites, even when there were fatalities.', 'OOPS! Looks like Fox News allowed a bit of truth to slip into their coverage of the train derailment story in East Palestine, OH — theyre blaming trump!!!  Be a real shame if everyone retweeted this.', 'Even Fox News knows that the deregulation by the trump admin were the cause of the disaster in East Palestine, OH. And Elaine Chao never visited train derailment sites, even when there were fatalities.', 'OOPS! Looks like Fox News allowed a bit of truth to slip into their coverage of the train derailment story in East Palestine, OH — theyre blaming trump!!!  Be a real shame if everyone retweeted this.']","[1069, 24343, 1078, 24557]","[314, 16978, 315, 17047]","['While Democrats push for ceasefire and humanitarian aid in Gaza, Republicans like Rep. Tim Walberg call for the slaughters of Palestinian children, ""It should be like Nagasaki and Hiroshima.""  This should be a much bigger story.', 'Good morning and Happy Sunday to everyone who would like to see this deal finalized to release dozens of women and children hostages from captivity in Gaza, and increase humanitarian aid.  Id rather see every last one of the hostages freed but its an important first step.', 'Israel has a right to exist. Palestine has a right to exist. A two-state solution is the ONLY way forward. BOTH need to be free of terrorist violence, retaliatory violence, settler violence, and occupier violence. Free of violence, PERIOD.  Both sides have suffered tremendous', 'LATE NITE WITH BDD: Israel-Hamas Conflict intensifies, Rep. George Santos indicted AGAIN, Tommy Tuberville and Rand Paul BLOCKING State and Military, Elon Musk to remove likes, reposts, and replies. Identifying misinformation on Israel-Hamas.  Live on my YouTube at 10:30PM ET', 'WOW.  Senator Chuck Schumer called Benjamin Netanyahu ""an obstacle to peace,"" and ""too willing to tolerate the civilian toll in Gaza,"" and called for Israel to hold new elections to replace him.  Senator Schumer is 100% right.', 'While Democrats push for ceasefire and humanitarian aid in Gaza, Republicans like Rep. Tim Walberg call for the slaughters of Palestinian children, ""It should be like Nagasaki and Hiroshima.""  This should be a much bigger story.', 'BREAKING: Hamas has tentatively accepted the ceasefire proposal!!!!!', 'As a Muslim,  a father,  a brother, a son, an American, and a human being  I am APPALLED at the heinous, horrendous attacks against civilians in Israel this weekend. You dont need to fit neatly into ANY category besides ""decent human being"" to condemn the atrocities we saw', 'Israel has a right to exist. Palestine has a right to exist. A two-state solution is the ONLY way forward. BOTH need to be free of terrorist violence, retaliatory violence, settler violence, and occupier violence. Free of violence, PERIOD.  Both sides have suffered tremendous', 'WOW.  Senator Chuck Schumer called Benjamin Netanyahu ""an obstacle to peace,"" and ""too willing to tolerate the civilian toll in Gaza,"" and called for Israel to hold new elections to replace him.  Senator Schumer is 100% right.', 'While Democrats push for ceasefire and humanitarian aid in Gaza, Republicans like Rep. Tim Walberg call for the slaughters of Palestinian children, ""It should be like Nagasaki and Hiroshima.""  This should be a much bigger story.', 'CEASEFIRE IN GAZA RIGHT FUCKING NOW,  AND NETANYAHU RESIGN.  Everyone should be calling for this.', 'Good morning and Happy Sunday to everyone who would like to see this deal finalized to release dozens of women and children hostages from captivity in Gaza, and increase humanitarian aid.  Id rather see every last one of the hostages freed but its an important first step.', 'Israel has a right to exist. Palestine has a right to exist. A two-state solution is the ONLY way forward. BOTH need to be free of terrorist violence, retaliatory violence, settler violence, and occupier violence. Free of violence, PERIOD.  Both sides have suffered tremendous', 'WOW.  Senator Chuck Schumer called Benjamin Netanyahu ""an obstacle to peace,"" and ""too willing to tolerate the civilian toll in Gaza,"" and called for Israel to hold new elections to replace him.  Senator Schumer is 100% right.']","[3900, 892, 5003, 203, 29181, 3901, 5852, 15884, 5008, 29184, 3884, 8496, 884, 4975, 28988]","[2146, 175, 1190, 73, 7332, 2149, 612, 2544, 1192, 7337, 2133, 2079, 173, 1181, 7299]"
krystalball,Democratic Party,587700,"['CNN had a literal lobbyist for Norfolk Southern on their panel to talk about East Palestine and didnt disclose it.', 'A provision in Obamacare allows residents in areas deemed a public health disaster to be covered by Medicare for life. At the very least, East Palestine residents deserve this universal coverage after being exposed to a known carcinogen.', 'Whatever you think of the SVB bailout, I want you to really sit with the fact that rich VC’s just got an Insta bailout while the people of East Palestine can’t even get a straight answer as to whether their kids have been poisoned.', 'Great work on this @heyjohnrussell. Thanks to @moreperfectunion for giving him this platform and not forgetting about East Palestine!', 'CNN had a literal lobbyist for Norfolk Southern on their panel to talk about East Palestine and didnt disclose it.', 'A provision in Obamacare allows residents in areas deemed a public health disaster to be covered by Medicare for life. At the very least, East Palestine residents deserve this universal coverage after being exposed to a known carcinogen.', 'Great work on this @heyjohnrussell. Thanks to @moreperfectunion for giving him this platform and not forgetting about East Palestine!']","[4215, 1991, 14437, 358, 4236, 2000, 360]","[1211, 457, 3108, 61, 1220, 459, 62]","['“With Gods help, children in Gaza will die thanks to us.”  Right wing activists in Israel are getting inside info from the military and organizing on WhatsApp to block and torch aid trucks and assault truck drivers. Police stand by and watch making no arrests.', 'The targeting of Al Shifa hospital, is also likely to make it even more difficult (impossible?) to track Palestinian deaths and injuries as the office of the person who tracks and reports this data is located at the hospital. …', '274 Palestinians killed in a bloody massacre to rescue 4 Israelis (and possibly kill others) and this is being celebrated by US politicians as a win. Depraved.', 'The only time the word ""Israel"" is even mentioned is in a statement from the IDF denying that they target civilians. Guess that IDF censor CNN chooses to operate under is doing their job.', 'Bibi’s been the main obstacle to a ceasefire the entire time so he can fuck right off with this hissy fit over some long overdue mild criticism.', 'Israeli Prime Minister Benjamin Netanyahu was upset by Vice President Kamala Harris on camera statement after their meeting & is concerned it will harm negotiations over a Gaza hostage & ceasefire deal, per Israeli official. My story on @axios …', 'Member of Netanyahu’s party defends starving civilians. Half of Gazans are already facing starvation and 90% regularly go entire days without eating.', 'This is exactly the sort of abhorrent logic Hamas used to justify their slaughter of innocent Israelis', 'Mast: I think when we look at this, as a whole, I would encourage the other side to not so lightly throw around the idea of innocent Palestinian civilians. I dont think we would so lightly throw around the term innocent Nazi civilians', '“With Gods help, children in Gaza will die thanks to us.”  Right wing activists in Israel are getting inside info from the military and organizing on WhatsApp to block and torch aid trucks and assault truck drivers. Police stand by and watch making no arrests.', 'The targeting of Al Shifa hospital, is also likely to make it even more difficult (impossible?) to track Palestinian deaths and injuries as the office of the person who tracks and reports this data is located at the hospital. …', 'IDF Spokesman Daniel Hagari rebukes Netanyahu and admits defeating Hamas is impossible:  ""Hamas is an idea, Hamas is a political party. It is rooted in the hearts of people – whoever thinks we can eliminate Hamas is mistaken."" …', 'The only time the word ""Israel"" is even mentioned is in a statement from the IDF denying that they target civilians. Guess that IDF censor CNN chooses to operate under is doing their job.', 'In this article about Israels mass maiming of children in Gaza, CNN fails to mention a single time that Israel is responsible for the fact that 10 kids are losing limbs every day. Instead they talk about ""blast wounds"" with zero responsibility assigned. …']","[907, 1753, 10846, 238, 3408, 1704, 646, 8826, 646, 896, 1747, 1266, 236, 2145]","[482, 670, 3168, 46, 591, 520, 317, 2242, 317, 477, 666, 480, 46, 717]"
