ComicDaveSmith,Other,570400,"['If you were on a mission to create more antisemitism in this country, you couldn’t do a better job than the ADL.', 'Isn’t it crazy that almost no one in the political or media class talk about radical Islamic terrorism anymore. There’s no concern about it, and yet every emergency power that the government took in the name of terrorism, DHL, TSA, Patriot act, is just part of America now.', 'You cannot possibly compare NATOs interventions to Russias invasions. It requires both a deliberate ignorance of the scale and to deliberately ignore the history of Russian genocide in Ukraine.  Dont deliberately ignore the history of Russian genocide in Ukraine.', 'If you don’t support Israel, you ain’t black!', 'Bernie Sanders is approximately as Jewish as a ham sandwich topped with shrimp on lard bread x.com/OstrovA/statu…', 'Absolutely not! The ADL represents Jews in the same way that Fortune 500 CEOs represent men. It’s a tiny substratum that in no way represents the entire group.', 'To my Jewish followers do you think the ADlL represents you and the Jewish people?   Lets keep this debate civil', 'If you were on a mission to create more antisemitism in this country, you couldn’t do a better job than the ADL.', 'Isn’t it crazy that almost no one in the political or media class talk about radical Islamic terrorism anymore. There’s no concern about it, and yet every emergency power that the government took in the name of terrorism, DHL, TSA, Patriot act, is just part of America now.', 'You cannot possibly compare NATOs interventions to Russias invasions. It requires both a deliberate ignorance of the scale and to deliberately ignore the history of Russian genocide in Ukraine.  Dont deliberately ignore the history of Russian genocide in Ukraine.']","[2577, 8286, 5401, 1809, 1015, 3086, 788, 2577, 8284, 2946]","[228, 1572, 949, 112, 72, 380, 65, 228, 1572, 450]","['Live Israel/Palestine debate starting right now', 'For the amount of times it’s been demanded that I condemn this kid and having never done it, you’d think if he were going to come out and criticize me, he would at least have something to say other than “look at this guy believing in freedom while being Jewish.”  For the record,', 'So now we’re all going to pretend that Dave Smith is THE redpilled guy and not a libertarian Jew who is willing to talk about neocons and deflect accusations of antisemitism?  I like him but let’s be honest.', 'Is there a dumber or more pathetically dishonest argument than @RabbiBarclay ‘s here?  What the hell does “self hating” even mean? I don’t hate myself. I’m awesome.  Jews are a people. Israel is a government. I can believe that what Israel is doing, and has done, to the', 'I don’t think there’s anything secret about it. Anyone can read “A clean break’ A major contributing factor to the neocons desire to remove Saddam was Israeli interests. And they were openly supportive of the war. Of course, that doesn’t absolve anyone.  My point is more that', 'I’m sorry but it is just incredibly dishonest for @bungarsargon to claim that @cenkuygur and I said anything that resembles what Israel is doing is what ought to be the response to 10/7. Anyone who watched the debate knows this is BS. I’m disappointed in her, @wethefifth', 'Picking and choosing quotes to serve your opinion. Yitzhak Rabin, who was the IDF Cied of Staff, didnt function most of the 6 Day War because he was in deep depression because he thought that would be the end of Israel. Dayan had to step in.', '@ComicDaveSmith, the reason Jewish people call you a self-hating Jew is because youre completely quite on the ""protests"" on college campuses that are straight up calling for ""more Oct 7th 10,000 times"", &""Go home to Poland Jew"".  Youre vocal on many things, why quite on this?', 'Because Israelis have built a home there for generations. Both the PLO and even Hamas have accepted those terms at different points and it just seems like the best, most reasonable compromise.', 'As the Israeli assault on Gaza becomes even more transparently indefensible, I’d like to take on the three main “justifications” that I get the most.  1) They have to finish the job! Hamas must be defeated!  The obvious moral hypocrisy of believing that you are justified in', 'It’s pretty amazing. I’ve spent the last week talking about the conditions that led to the Hamas terrorist attack, mainly Israel’s occupation and Israel’s support of Hamas. I’ve been speaking out against the current war, where over a million children’s lives hang in the balance.', 'The Hamas attack on Israel was horrific, criminal and so stupid. It guarantees further suffering for their own people.  The problem in America is that most people have a simplistic view of the situation that is completely removed from reality. They assume normal relations and', 'I see a lot of critics of Israel, who I respect very much, celebrating the ICJ ruling. It seems to me that they totally bitched out. They could have ordered an immediate ceasefire and instead they told Israel to make sure they don’t do anymore genocide and that they have a', 'Obviously the story of the day is Biden’s monumentally disastrous performance, and it should be, but can we take a moment to appreciate how unbelievably awful and cowardly Trump’s take on Israel was?  Seriously? Joe Biden, the life long Zionist who is currently funding the', 'I have admired many aspects of RFK’s campaign. His opposition to Covid tyranny, vax mandates, the Ukraine war and the deep state have been nothing short of heroic.   However, his support for the war in Gaza is disqualifying. We are THE antiwar, non-interventionist party and', 'Is there a dumber or more pathetically dishonest argument than @RabbiBarclay ‘s here?  What the hell does “self hating” even mean? I don’t hate myself. I’m awesome.  Jews are a people. Israel is a government. I can believe that what Israel is doing, and has done, to the', 'If anyone spoke this way about Israeli children as they were being slaughtered what would your reaction be?', 'One of the quickest IQ tests on Twitter is when you make a logical analogy and someone responds with “those two situations aren’t exactly the same!”  Also, this guy just compared Hamas to the Nazis. See “DIFFERENT” is ok when you’re justifying the mass slaughter of babies.', 'Oh my god! Right after rigging the 2016 election, installing Trump, creating the Hunter Biden lap top, and blowing up the Nord stream pipeline, Putin ordered Hamas to invade Israel. It all makes perfect sense!', 'Consider the possibility that Putin conspired with Hamas to create the distraction.', 'Seriously? No, not at all. Sabotaging the peace process and then propping up a terrorist organization so that you never have to resume that process is not “funding to become independent” it’s the opposite. And no, they do not share any similarities.', 'Whats the difference between a ""poison pill"" as described here and giving Gaza funding to become independent while expecting they will fail? Dont they look and sound the same?']","[510, 5891, 3825, 329, 2045, 339, 412, 1780, 339, 7861, 3947, 9217, 829, 6540, 4907, 243, 9284, 1166, 510, 267, 240, 2285]","[54, 287, 421, 33, 130, 19, 30, 175, 19, 1755, 294, 1314, 84, 738, 483, 4, 1395, 90, 25, 4, 10, 227]"
jimmy_dore,Other,628500,"['The U.S. is doing what it always does, terrorize the world for corporate profits.   Here Seymour Hersh explains EXACTLY how the United States blew up The Nord Stream pipeline so US companies could sell more Natural Gas to Europe.    Were The Terrorists.  …', 'Videos like this make me forget he helped crush the railroad workers right to organize & strike, then abandoned the people of East Palestine while downplaying the disaster. Great video!', 'The U.S. is doing what it always does, terrorize the world for corporate profits.   Here Seymour Hersh explains EXACTLY how the United States blew up The Nord Stream pipeline so US companies could sell more Natural Gas to Europe.    Were The Terrorists.  …']","[5239, 2648, 5237]","[1465, 487, 1465]","['This is AMAZING. Watch as Trumps says it is not the Palestinians blocking peace, but   Netanyahu that doesnt want to make a  deal  & is BLOCKING A PEACE DEAL.   This confirms everyones suspicions that Netanyahus plan all along was to wipe out the Palestinians, move those that', 'The JIMMY DORE SHOW Is Live! NOW!  Israel Targeted & Killed Its Own Civilians on Oct 7! French Left Scores BIG Electoral Victory!  Featuring: Max Blumenthal @MaxBlumenthal Stef Zamorano @miserablelib  Now streaming on Rumble, YouTube & Rokfin …', 'It’s been like this since 1948, but modern day Zionists are such depraved blood thirsty maniacs that even Americans are waking up:', 'The JIMMY DORE SHOW Is Live! NOW!  Israel’s Brutal Response On Gaza! MORE Covid Censorship!  Featuring Dr. Peter McCullough @PMcCulloughMD, Jackson Hinkle @jacksonhinklle,  Kurt Metzger @KurtMetzger & Stef Zamorano @MiserableLib  EXCLUSIVELY ON RUMBLE!  …', 'The JIMMY DORE SHOW Is Live! NOW!  Hamas Stages Brazen Attack Inside Israel!  Netanyahu Declares War on Gaza!   Featuring Norman Finkelstein @normfinkelstein, Kurt Metzger @KurtMetzger & Mischa Paullin @mickmackpaullin  Now streaming on Rumble, YouTube & Rokfin!', 'Of COURSE! They hypocrisy of the Pro Ukraine Nazis and the Pro Israel crowd is astounding.', 'What would be weird is if \xa0you weren’t being paid to support genocide & slaughter of your enemies children. You doing that for free are you? Bravo.', 'Is Hamas paying you now?', 'This is AMAZING. Watch as Trumps says it is not the Palestinians blocking peace, but   Netanyahu that doesnt want to make a  deal  & is BLOCKING A PEACE DEAL.   This confirms everyones suspicions that Netanyahus plan all along was to wipe out the Palestinians, move those that', 'The JIMMY DORE SHOW Is Live! NOW!  Israel’s Brutal Response On Gaza! MORE Covid Censorship!  Featuring Dr. Peter McCullough @PMcCulloughMD, Jackson Hinkle @jacksonhinklle,  Kurt Metzger @KurtMetzger & Stef Zamorano @MiserableLib  EXCLUSIVELY ON RUMBLE!  …', 'It’s been like this since 1948, but modern day Zionists are such depraved blood thirsty maniacs that even Americans are waking up:', 'Here’s how Israel deals with Jews in Israel protesting against the Israel government.', 'The JIMMY DORE SHOW Is Live! NOW!  Hamas Stages Brazen Attack Inside Israel!  Netanyahu Declares War on Gaza!   Featuring Norman Finkelstein @normfinkelstein, Kurt Metzger @KurtMetzger & Mischa Paullin @mickmackpaullin  Now streaming on Rumble, YouTube & Rokfin!']","[8554, 312, 1062, 224, 232, 541, 346, 215, 8504, 225, 1056, 4281, 233]","[2987, 92, 300, 46, 65, 116, 28, 20, 2964, 47, 296, 1647, 67]"
ProudSocialist,Other,361300,"['Jimmy Dore calling out @RobertKennedyJr on his refusal to stand up to Israel:  “Why is it that you can stand up to the military industrial complex, you can stand up to Big Pharma, you can stand up to your own party, but you cant stand up to Israel?""', 'Jimmy Dore calling out @RobertKennedyJr on his refusal to stand up to Israel:  “Why is it that you can stand up to the military industrial complex, you can stand up to Big Pharma, you can stand up to your own party, but you cant stand up to Israel?""']","[939, 939]","[230, 231]","['You cannot occupy, colonize, and steal people’s land and then expect peace.  You kill peace the moment you subjugate an entire group of people.  Conversely, you create peace when all people are liberated and free.  #Israel #FreePalestine #EndApartheid']",[6880],[2353]
SocialistMMA,Other,143800,"['Good. Israel should not exist. Get rekt Zionists', 'Over 160 Palestinians killed by Israeli forces this year alone meanwhile the Nazi supporting west is silent', 'Pramila Jayapal apologizes after telling the truth about Israel  If you don’t have the guts to stand up to the media and the Israeli lobby then stfu.   I’m tired of these progressive affirming Zionist nonsense by apologizing', 'Ilhan Omar and the squad made her ousting on committees about racist Republicans and identity politics to avoid the conversation about how her party is bought by Israel and threw her under the bus', 'Over 160 Palestinians killed by Israeli forces this year alone meanwhile the Nazi supporting west is silent', 'Good. Israel should not exist. Get rekt Zionists']","[404, 854, 459, 795, 404, 463]","[64, 285, 125, 165, 63, 127]","['Israel commits crime of the century as they slaughter Palestinians in Rafah  Zionism is currently the most barbaric ideology in the world', 'Israeli settlers are attacking and lynching Palestinians in the West Bank   Every single adult Israeli is a willing agent and tool of colonialism', 'Violent Israeli settlers were committing so many terrorist acts on Palestinians in the west bank that the United States is revoking their visas   Everything Zionists accuse Palestinians of is pure projection. Israeli settlers are terrorists', 'Israel announces war crimes and atrocities are planned for Gaza  Critical support for the Palestinians  #FreePalestine', 'Weird how the media pretended Hamas targeted civilians on Oct 7th, but now it comes out all their victims where military personnel while the IDF killed Israeli civilians', 'What the corporate media and their shills will never tell you   Hamas is NOT the terrorist group in this conflict  Israel is the party that has been out of compliance under International Law for YEARS  They are only protected by the United States veto power.   Palestinians', '“The United States is controlling the war in Gaza, and it is the United States that must pay the price for the crimes perpetrated by the Israelis in Gaza and by the Americans in Iraq and elsewhere.”  Address by Hezbollah Chief Nasrallah that was viewed by millions around the', 'Netanyahu is getting peace loving Jewish people arrested for protesting the war crimes he was found guilty committing by the ICC  Another example of how Zionism is the height of antisemitism   Zionism makes Jewish people LESS SAFE', 'Jews in the United States getting arrested on behalf of Israels Netanyahu', 'Israel commits crime of the century as they slaughter Palestinians in Rafah  Zionism is currently the most barbaric ideology in the world', 'Israel announces war crimes and atrocities are planned for Gaza  Critical support for the Palestinians  #FreePalestine', '“The United States is controlling the war in Gaza, and it is the United States that must pay the price for the crimes perpetrated by the Israelis in Gaza and by the Americans in Iraq and elsewhere.”  Address by Hezbollah Chief Nasrallah that was viewed by millions around the', 'Hamas has utterly defeated Israel. Israel getting buried on the battlefield AND diplomatically', 'Ireland, Norway and Spain announce they are officially recognizing Palestine as an independent state.', 'Israel commits crime of the century as they slaughter Palestinians in Rafah  Zionism is currently the most barbaric ideology in the world', 'Israel announces war crimes and atrocities are planned for Gaza  Critical support for the Palestinians  #FreePalestine', 'SHOCKING POLL: Majority of White Evangelical Christians and Jewish Americans support a ceasefire   Israel has completely lost the propaganda war', 'Violent Israeli settlers were committing so many terrorist acts on Palestinians in the west bank that the United States is revoking their visas   Everything Zionists accuse Palestinians of is pure projection. Israeli settlers are terrorists', 'Bombshell UN report exposes how Israel uses sexual violence as a tool of war against Palestinian women and children   Everything Israel accuses Hamas of is pure projection. Israel are the terrorists, not Hamas', 'United States weapons were used during Israel’s massacre in Rafah   It’s a crime against humanity that the ICC hasn’t issued an arrest warrant for Joe Biden and Antony Blinken', 'Weird how the media pretended Hamas targeted civilians on Oct 7th, but now it comes out all their victims where military personnel while the IDF killed Israeli civilians']","[511, 332, 393, 677, 357, 1315, 242, 4085, 513, 677, 278, 243, 221, 279, 508, 675, 728, 391, 635, 724, 355]","[235, 149, 159, 261, 125, 518, 65, 2035, 235, 263, 118, 66, 47, 104, 233, 262, 318, 158, 361, 345, 124]"
Jaybefaunt,Republican Party,54500,"['Im sorry but the Democrats you voted for are the reason for the Crime Bill.  The Dems You voted for are the reason for the funding for more cops.  The Dems you voted for are funding the Palestinian genocide. The GOP doesnt care and funded it, too. None of them care.', 'Im sorry but the Democrats you voted for are the reason for the Crime Bill.  The Dems You voted for are the reason for the funding for more cops.  The Dems you voted for are funding the Palestinian genocide. The GOP doesnt care and funded it, too. None of them care.', 'Im sorry but the Democrats you voted for are the reason for the Crime Bill.  The Dems You voted for are the reason for the funding for more cops.  The Dems you voted for are funding the Palestinian genocide. The GOP doesnt care and funded it, too. None of them care.']","[225, 540, 225]","[73, 126, 73]","['All Out for Palestine Rally in Orlando Florida! #FreePalestine', 'If I say that I want to be like Nelson Mandela, Malcolm X and Kwamé Turé; many people will applaud me for it. But if I take their same stance on Palestine, then Im demonized for it. Make it make sense.', 'I not only condemn Israel.  I condemn the UNITED STATES.', '""Donald Trump would genocide even worse""  Tell that to the dead people in Rafah today.   Biden and Trump would take identical genocidal actions.', 'Whelp.  Looks like some friends on Facebook are not liking my position on supporting Palestine. I may lose more friends today because I dont want more Palestinians to die. Its wild because weve been friends for years. Its sad, honestly.', 'Bro, its literally happening on TikTok. Black Americans and Palestinians are now fighting with each other which is what the corporate parasites and Zionists want. They want us to fight each other instead of fighting FOR liberation. Its sad to see, TBH.', 'They want Netanyahu to resign. Interesting', 'Thousands of demonstrators in Tel Aviv are demanding Netanyahus resignation.', 'Watch them lie in 20 years about how they ""had no idea"" they were supporting genocide.', 'Forget Russiagate.  Israel is actually meddling in our elections/politicians to fund a genocide.', 'AIPAC is planning on spending $100 million dollars in order to meddle in our elections   Everything Democrats claimed Russia was doing meddling with our elections is actually true of Israel', 'Supporting genocide & illegal occupation is not progressive no matter how you spin it. Attempting to Both sides an extermination shows how youre either 1. Ignorant of the history & nuance of whats going on or 2. Purposefully trying to ride the fence to avoid angering Zionists', '""The governments may be with Israel but the streets are with Palestine""- @tex', 'Just a small sampling of ppl flooding Washington DC in largest #FreePalestine march in U.S. history', 'To all the people going to free Palestine marches and rallies this weekend.  Please stay safe, ignore the Zionists and make as much noise as you can. Network! Get to know others and build connections to help your community. Talk about the link between Zionism and capitalism.', 'ATTENTION: The narrative that we have seen from  is that crimes were committed by  and it all started on October 7th. Heres proof that it started LONG before that day, narrated by Benjamin Netanyahu and Michael Rapaport. Share this with everyone willing to listen to see the', 'This should be abundantly clear: HAMAS WOULDNT EXIST IF IT WERENT FOR THE ILLEGAL OCCUPATION OF PALESTINE  If you want to get rid of Hamas, end the ILLEGAL occupation.', 'Everyone is talking about a ceasefire which is a step in the right direction.  But what we NEED to talk about is a cease-OCCUPATION. Also.  Israel now owes reparations to Palestinians for their crimes against them. Palestine has the right to defend itself and RESIST occupation!', 'If Israel didnt commit genocide then let the process in the ICJ prove it.  Why yall so defensive?', 'Are you willing to condemn Israel for the deaths of over 7000 innocent people, including hundreds  of babies?', 'His death certificate was issued before his birth. His name is Uday Abu Mohsen, he is only one day old. #Gaza', 'Everyone is talking about a ceasefire which is a step in the right direction.  But what we NEED to talk about is a cease-OCCUPATION. Also.  Israel now owes reparations to Palestinians for their crimes against them. Palestine has the right to defend itself and RESIST occupation!', 'ATTENTION: The narrative that we have seen from  is that crimes were committed by  and it all started on October 7th. Heres proof that it started LONG before that day, narrated by Benjamin Netanyahu and Michael Rapaport. Share this with everyone willing to listen to see the', 'A ceasefire is not good enough.  They deserve the right to return and reclaim their land.', 'It has officially been 76 years that this illegal occupation happened. Today is the anniversary of the ""Nakba"". We cannot allow this genocide to continue to year 77.']","[255, 412, 3835, 232, 1584, 274, 346, 796, 272, 1069, 544, 312, 249, 275, 515, 753, 327, 515, 289, 515, 248, 310, 750, 32089, 297]","[77, 87, 842, 83, 205, 35, 81, 52, 114, 345, 29, 95, 73, 126, 198, 559, 88, 198, 77, 197, 73, 94, 557, 9576, 119]"
BernardKerik,Republican Party,328900,"['#NeverForget #NeverForgive   No plea deals for 9/11 terrorists!', '#NeverForget #NeverForgive   No plea deals for 9/11 terrorists!', '#NeverForget #NeverForgive   No plea deals for 9/11 terrorists!']","[1014, 1011, 1015]","[262, 263, 262]","['Federal hate crime, and terroristic threats! Start locking them up!', 'Philadelphia, PA - four masked men walked into Cafe Ole (Huntingdon) and proceeded to tear off the Israeli flag, while yelling “Free Palestine” as they left.   Police are investigating.', 'Homes and businesses in France being are marked for Jewish occupants.  We are witnessing a modern day holocaust, and unfortunately, the enemies of Israel and Jews around the world, have saturated western communities, while our FBI and DOJ were targeting PTAs and churches.', '#Hamas is the new #ISIS and should be treated as such.', 'Iran, and the Iraqi militia Al-Hashd al-Shabbi proclaims they are with the Hamas terrorists!  Our CIA/DOJ/FBI better be working overtime here at home because the chameleon radical Muslims already in the United States, are planning their next moves.', 'I love how state leaders in the Arab region are calling for restraint, and refuse to denounce the initial attacks on Israel.  Having lived and worked in the Middle East for more than 10 years, I can promise you, if the tables were reversed, and it was them, there would be hell to', 'Homes and businesses in France being are marked for Jewish occupants.  We are witnessing a modern day holocaust, and unfortunately, the enemies of Israel and Jews around the world, have saturated western communities, while our FBI and DOJ were targeting PTAs and churches.', 'Iran, and the Iraqi militia Al-Hashd al-Shabbi proclaims they are with the Hamas terrorists!  Our CIA/DOJ/FBI better be working overtime here at home because the chameleon radical Muslims already in the United States, are planning their next moves.', '#Hamas is the new #ISIS and should be treated as such.', 'I love how state leaders in the Arab region are calling for restraint, and refuse to denounce the initial attacks on Israel.  Having lived and worked in the Middle East for more than 10 years, I can promise you, if the tables were reversed, and it was them, there would be hell to']","[279, 2489, 212, 204, 896, 296, 212, 895, 203, 296]","[80, 1393, 150, 51, 429, 76, 151, 426, 51, 76]"
