Poster,Date,Tweet,No of Likes,No of Retweets,No of Replies,No of Views
justinamash,"February 13, 2024 07:46 PM",Then Israel can plan and conduct their military operations without our money and assistance. You can’t have it both ways.,12326,2332,416,1617367
LPNational,"January 30, 2024 03:07 AM","War with Iran is unacceptable. Neocons always drench the world in blood, while destroying your money and violating your civil liberties in the process. They can never be trusted.",1129,214,59,29795
LPNational,"December 24, 2023 02:38 PM","What became known as the Christmas Truce showed that, given the choice, people do not want to kill each other. It was a heartwarming occasion for the soldiers, but the governments of both sides feared what this meant for their war propaganda.",227,25,3,7817
LPNational,"December 13, 2023 03:34 PM","Follow the federal money trail in the new $886 billion NDAA bill, and youll find Congress represents Ukraine, Israel, the military industrial complex, the surveillance state, and the banks.  Not regular Americans, who are struggling to make ends meet.",825,243,17,24815
LPNational,"December 24, 2023 02:38 PM","Even today, war-makers in every country demand total dehumanization of the enemy. This is why we must remain focused on dispelling the lies of the war machine.  As Ludwig von Mises taught us just 8 years after the Christmas Truce, ""Peace and not war is the father of all things.""",231,25,8,7332
LPNational,"October 26, 2023 01:48 PM","If you opposed the Patriot Act and invasion of Iraq, they called you anti-American.  If you opposed the lockdowns and vaccine mandates, they called you antiscience.  If you oppose endless funding for Israel, they call you antisemitic.  Ignore their lies and preserve your liberty.",1876,456,40,50370
LPNational,"June 19, 2024 10:10 PM","The military-industrial complex thrives on perpetual war and fear.   Endless conflicts and interventions arent about national security; theyre about profit and power.   The state uses patriotism to mask its true intentions, sacrificing lives and liberties for the benefit of a",264,85,16,10793
LPNational,"October 13, 2023 10:26 PM",Ukraine is not the 51st state.  Taiwan is not the 51st state.  Israel is not the 51st state.  Not one cent should be sent overseas while you struggle to make ends meet in America.,4087,811,190,120015
LPNational,"February 27, 2024 09:10 PM",The US war regime intends for Ukraine to serve the purpose that Afghanistan once did—as the excuse for a long-term money laundering scheme for the banks and military industrial complex.   Thats why $173 billion has been spent there without realistic goals or significant,561,125,38,25534
LPNational,"January 17, 2024 06:03 PM","Today in Davos, Javier Milei told a bunch of WEF elites that socialist schemes arent the solution to societys problems—but instead their root cause. Hes exactly right.",3897,719,94,126619
LPNational,"October 27, 2023 06:14 PM",The neocons and military industrial complex wanted war with Iran in 2001. None of us should be surprised by the new ploy to drag Americans into such a conflict.,312,95,13,18170
LPNational,"November 10, 2023 10:36 PM","America needs a peace President.  The Libertarian Party is dedicated to peace. Actual peace. Not the kind cloaked in the grandiloquence of political doublespeak, nor the fleeting mirage conjured up by the ephemeral gestures of international diplomacy. We are speaking of a peace",818,176,68,108357
LPNational,"December 15, 2023 03:45 PM","This video is from 2019, and our rulers have made the suicide mission more obvious since then. We can only change course by ending their criminal institutions, nullifying their schemes at the local level, and embracing liberty.",615,161,29,23838

|RUN STATISTICS|
"Time Processed: September 25, 2024 07:58 PM",Number of discards: 3,"List of accounts processed: ['RevBlackNetwork', 'TheDemocrats', 'FoxNews', 'politico', 'joncoopertweets', 'LPMisesCaucus', 'RealSpikeCohen', 'YATPOfficial', 'justinamash', 'LPNational']","List of accounts coming in: ['RevBlackNetwork', 'TheDemocrats', 'msnbc', 'FoxNews', 'TheAtlantic', 'aldotcom', 'JudiciaryGOP', 'MSNBC', 'NBCNews', 'politico', 'joncoopertweets', 'HomelandDems', 'HouseJudiciary', 'NPR', 'CNN', 'LPMisesCaucus', 'RealSpikeCohen', 'YATPOfficial', 'justinamash', 'LPNational', 'theintercept']","List of accounts needed to be rerun: ['TheAtlantic', 'HouseJudiciary', 'NPR', 'LPNational', 'theintercept']","List of accounts with parsed but only irrelevant tweets: ['msnbc', 'aldotcom', 'JudiciaryGOP', 'MSNBC', 'NBCNews', 'HomelandDems', 'CNN']"
