Poster,Date,Tweet,No of Likes,No of Retweets,No of Replies,No of Views
charliekirk11,"November 17, 2023 02:11 AM","70 percent of Gazans say that peaceful coexistence with Israel is unacceptable; only genocide and destruction of Israel, “from the river to the sea,” is enough.  This, more than anything else, is why the war in Gaza happened.",3966,1302,566,198577
charliekirk11,"May 06, 2024 04:58 PM","BREAKING: According to AP, Hamas has told Qatar and Egyptian mediators that it will accept terms of a ceasefire and prisoner swap with Israel. This comes as Israel was preparing a ground siege on Rafah, the last Hamas stronghold in Gaza.",1728,356,425,236879
charliekirk11,"October 18, 2023 06:33 PM","Yayha Sinwar, the head of Hamas in Gaza, took time out of an interview to pander to the left over “the racist murder of George Floyd.”  A week ago I was ridiculed for linking the poisonous ideologies of Hamas and BLM. But at heart they are the same hateful ideologies. Both rely",848,277,116,108328
charliekirk11,"October 19, 2023 03:01 PM","Son of Hamas leader, Mosab Hassan Yousef, denounced Hamas and converted to Christianity after witnessing their savagery:   ""They dont care for the Palestinian people. They dont regard human life. I saw their brutality firsthand If they succeed in destroying Israel and",27250,10440,1179,2560815
TuckerCarlson,"April 09, 2024 08:46 PM","Ep. 91  How does the government of Israel treat Christians? In the West, Christian leaders don’t seem interested in knowing the answer. They should be. Here’s the view of a pastor from Bethlehem.",83854,29830,10882,19330710
AnnCoulter,"January 05, 2024 04:35 PM","I dont like Ramaswamys conspiracy theories, but none of them hold a candle to Nikki Haleys claim that Hamas attacked Israel on Oct 7 because its Putins birthday.    #WarmongerMadness",480,64,85,45592
AnnCoulter,"January 26, 2024 03:09 PM",Nikki Haley explains the Hamas attack on Israel:   “I told you about that brutality on Oct. 7 in Israel. Right? Oct. 7 is Putin’s birthday.”  This is the nitwit the donors are trying to foist on us.,304,61,38,25643
AnnCoulter,"November 27, 2023 01:47 AM","<<Contrast Douglas Murray’s (correct) claim that in all the footage of the Oct. 7 massacres, the one thing you don’t see is a single Pali saying, “Wait, hold up, we’re going too far; we’re soldiers, not rapists,” to Himmler bitching to his SS officers at Posen that average",304,48,11,91273
AnnCoulter,"January 31, 2024 07:05 PM","NEW COLUMN!  The Fall of Rome, Updated  Americans killed by Islamic terrorists in Islamic lands so far this year: 3.  Americans killed by third-worlders who entered our country illegally so far this year: 150.",845,281,63,46496
AnnCoulter,"January 31, 2024 11:30 PM","Well, I know how to recognize a future Palestinian state. Itll be the one lobbing rockets across the border at Israeli civilians.",346,69,62,28092
LaraLeaTrump,"September 04, 2024 12:00 AM",".@DailyCallers @MaryRooke and the @FDRLSTs @BriannaLyman2 join me to discuss Joe and Kamala failing hostages in Israel, Kamala ducking the media, and MUCH MORE #TheRightView",494,112,227,69770
PatTheSocialist,"December 26, 2023 09:36 PM",Human Rights watch has determined that Israel is intentionally destroying the food supply of Gaza. Add it to the list of war crimes.  This is genocide.,1635,798,34,26581
PatTheSocialist,"July 19, 2024 05:03 PM",The US must immediately pull all funding of Israel and demand a ceasfire,478,163,3,7863
PatTheSocialist,"November 10, 2023 07:34 PM","The Israeli government, and anyone supporting or enabling them, are clearly the bad guys. War crime after war crime.",904,268,97,12294
PatTheSocialist,"January 21, 2024 05:58 PM","Over 30,000 people dead  Over 12,000 children killed  115 journalists murdered  Almost 2 million displaced  Over 200 healthcare facilities destroyed  This is genocide  Joe Biden and the Democratic Party own this",633,378,31,17619
PatTheSocialist,"July 27, 2024 05:42 AM","Kamala just said shell keep supplying weapons to Israel, so maybe think more critically than trusting her call for a ceasfire. You know who else is calling for a ceasefire? Biden.",1945,572,40,29112
PatTheSocialist,"December 05, 2023 05:20 PM","Its not genocide, or ethnic cleansing, its just ""thinning out"" Gazans.  This is what Biden supports",206,70,9,4042
TristanSnell,"July 28, 2024 12:57 AM",Donald Trump held a SUMMIT with Israeli Prime Minister Netanyahu.  As a private citizen. At Mar-a-Lago.   The Logan Act is a federal law forbidding private citizens from negotiating with foreign governments.  TRUMP IS BREAKING THE LAW — YET AGAIN,103575,31150,9371,3835963
TristanSnell,"September 11, 2024 02:01 AM",Why is there not a cease fire in the Israel-Palestine war?  The #1 reason right now is because DONALD TRUMP has illegally lobbied Israeli prime minister Benjamin Netanyahu to refuse a cease fire because it would help Harris -- in blatant violation of the Logan Act.  THATS why.,6663,3114,137,78963
TristanSnell,"August 21, 2024 03:07 AM",Donald Trump should be INDICTED — AGAIN.  PBS now reports Trump told Israeli Prime Minster Netanyahu to NOT agree to a cease fire because it would help Kamala Harris.  This is a violation of the Logan Act and should be investigated and prosecuted to the fullest extent of the law.,63001,18319,3029,958034
TristanSnell,"August 28, 2024 06:56 PM",Donald Trumps crime spree continues:  - Logan Act - pressuring Netanyahu to kill cease fire - RFK Jr. - promising job in exchange for endorsement - Logan Act - discussions with Putin on invading Ukraine - Holding campaign event at Arlington National Cemetery,21941,9529,1194,332214
TristanSnell,"July 12, 2024 05:21 PM","BREAKING -- Joe Biden announces CEASEFIRE framework, with release of hostages, and with both Israel and Hamas in agreement.  Culmination of months of work by Biden and the State Department.  But sure, go ahead and tell me how Biden has declined and should quit the race.",25408,8034,1348,390848
TristanSnell,"June 27, 2024 11:36 PM","BREAKING -- US and Israel will provide Patriot air defense systems to Ukraine, per a new deal that is near completion  This would TRIPLE the Ukrainian air defense and allow Ukraine to fully protect its major cities and strategic sites from Russian missiles  MASSIVE loss for Putin",1923,650,58,36648
KyleClark,"November 04, 2023 02:43 AM","GOP State Rep Scott Bottoms, who said Jewish hostages held by Hamas needed to find Jesus, now says theres no such thing as the Palestinian people, theyre all just terrorists. #coleg #copolitics",252,89,63,39730
BobMurphyEcon,"September 29, 2024 01:54 AM","Its exchanges like this (of which Ive seen many) that make @ComicDaveSmith call the pro-Israel conservatives the ""woke Right."" People will object to the killing of civilians, and the pro-Israel people will say ""But terrorists are bad!"" It would be like opposing coercive",790,82,63,49629
BobMurphyEcon,"October 09, 2023 09:26 PM","I am making a simple observation here. Im not ""picking sides"" except for the side of ""Killing innocent people is always wrong.""  The people responsible for the attack on Israel want the response to be ""over the top."" They want the propaganda to then turn public opinion and",565,80,59,47164
BobMurphyEcon,"November 13, 2023 06:06 AM","I get it; its funny. But not only did God not kill kids Cain hid behind, and not only did God not even kill Cain, but He actually placed a mark on him so that nobody ELSE would kill him.  I.e. God agreed to a ceasefire after this crime.",208,20,19,11877
BobMurphyEcon,"November 12, 2023 07:40 PM",Cain Calls For Ceasefire After Killing Abel,1070,181,123,92448
BarbMcQuade,"October 03, 2024 12:27 PM",Happy new year to our Jewish friends and neighbors. Wishing for peace.,746,52,12,18307
BarbMcQuade,"December 07, 2023 11:23 PM",Happy Hanukkah to all of our Jewish friends and neighbors. Wishing you hope and light.,1728,110,15,34741
BarbMcQuade,"April 22, 2024 11:25 PM",Wishing peace to all of our Jewish friends and neighbors. Chag sameach. #Passover2024,681,60,14,24966
natsechobbyist,"October 10, 2023 11:39 PM",The Israeli government put out this warning as did a friend of mine in Israel who is a mental health professional. This is very good advice. …,2340,540,39,154415
natsechobbyist,"November 04, 2023 09:02 PM","""You see, when we say kill all Jews its aspirational. We dont actually mean it. unless its possible and then, of course, wed be all over it.""     Words have meaning. This mealy-mouthed bullshit excuse is pathetic. You know exactly what you are doing.",4235,683,747,401663
anthonyzenkus,"December 01, 2023 08:14 PM",Israel has resumed its genocidal attacks on the people of Gaza. Children are suffering the most as Israels forces bomb close to the largest functioning hospital left standing in Gaza. Biden is complicit. It is time to #StopArmingIsrael.   (report from UN - UNICEF spokesperson),791,538,57,53756
anthonyzenkus,"August 28, 2024 10:50 AM","Israel is increasing its attacks in the West Bank, an area not run by Hamas. The West Bank has no army and their citizens are defenseless. People are being forcibly removed from their homes, terrorized, arrested and shot. Bombs and bullets supplied by Kamala Harris and Joe Biden.",1008,733,52,30333
anthonyzenkus,"November 01, 2023 11:25 PM","After bombing the #Jabalia Refugee Camp yesterday killing hundreds, Israel bombed it again today as rescue workers tried to save those still alive buried in the rubble. The US is complicit in war crimes. Its time to force a #ceasefireNOW - Biden and Blinken must step down.",602,308,45,21158
anthonyzenkus,"January 17, 2024 07:35 AM","Latest Gaza Casualty Numbers Total dead: 24,285 Total wounded: Over 60 000 Total killed, injured or missing: 1/20 Palestinians  Gaza genocide: brought to you by Israel, sponsored by Joe Biden and the US War machine",252,150,34,7075
anthonyzenkus,"November 22, 2023 07:41 PM","UN expert: ""Gaza is complete and utter carnage"". He said its the worst thing hes ever seen. Israel is perpetrating the worst humanitarian crisis in modern times, aided and abetted by Joe Biden and the US government. No, a ""pause"" is not enough. We need a full #CeasefireNOW.",533,313,34,21801
anthonyzenkus,"August 18, 2024 08:28 PM","Its been 202 days since 6 year old Hind Rajab was murdered by Israeli forces firing 335 rounds into her familys car in Gaza City as she cowered on the phone with emergency services waiting for an ambulance that never came, surrounded by the bodies of her 6 dead relatives.   Her",593,348,22,9197
anthonyzenkus,"November 15, 2023 06:35 PM","""Our focus is on damage, not on precision"" - IDF Spokesperson  ""We will eliminate everything. They will regret it"". - Israeli Defense Minister Toav Gallant  ""We are now rolling out the Gaza Nakba"". - Israeli Minister of Agriculture  Collectjve punishment is a war crime.",587,365,29,12180
benshapiro,"August 21, 2024 12:49 AM",No shit. Thats what happens when Hamas rejects the ceasefire offer and asks Hezbollah to go hot.,3384,418,186,256009
benshapiro,"August 20, 2024 11:41 PM",Politico : Senior US officials say the ceasefire deal is on the verge of collapse.,14118,2052,1983,1732459
benshapiro,"October 11, 2023 02:52 AM",Agreed. This is precisely why Palestinian civilians in Gaza should listen to Israels warnings and leave target areas -- and it is also precisely why Hamas is telling them not to do so.,1064,234,102,157603
benshapiro,"August 15, 2024 01:51 PM","They said this BEFORE Israel took Rafah. They said this BEFORE Israel took the Philadelphia Corridor. They said this BEFORE Israel killed Deif, Haniyeh, and Shukr. So Id take their military opinions with a Dead Sea-worth of salt.",485,57,40,70260
benshapiro,"August 13, 2024 01:36 PM",Hamas does not have the capacity anymore for serious offensive action. But theyve roped Iran and Hezbollah into sympathy action that neither Iran nor Hezbollah can afford. Iran and Hezbollah are desperately attempting to get to a ceasefire offramp so they can claim that they,1966,226,117,296047
benshapiro,"August 13, 2024 01:14 PM",#BREAKING Hamas claims to have fired two rockets at Tel Aviv.  Residents report hearing explosions.,1064,234,102,157603
benshapiro,"July 23, 2024 12:29 PM","Remember, the obstacle to peace in the Middle East is very simple: Palestinian rejection of Israel, and heartfelt support for murderous terrorism. The supposedly ""moderate"" Palestinian Authority has now formed a unity government with HAMAS.",21490,2973,8702,2226858
briebriejoy,"December 07, 2023 10:10 PM","This Week in Hasbara (w/ @AbbyMartin)  ""We cant forget that the Jerusalem Post run by @AviMayer, whos essentially a stenographer for the IDF hes essentially a military propagandist running one of the biggest newspapers in Israel. They had the audacity to try to discredit &",1886,812,216,129980
briebriejoy,"January 25, 2024 07:20 PM","VIDEO PREMIERE: …  ""When Israel did this whole hunt for Hamas thing, while they were attacking hospitals, it was like: well, theyre just attacking the hospital because they said they were going to do that. They called them the day before Sort of",214,69,18,19487
briebriejoy,"November 07, 2023 10:25 PM","""What Hamas did was horrific, and they should answer for that. Now, at the same time, targeting innocent Palestinian citizens for something Hamas did is wrong. It is wrong. Turning off their electricity, taking away their water. 50% of people who live in Gaza are 15 years and",205,52,23,15122
briebriejoy,"April 10, 2024 08:52 PM","""The claim was that 0.002% of UNWRA had been involved in October 7th. So they defunded it. Now, more than 0.02% of the IDF has been committing war crimes way more than that. So, of course, if there were any consistency, theyd do something to the IDF. Theyd defund the IDF.",836,268,35,36386
briebriejoy,"June 17, 2024 04:01 PM","""The court said this must happen: You, Israel must stop your offensive in Rafah period. It has nothing to do with Hamas is doing, it has nothing to do with anybody else is doing. It has nothing to do with what Israel says or doesnt say anything the court made an or the UN",1267,482,101,44884
briebriejoy,"June 13, 2024 10:07 PM","The Ceasefire Shell Game (w/ @samhusseini)  Independent journalist Sam Husseini completely dismantles the state department narrative around the ceasefire negotiations, who’s at fault, & what the new UN report tells us about Israel’s use of rape, torture, & the Hannibal",1821,944,477,158310
fred_guttenberg,"November 01, 2023 11:20 AM","(1,3) To those who take the time to send me emails like this, there was a ceasefire until October 7th, when a terror group who also happened to be the governing entity of Gaza brutally attacked Israel killing over 1400, raping women, burning babies and wearing go pros to extend",261,48,22,18933
fred_guttenberg,"November 17, 2023 08:36 PM","What happened to all of the discussion of the hospital that Israel entered this week?  Now that they found & presented all of the evidence that Hamas was using it for terror, is the conversation just going to stop?  Perhaps time to acknowledge Israel was right.  Lets end terror.",1265,240,179,86833
fred_guttenberg,"October 13, 2023 02:12 PM","The Hamas terrorists chose to terrorize and kill.  They chose to use Gaza.  They chose to hide out amongst the citizens and public places.  Israel is doing everything that they can to avoid civilians, but they will be eliminating Hamas from Gaza.  Direct your anger now at Hamas.",2824,531,312,266140
fred_guttenberg,"March 03, 2024 02:07 PM","Reporting is that Israel agreed to a truce last night but just wants a list of living hostages.  which Hamas wont provide to go to Cairo to ink the deal.  Based on this reporting, Hamas is blocking ceasefire & truce, not Israel.",494,170,19,19843
fred_guttenberg,"October 13, 2023 10:53 AM","Please be vigilant.  Hamas is a terrorist group targeting all Jewish people.  Israel will finish them and Israel needs our support, but today is a day of caution for all Jewish people in the United States.",569,202,30,25345
LeeCamp,"December 18, 2023 05:39 PM",The debate over what is happening in Gaza right now is not a real debate. Israel has ADMITTED to a long list of atrocities & crimes. Here are some of them:,437,256,13,12842
LeeCamp,"March 02, 2024 07:33 PM","BREAKING — Today saw protests in Washington DC, NYC, Tokyo, Rochester, Pittsburgh, Havana, Cuba & many other cities around the world demanding an end to Israels war / conflict / genocide / ethnic cleansing — Whatever you want to call it.",802,433,33,21116
LeeCamp,"February 23, 2024 10:08 PM","BREAKING: The number of murdered & missing people in Gaza now tops 37,000. 70% are women & children. Yet Israel continues its genocidal attack.",1210,911,54,139647
LeeCamp,"February 29, 2024 03:50 PM",BREAKING: The IDF opened fire on innocent people in line for humanitarian aid trucks in Gaza City. They killed at least 100 in just the latest massacre.,732,422,47,29646
LeeCamp,"February 27, 2024 06:41 PM",BREAKING: Officials say famine & dehydration could kill thousands in Gaza in the coming days. (Al Jazeera) This is why Israel has done everything they can do destroy aid efforts.,284,179,21,6545
JordanChariton,"March 05, 2024 03:14 PM","UNREAL: Head of the Democratic Majority for Israel Super PAC—who spent millions to bring down Bernie Sanders, Nina Turner, etc—says young voters are fleeing Biden and protesting for Palestine because they have an ""unfamiliarity with the Holocaust.""   Its actually the opposite.",311,121,22,11972
JordanChariton,"April 22, 2024 01:36 PM","My take on corporate medias ""anti-semitic"" propaganda on Columbias Gaza student protests: Ive covered protests across America: BLM, anti-pipeline, climate, healthcare, etc. ALL had elements of individuals out of synch w/ the overall message & sentiment of the protest.",193,64,4,14613
JordanChariton,"April 24, 2024 05:38 PM","Contamination in East Palestine. “It pisses me off” -Jenna told me when I asked about EPA saying everything is fine here. “They’re lying.” For 8 years, I have repeatedly said that the reason I have continued covering the ONGOING #FlintWaterCrisis—which tomorrow marks 10 years…",1387,135,2,34257
JordanChariton,"April 24, 2024 05:26 PM","I know there’s a lot going on, but I want to remind folks what the govt & media are covering up—the latest sacrifice zone. Jenna is an 18 year old East Palestine OH resident. Before Norfolk Southern unnecessarily detonated toxic cancerous chemicals over EP, she was healthy….",10957,2984,39,546677
JordanChariton,"August 08, 2024 01:55 AM",The Yes Queen Dem sycophants will love this. But anyone who cares about an ongoing genocide should be disgusted by this.,560,113,19,8629
JordanChariton,"August 08, 2024 12:25 AM","Pro-Palestine protesters just disrupted Kamalas speech in Michigan.  Her response: ""If you want Donald Trump to win say that. Otherwise, I’m speaking.”",1387,135,2,34257
kylegriffin1,"July 27, 2024 02:00 PM",The U.K. government has reversed its opposition to the International Criminal Court seeking an arrest warrant against Israeli PM Benjamin Netanyahu.,4567,1088,76,181490
kylegriffin1,"August 22, 2024 03:45 PM","Trump ranted last night about Gov. Josh Shapiro — calling him ""the highly overrated Jewish Governor"" and claiming he has done ""nothing for Israel.""  In response, White House spokesman Herbie Ziskend says: ""It is Antisemitic, dangerous, and hurtful to attack a fellow American by",3419,781,53,173122
kylegriffin1,"July 25, 2024 11:30 PM","BREAKING. Vice President Harris on Israel-Gaza:  ""Israel has a right to defend itself, and how it does so matters.""  ""The images of dead children and desperate, hungry people fleeing for safety, sometimes displaced for the second, third or fourth time — we cannot look away in the",4101,993,65,202829
kylegriffin1,"May 08, 2024 10:25 PM","Breaking:  WASHINGTON (AP) — Biden says Im not supplying the weapons if Israel launches assault on Gazas Rafah, after US paused bomb shipment.",3955,739,123,192258
kylegriffin1,"August 23, 2024 03:10 AM","Vice President Harris: ""President Biden and I are working to end this war such that Israel is secure, the hostages are released, the suffering in Gaza ends, and the Palestinian people can realize their right to dignity. Security. Freedom. And self-determination.""",1720,331,34,85329
kylegriffin1,"September 28, 2024 08:20 AM","TEL AVIV, Israel (AP) - Israels military says Hezbollah leader Hassan Nasrallah was killed in Beirut strike.",519,126,37,65959
kylegriffin1,"August 21, 2024 11:55 PM","The United Center breaks out in chants of Bring Them Home as the parents of Hersh Goldberg-Polin, an American hostage held by Hamas, speak at the DNC.",1895,312,26,80210
elonmusk,"October 28, 2023 11:12 AM",Starlink will support connectivity to internationally recognized aid organizations in Gaza.   ComStar,162231,64463,11245,15048573
elonmusk,"April 28, 2024 03:42 AM","If you teach that “weak makes right”, then the perceived stronger party – in this case, Israel – is wrong.  Morals should be taught in the absolute, meaning that it is possible for either the strong or weak to be morally good, depending on their actions.",147384,25777,17861,25487492
elonmusk,"July 23, 2024 09:29 PM",Starlink is now active in a Gaza hospital with the support of @UAEmediaoffice and @Israel,259823,27744,18049,85718989
elonmusk,"October 08, 2023 04:23 PM","Khamenei’s official position is clear that the eradication of Israel is the actual goal, not just supporting Palestinians.  That will not happen. All that actually happens, decade after decade, is a never-ending cycle of violence and vengeance.  Stoking the fires of hatred isn’t",44030,10405,8327,6465200
bluestein,"November 01, 2023 04:19 PM",A large crowd gathered at Georgia Tech today to rally for Jewish students who feel threatened by recent campus demonstrations. Similar rallies are being held all over Georgia campuses now.,409,102,4,16687
bluestein,"May 19, 2024 02:59 PM","Biden’s speech ends after he speaks of the Israel-Hamas war in broad terms, saying the conflict is “heartbreaking” and that he’s working to bring it to an end. His address is well received by students, alumni and their families — who cheer as he’s given an honorary degree.",829,293,31,112125
bluestein,"October 10, 2023 11:34 PM","Thousands are gathering right now in Sandy Springs, Ga. in support of Israel after the Hamas terror attack over the weekend. I’ve seen more than a dozen lawmakers, city and state officials, and community leaders in the crowd. It’s one of the biggest pro-Israel rallies in the US.",896,176,31,116273
bluestein,"April 16, 2024 11:17 PM","At @KLoeffler’s Greater Georgia gala, @GovKemp says he talked to the head of the public safety department last night about pro-Palestinian protesters in other cities who blocked roads and bridges. His message: If they do that here, “lock their ass up.” #gapol",222,60,36,43873
bluestein,"July 30, 2024 08:34 PM",The VP briefly addressed the growing conflict in the Middle East after Israel retaliated for rocket attacks by targeting a Hezbollah commander.,262,44,16,22432
SarcasmStardust,"November 18, 2023 02:26 AM","Let’s start a thread of all the times high level Israeli officials, affiliates, and proxies have openly called for genocide. Drop em here",7886,3581,375,523848
SarcasmStardust,"October 11, 2023 01:37 AM",Israel wasn’t attacked. Israel isn’t real. The occupiers of Palestine were attacked.,578,144,56,13945
SarcasmStardust,"October 20, 2023 01:11 AM",Israel bombed homes. Israel bombed schools. Israel bombed hospitals. Israel bombed churches. Israel bombed evacuees. Israel bombed journalists. Israel bombed UN workers.  But they want you to believe Israel is “good” and Palestinians are “evil.”,383,177,11,19027
SarcasmStardust,"October 20, 2023 12:38 AM",Israel bombed homes. Israel bombed schools. Israel bombed hospitals. Israel bombed churches. Israel bombed evacuees. Israel bombed journalists. Israel bombed UN workers.  But they want you to believe Israel is “good” and Palestinians are “evil.” x.com/Kahlissee/stat…,709,194,38,11655
SarcasmStardust,"July 31, 2024 05:17 PM",Israel has targeted and murdered over 130 journalists in the past 9 months.   Fuck Israel. …,203,60,3,3327
SarcasmStardust,"December 16, 2023 03:36 PM",You don’t end Hamas by slaughtering a bunch of innocent people. That’s how you recruit for Hamas.,972,262,68,15417
SarcasmStardust,"October 07, 2023 03:50 PM",“But more people will die”  Palestinians BEEN dying. And that’s not going to stop. The fact that there are people who think they should just sit around and continue to take it blows my mind. There’s only one aggressor and occupier here. And it ain’t Palestine.,709,194,38,11655
SocialistMMA,"May 09, 2024 01:11 AM",Israel commits crime of the century as they slaughter Palestinians in Rafah  Zionism is currently the most barbaric ideology in the world,508,233,19,14566
SocialistMMA,"October 09, 2023 07:58 PM",Israel announces war crimes and atrocities are planned for Gaza  Critical support for the Palestinians  #FreePalestine,675,262,56,54072
SocialistMMA,"February 29, 2024 07:49 PM",SHOCKING POLL: Majority of White Evangelical Christians and Jewish Americans support a ceasefire   Israel has completely lost the propaganda war,728,318,36,23737
SocialistMMA,"December 05, 2023 10:32 PM",Violent Israeli settlers were committing so many terrorist acts on Palestinians in the west bank that the United States is revoking their visas   Everything Zionists accuse Palestinians of is pure projection. Israeli settlers are terrorists,391,158,15,9127
