Poster,Date,Tweet,No of Likes,No of Retweets,No of Replies,No of Views
SocialistMMA,"February 23, 2024 11:04 PM","Bombshell UN report exposes how Israel uses sexual violence as a tool of war against Palestinian women and children   Everything Israel accuses Hamas of is pure projection. Israel are the terrorists, not Hamas",635,361,38,42292
SocialistMMA,"May 29, 2024 09:36 PM",United States weapons were used during Israel’s massacre in Rafah   It’s a crime against humanity that the ICC hasn’t issued an arrest warrant for Joe Biden and Antony Blinken,724,345,31,19602
SocialistMMA,"March 12, 2024 01:06 PM","Weird how the media pretended Hamas targeted civilians on Oct 7th, but now it comes out all their victims where military personnel while the IDF killed Israeli civilians",355,124,22,6632
maryltrump,"January 04, 2024 11:07 PM","NEW: Donald reversed his stance on Qatar the SAME month they bought a $6.5 million apartment at Trump World Tower.   2017: Qatar is a “funder of terrorism.”  2018: Qatar is a partner in “stopping the funding of terrorism.”  For the rest of this story, link in bio.",13752,6636,272,403684
maryltrump,"October 09, 2023 10:34 PM",Tommy Tuberville is Hamas’ favorite Senator.,12480,5017,551,763916
maryltrump,"October 09, 2023 05:39 PM","This fucking maniac likely gave Putin (who gave Iran, who gave Hamas) Israels national security secrets…  Plus, he divulged highly classified information about our nuclear subs to an Australian cardboard guy.   Why is he still allowed to roam free?",50866,17500,2552,1307921
JoJoFromJerz,"October 14, 2023 05:26 PM","This week’s guest is @JoelMartinRubin (please follow him). His insights on the horrific Hamas attack come not only from his professional background, but also from a deeply personal connection to Israel as well. I am so grateful to him for this important conversation.",303,50,17,40159
JoJoFromJerz,"November 24, 2023 02:45 PM","Per CNN: “An initial group of 13 hostages have been released, the Israeli prime ministers office says, as a truce between Israel and Hamas — the first in weeks of fighting — appears to be holding.”",2026,165,90,66902
JoJoFromJerz,"October 09, 2023 10:26 PM",Hamas has committed atrocities in Israel. The human cost of their barbarousness is catastrophic. We should have solidarity in our unwavering support for the innocent victims of this violence. But what have Republicans done since day one instead? They’ve used the acute suffering,5120,1100,727,356681
JoJoFromJerz,"May 26, 2024 10:59 PM","We aren’t going to forget in November who it is that ran on a Muslim ban and who it is that is promising mass deportations and who it is that will hand Gaza and the West Bank to Netanyahu on a silver fucking platter. Unlike @RashidaTlaib, we Arabs aren’t going to forget, are we?",1447,302,345,65718
JoJoFromJerz,"October 12, 2023 01:11 PM",How many so-called “reasonable” Republicans will stand up and denounce Donald Trump for blaming Netanyahu for the horrific Hamas attack?,955,207,234,56274
JoJoFromJerz,"November 25, 2023 09:12 PM",Breaking: the second group of Hamas hostages has been released to the Red Cross.,5528,434,312,155735
DineshDSouza,"October 01, 2024 09:13 PM","This attack on Israel is brought to you by Iran, courtesy of its US enablers: Barack Obama, Joe Biden and Kamala Harris",7512,2169,402,194501
DineshDSouza,"April 29, 2024 08:17 PM","It may seem odd for me to say that some of the horrific images of civilian suffering in Gaza  are the product of local cosmetic art, not Israeli aggression. See for yourself!",565,361,89,81310
DineshDSouza,"October 19, 2023 12:05 PM",I make the case for the Jewish people possessing the land of Israel from their long and consistent presence in the region.,328,96,84,69815
DineshDSouza,"April 23, 2024 08:04 PM","While many secular Jews on the Left are now denouncing pro-Palestine protests around America, many of these same figures helped to further the cause by coopting radical “resistance” ideologies.",286,56,27,48664
DineshDSouza,"October 10, 2023 07:05 PM",Here’s how the Biden Administration’s negligence helped to enable the attack on Israel.,480,135,33,70599
DineshDSouza,"October 10, 2023 09:04 PM",Human rights attorney @GoldsteinBrooke discusses the situation on the ground in Israel in light of the recent attacks.,398,114,34,120193
TheLeoTerrell,"May 05, 2024 11:17 AM","Biden Has Given These Terrorists the Green Light to Attack, Harm, and Denied Jewish Americans to Exist in This Country",1891,702,124,104474
TheLeoTerrell,"May 24, 2024 08:01 PM",GO TO HELL! U.N. Court Orders Israel to Halt Some Military Operations in Rafah - The Wall Street Journal,331,81,91,14571
TheLeoTerrell,"October 13, 2023 11:54 AM",JUST IN: Israel Warns UN to Evacuate the Northern Gaza Strip Within 24 Hours  …,231,36,19,18574
TheLeoTerrell,"October 20, 2023 07:28 PM","The ""Squad"" is demanding a cease fire in Gaza! My response: HELL NO! ELIMINATE HAMAS!",745,99,58,24685
TheLeoTerrell,"March 04, 2024 01:31 AM",Why would anyone Trust #Hamas? Stupid! Harris Calls for Gaza Cease-Fire as She Urges Hamas to Accept Deal - The Wall Street Journal,307,67,87,24252
TheLeoTerrell,"October 23, 2023 09:37 PM","Israel Defense Forces hit over 320 Hamas military targets in air strikes, kills five key commanders",441,74,48,24611
donaldjtrumpjr,"August 16, 2024 04:46 PM",FULL STORY: Walz administration awarded $2 million to Muslim group fundraising for al Qaeda-linked charity,1139,541,198,111322
donaldjtrumpjr,"October 09, 2023 03:06 PM",I think these people should go to Israel and negotiate with Palestinian and Hamas leadership. I’m sure they’ll be taken seriously and not thrown off of the rooftops!,17482,3636,2635,978057
donaldjtrumpjr,"October 07, 2023 04:19 PM",This is from the US Embassy in Israel urging Israel to not retaliate under unprecedented circumstances… a literal  attack on their very existence. It’s absolutely unbelievable. Like so many examples here in the United States. The left thinks you should be OK with your own demise,19049,6342,2625,2890410
donaldjtrumpjr,"February 03, 2024 04:13 PM","While Donald Trump immediately stood with the patriots of East Palestine, Joe Biden was no where to be found when they needed him the most. He refused to step foot in East Palestine for an entire year, but now since its election time, hes showing up for a photo op.  Pathetic!",16759,4846,1977,427855
donaldjtrumpjr,"November 09, 2023 03:18 PM",Pretty amazing that the entire establishment media had people embedded with Hamas while they did the terrorist attack on 10/7. Are we still pretending they’re not the enemy of the people? Truly sick people!,36166,13457,1646,1259341
donaldjtrumpjr,"November 30, 2023 04:14 PM",Shocked that even MSDNC realized that it probably wasn’t a great idea to have Pro Hamas propagandists on air for hours a week.,1799,413,260,123779
spiritofho,"November 14, 2023 07:21 PM",Zionists gathering on the National Mall chanted “no ceasefire” over Van Jones as he urged the crowd to “take a stand against Muslim.”,645,261,166,75280
spiritofho,"November 24, 2023 03:51 PM",Israel  is already sniping at civilians attempting to go home during the temporary ceasefire.  This terrorist regime has run out of masks to take off.,1929,1432,96,41645
spiritofho,"October 29, 2023 05:18 AM",Israel  has displaced over a MILLION Palestinians from their homes as they bomb everything that moves.  The second Nakba isn’t coming. It’s happening NOW.,1398,963,61,35049
spiritofho,"November 02, 2023 01:33 AM","This is Jabalia refugee camp after Israel  bombed it for two consecutive days.   More than 50 were killed, hundreds injured.  There is no time to mince words. This is a holocaust and a genocide. Israel must be punished accordingly.",884,402,84,19465
spiritofho,"May 08, 2024 02:52 PM","This is what Israels ""war"" is doing in Rafah.  This is not ""victory."" Its a project of genocidal desperation aided and abetted by the U.S. and its European vassals.",1617,811,80,39041
spiritofho,"October 24, 2023 02:37 AM","Israel  has killed 2,000 children in Gaza.  Israel  has destroyed hospitals and schools.  Israel  has killed UN workers and journalists.  Israel  is threatening an invasion that would spark a regional war.  But sure, tell us again how China  is the greater threat.",832,377,55,16714
spiritofho,"February 12, 2024 01:38 PM","Israel waited for the Super Bowl to intensify its genocide by bombing Rafah, the most crowded village in Gaza precisely because Israel has spent 4 months razing the rest of Gaza.  This has to stop.",579,259,47,20168
MollyJongFast,"September 24, 2024 07:05 PM","It was supposed to be an event on fighting antisemitism, but like so many things in Trumpworld, it quickly turned into Donald Trump just engaging inantisemitism.",1590,536,52,179093
MollyJongFast,"September 14, 2024 12:28 AM","As a Jew, I know that othering against one group leads to othering the rest of us",2667,339,80,98644
MollyJongFast,"September 21, 2024 06:44 PM","As a jew, I have a sacred duty to support the candidate who believes in democracy and the rule of law, and not the candidate who was the driving force behind January 6.",11387,2657,169,288055
MollyJongFast,"September 21, 2024 04:26 PM","Adelson: Jews have a ""sacred duty"" to vote for Trump.  Let that sink in.  Trump: Jews ""would have a lot to do with the loss"" if Harris wins.  Let that sink in.  This is not normal. Dont let anyone tell you either of these things are OK to say.  @birenbomb was there. x.com/TheNVIndy/stat…",2323,560,149,77636
FiorellaIsabelM,"February 29, 2024 12:07 PM","Israel has been shooting at civilians, trying to reach food dropped off by air in Gaza.  The fact is nothing has been done and the weak, cowardly words from international organizations are not anything more than empty virtue signals. Israel is killing with impunity.   Here is",298,193,9,11077
FiorellaIsabelM,"November 06, 2023 10:32 AM","Israel struck various neighborhoods in Gaza in the middle of the dark last night, during a full internet & communications blackout. According to a doctor in Gazas Al Shifa Hospital, at least 500 civilians, including women & children, were murdered by Israeli missiles.",516,487,43,16119
FiorellaIsabelM,"November 03, 2023 04:18 PM","Israel is deliberately, undeniably targeting hospitals where injured & civilians go for safety.  Just now more Israeli strikes in front of the Al Quds Hospital in Gaza, leaving several dead. Israeli jets also targeted the Al Shifa and Indonesian hospitals simultaneously.",248,187,17,13328
FiorellaIsabelM,"November 24, 2023 08:29 AM","As the temporary pauses begins dozens of Palestinians return to the homes they were forced to leave. Trucks carrying aid & fuel enter the Gaza Strip, this after weeks of incessant carpet bombing by Israel.   Israeli forces have been deploying tear gas & firing shots in many",237,155,21,11113
FiorellaIsabelM,"May 27, 2024 05:33 AM","WARNING Horrific images of Israel’s massacre of Rafah, where they charred thousands of displaced people with 8 missiles, targeting the vicinity of UNRWA agency headquarters. A childs head & legs were decapitated, families wiped out; women, children, & elderly burned to death.",203,165,7,13874
FiorellaIsabelM,"November 01, 2023 02:26 PM","Since October 7th, Israel’s dropped 18,000 tons of bombs on Gaza, 1.5 times the force dropped on Hiroshima.   This is a global, unforgivable mass genocide war crime.",525,397,42,14105
aaronjmate,"February 04, 2024 02:02 PM","Israel’s mass murder campaign in Gaza shattered what the Wall Street Journal described in October as “an undeclared truce between Tehran and Washington.”  For more than six months before Oct. 7th, the Journal noted, “Iranian-backed militia groups refrained from launching drones",395,140,11,14627
aaronjmate,"January 24, 2024 05:35 AM","One day after it whitewashed the Palestinian death toll, NYT now describes an Israeli attempt to raze Palestinian homes and make their area unlivable as an attempt to ""help create a buffer zone.""  Nazi propagandists would be impressed.",4469,2000,113,127914
aaronjmate,"December 19, 2023 03:50 AM","In 2018, Henry Siegman, former head of the American Jewish Congress and the Synagogue Council of America, wrote this about Israels claim of ""self-defense"" in Gaza and the West Bank:  ""In Gaza, as in the West Bank beyond the pre-1967 armistice line, Israel is acting not in",1779,865,54,57992
aaronjmate,"January 10, 2024 05:47 AM","This headline -- erasing the ""cost"" of 23,000+ Palestinians killed by the invading Israeli army, plus many more wounded, maimed, and displaced -- only underscores that the NYT should change its name to the Nazi Yisrael Times:",5222,2155,150,100776
aaronjmate,"July 09, 2024 03:22 PM",The Israeli outlet Haaretz has confirmed what independent journalists @AliAbunimah @davidsheen @MaxBlumenthal reported from the start: Israel invoked the Hannibal Directive and slaughtered its own people on Oct. 7th to prevent them from being taken captive.   Former IDF,4518,2082,280,114229
aaronjmate,"November 03, 2023 12:19 AM","Rather than use vital US leverage to stop Israels assault on Gaza, Joe Biden fuels the carnage.  In May 2021, according to an insider account, Bidens orders forced Netanyahu to stop a deadly assault on Gaza.   Netanyahu “kept begging for time” but “struggled to justify his",574,240,30,29641

|RUN STATISTICS|
"Time Processed: November 04, 2024 01:30 PM",Number of discards: 337,"List of accounts processed: ['ThomasEWoods', 'ComicDaveSmith', 'FreemansMind96', 'HannahDCox', 'MsLaToshaBrown', 'RonFilipkowski', 'KyleKulinski', 'funder', 'mmpadellan', 'krystalball', 'SteveSchmidtSES', 'DavidAFrench', 'BillOReilly', 'jimmy_dore', 'TheRickWilson', 'davidsirota', 'gtconway3d', 'Jaybefaunt', 'BernardKerik', 'TomFitton', 'brad_polumbo', 'IngrahamAngle', 'seanhannity', 'charliekirk11', 'TuckerCarlson', 'AnnCoulter', 'LaraLeaTrump', 'PatTheSocialist', 'TristanSnell', 'KyleClark', 'BobMurphyEcon', 'BarbMcQuade', 'natsechobbyist', 'anthonyzenkus', 'benshapiro', 'briebriejoy', 'fred_guttenberg', 'LeeCamp', 'JordanChariton', 'kylegriffin1', 'elonmusk', 'bluestein', 'SarcasmStardust', 'SocialistMMA', 'maryltrump', 'JoJoFromJerz', 'DineshDSouza', 'TheLeoTerrell', 'donaldjtrumpjr', 'spiritofho', 'MollyJongFast', 'FiorellaIsabelM', 'aaronjmate']","List of accounts coming in: ['ThomasEWoods', 'RealSpikeCohen', 'ComicDaveSmith', 'FreemansMind96', 'HannahDCox', 'checkmatestate', 'SabbySabs2', 'MsLaToshaBrown', 'RonFilipkowski', 'KyleKulinski', 'funder', 'mmpadellan', 'krystalball', 'SteveSchmidtSES', 'robreiner', 'marceelias', 'DavidAFrench', 'BillOReilly', 'jimmy_dore', 'TheRickWilson', 'davidsirota', 'gtconway3d', 'spann', 'Jaybefaunt', 'ProudSocialist', 'BernardKerik', 'jeff_poor', 'TomFitton', 'brad_polumbo', 'IngrahamAngle', 'seanhannity', 'charliekirk11', 'TuckerCarlson', 'AnnCoulter', 'EricTrump', 'LaraLeaTrump', 'PatTheSocialist', 'TristanSnell', 'NancyAFrench', 'donwinslow', 'KyleClark', 'BobMurphyEcon', 'bshelburne', 'PatrickSvitek', 'evanasmith', 'BarbMcQuade', 'JohnArchibald', 'natsechobbyist', 'davidhogg111', 'anthonyzenkus', 'benshapiro', 'briebriejoy', 'fred_guttenberg', 'LeeCamp', 'JordanChariton', 'kylegriffin1', 'elonmusk', 'itsJeffTiedrich', 'bluestein', 'SarcasmStardust', 'SocialistMMA', 'Josh_Moon', 'WarOnDumb', 'toddcstacy', 'maryltrump', 'JoJoFromJerz', 'DineshDSouza', 'dbongino', 'TheLeoTerrell', 'donaldjtrumpjr', 'diamondandsilk', 'spiritofho', 'MollyJongFast', 'FiorellaIsabelM', 'aaronjmate']","List of accounts needed to be rerun: ['SabbySabs2', 'marceelias', 'dbongino']","List of accounts with parsed but only irrelevant tweets: ['RealSpikeCohen', 'checkmatestate', 'robreiner', 'spann', 'ProudSocialist', 'jeff_poor', 'EricTrump', 'NancyAFrench', 'donwinslow', 'bshelburne', 'PatrickSvitek', 'evanasmith', 'JohnArchibald', 'davidhogg111', 'itsJeffTiedrich', 'Josh_Moon', 'WarOnDumb', 'toddcstacy', 'diamondandsilk']"
