Subreddit Name,Author,Author Fullname,Name,Parent ID,Created Time,Depth,Score,Upvote Ratio,Number of Replies,Body
northkorea,Block-Busted,t2_15ieu8,t3_1dyqgos,,07/08/24 21:46,0,0,0.15,84,"""Do you think North Korea and Russia will wipe South Korea out of existence within few weeks or even days from today?. When it comes to the whole Russia-North Korea summit meeting that happened this year, someone made this claim:. Escalation of horizontal conflict (2-front expansion). When there is a conflict between countries, there is horizontal conflict escalation, which expands the scope of the conflict horizontally, and vertical conflict escalation, which increases the intensity of the conflict. Vertical conflict escalation is a form of increasing the intensity by fighting with bare hands, then fighting with clubs, shooting guns, firing cannons, launching missiles, and launching nuclear weapons, and horizontal conflict escalation is a form of fighting in East Asia in which conflicts that were only fought in Europe are also fought. A typical example of this escalation of horizontal conflict was in 1950, at the beginning of the Cold War, when the Soviet Union, in order to check the United States and China, allowed North Koreas Kim Il-sung to invade the South, putting the United States and China in a quagmire. In other words, it is a strategy to keep Western powers from getting caught up in war not only in Ukraine, but also in the Middle East and the Korean Peninsula in East Asia, and to prevent them from getting out of the quagmire of war. A few experts are warning of the seriousness of the current situation, which is similar to the theory that the Soviet Union induced American intervention , that Putin could start a war in Korea. Stalins Ghost and Putins Strategy.  The Cold-Blooded International Situation and the Shaking Security Landscape of the Korean Peninsula: . Putins Complex Calculations: . . This is an English translation of the original Korean source that can be found here:. . This is basically claiming that, when Korean War broke out in 1950, Stalins Soviet Union did not participate in the UN Security Council and exercised its veto, so the UN forces intervened and the subsequent clash between the UN forces and the Chinese army was a strategy intended by Stalin. Heres the English translation version of that claim:. . . and heres the original Korean version:. . Here are some of the excerpts:. In the early days when this information was known, some viewed these as bluffs of Stalins spiritual victory. At the time, Stalin was a figure who was revered as a leader representing communism throughout the communist world. In a situation where the Korean War broke out and the United States stepped in to stop it, Stalins own authority was undermined if he admitted that he made an unexpected misjudgment of the United States intervention. This is because it greatly damages the.5 However, this logic cannot explain the Soviet Unions deliberate absence from the UN Security Council and its failure to exercise its veto, and there is no evidence other than speculation. And as time passes and more and more data is discovered and cross-checked, the hypothesis that it was Stalins grand strategy is gaining strength. . Original Korean version:. . Stalin s opposition to the ceasefire. Stalin calculated that it would be fine if the Korean peninsula was unified under communist rule, and that if unification under communist rule failed due to U.S. intervention, the Chinese military would intervene in a dead-end manner, tying the U.S. military to the Korean Peninsula while consuming China, a potential competitor, so it would have been fine no matter what. It may be possible. In fact, during Stalins lifetime, the ceasefire negotiations were not properly carried out due to constant back and forth, and after Stalins death, the ceasefire negotiations proceeded very quickly and the war ended. Believing that war between the United States and the Soviet Union was imminent on the continent and that tying up American military capabilities on the Korean Peninsula would give the Soviet Union an advantage in an impending war in continental Europe, Stalin believed that the Chinese and North Korean leaders Despite expressing concern about the operation continuing the Korean War, he wanted to continue the Korean War. By May 1953, all of the communist leaders in the Soviet Union felt that the ongoing war in Korea had to be stopped.  Thus, Stalins death opened up an opportunity for senior Soviet leaders to implement a series of political reforms. The sweeping turn of Soviet foreign policy and the resulting major international systemic change was made possible by senior Soviet policy makers after Stalins death. In the spring and early summer of 1953, Soviet leaders in particular were now able to put an end to Stalins ""wrong policy"" on the Korean peninsula, while at the same time seeking a speedy end to the situation. In the spring and early summer of 1953, Soviet policy changed radically compared to the policy stance maintained just before under Stalin. Thus, an armistice could be signed on 26 July. Stalins Death and the Implications for Ending the Korean War: . Stalins global strategic goal through the Korean War, as stated in a telegram sent to Czech President K. Gottwald on August 27, 1950, was to draw the United States and China into the Korean War and continue the war for a long period of time to protect the United States. The goal was to secure time for the Soviet Union to strengthen socialism in Europe by tying its hands and feet to the Korean Peninsula and consuming Americas resources. Therefore, ending the Korean War through negotiations between the United States and China did not meet Stalins strategic goals in any case. Accordingly, on December 31, 1950, Mao Zedong told Soviet scholar P. Yudin, “We are not opposed to continuing this war, because if the U.S. forces were to remain on the Korean Peninsula for another day, it would further weaken them. “This is because it can promote discord within American imperialism and strengthen social public opinion against them.” This shows that Mao Zedong had a good understanding of Stalins intentions. Since Stalins will to oppose a negotiated resolution of the Korean War was clear, it was difficult for Mao Zedong to agree to the January 13 UN ceasefire plan that satisfied his demands. A study on the strategic conflict between Mao Zedong and Stalin in the early days of the Chinese Peoples Volunteer Armys participation in the war: . . Original Korean version:. . This is the English-translation version of the whole page:. . . and this is the original Korean version of the whole page:. . Please note that these English versions might be rough translations, so some of the sentences might not be in good shape. But basically, that user seems to be claiming that either:. 1. Putin will convince North Korea to invade South Korea after supplying North Korea with Russian weapons and resources so that South Korea and the United States will be weaken from war and won  be able to focus on Ukraine after that - or South Korea will be wiped from existence entirely. 2. Putin will invade South Korea after requesting North Korea to lend its border similar to how he asked Belarus to do so before invading Ukraine. 3. Putin and North Korea will invade South Korea together and wipe it out from existence. And with Trump, who is apparently going to pull out U.S. military from South Korea and completely scrap U.S.-South Korea alliance almost immediately after he becomes the president, thus leaving South Korea completely on its own, being 100% guaranteed to become the president again, do you expect that South Korea will completely cease to exist by next year at the latest due to Russia and North Korea invading and take over the said country in less than a week, if not a day? Why or why not?"
northkorea,P-LStein,t211utglhdmo,t1lcf6wo9,t1lcf5vgr,07/09/24 18:12,9,1,0,0,"""I dont know really, im all over the place. I watch documentaries on the life in lesser known countries and remote area of Russia/Siberia. Love that shit. Then I spent the next couple of days obsessed with said countries and read a fuck ton about it, their history; geography, culture and of course current events. That is why I am on this very subreddit and talkin to you. Right now im reading a lot about Sri Lanka and North Korea. I dont know enough about Biden or the US in general to give my opinion. All I know is that Putin is up to shady shit when it comes to geopolitics and it affects you, the people you love, and everybody around the world. We never really left the Cold War"""
northkorea,Levbendy281,t2fklwltkww,t1lcf5vgr,t1lcf55a9,07/09/24 18:06,8,0,0,1,"""But China has most of the materials to make nukes, and theyre the principal ally of Russia. Although, yeah I think youre right, Russia is nowhere near to the USSR, I think China has taken its place. Dude, tell me any country you watch media from. Because from where I am (No, im not from a communist country) we get totally different info. And my opinion does matter, at least my president isnt a senile old man that doesnt even know hes president of the united states bruh. I trust Putin more than a guy with dementia"""
northkorea,P-LStein,t211utglhdmo,t1lcf55a9,t1lcf3vhr,,7,3,0,1,"""Theyre just using their 10% of their power. No. They are 110% of their power. They had to remove guards from the Finnish border to go die in Ukraine. No. A superpower isn  formally a country with loads of nukes. That is wrong. A superpower is defined as a very powerful and influential nation. Which obviously isn  the case of Russia now. At least not anymore. Again no. They are not superior than anyone. Who know if they even have any functional nukes right now. That shit is expensive as fuck to maintain. I doubt everything that comes out of the mouth of Putin. Again you are wrong. Remember that Russia is fighting against 6% of NATO military budget in the hands of Ukrainians. If Russia does not want to get kicked out of Ukraine in a matter of days, they HAVE to go all in. Thats what theyre doing right now. Again, no I don  really care about ""western media"". Thats a bad assumption to make. I listen to medias from all over the world. And no, it doesn  say otherwise. Your opinion doesn  matter because youve been wrong on every single statement youve made. Lol"""
northkorea,Levbendy281,t2fklwltkww,t1lcgkbcs,t1lcgjms3,07/09/24 23:41,6,1,0,0,"""Youre right."""
northkorea,Mii009,t24nmw0g,t1lcgjms3,t1lcgi2wb,07/09/24 23:35,9,1,0,1,"""According to this site,  . Russia has just under 5900 nuclear weapons in total, the US along with the only other NATO nations with nuclear programs, France and Britain number a bit over 5750, Id argue theyre about equal especially with France since they seems to be more forward so to say with their nuclear weapons."""
northkorea,Levbendy281,t2fklwltkww,t1lcgi2wb,t1lcgexh4,07/09/24 23:24,8,1,0,1,"""search up on google, its everywhere on the internet. Still, heres a source:. """
northkorea,Mii009,t24nmw0g,t1lcgexh4,t1lcf3vhr,,7,1,0,1,""">russia has over 4000 nuclear weapons, even stronger than NATOs. Do you have a source for this information?"""
northkorea,Levbendy281,t2fklwltkww,t1lcf3vhr,t1lcf1and,07/09/24 23:01,6,0,0,2,"""Theyre just using their 10% of their power. Also, a superpower is normally for a country that has loads of nukes, and russia has over 4000 nuclear weapons, even stronger than NATOs. Yes, in comparision to the US, russia has a very defficient manpower, but on weapons of mass destruction, theyre far superior than anyone. Theyre just saving up their most strong power for something bigger. Also, most of the info you got are from western media, meanwhile on non-western media, it says otherwise. In my opinion, none of us really know whats going on in Ukraine, because probably both media are some kind of propaganda, just as it has been previously."""
northkorea,P-LStein,t211utglhdmo,t1lcf1and,t1lceyz2c,07/09/24 17:54,5,3,0,1,"""Russia has the second best military in Ukraine right now.  Not sure how you can think they are a superpower with that debacle that is happening in this stupid ego war for one man. . The entire point of this invasion was to tell Ukraine to stop doing businesses with EU and stop trying to join NATO. Russia does NOT want to share a border with another NATO country. Now they came up with a plan to kidnap/kill Zelensky before anyone could react and the world would accept whoever new puppet he installs as president à la Lukashenko. But the CIA gave away the plan to the Ukrainian army. Then The Battle of Hostomel happened which pretty much wiped the most elite soldiers of the Russian army in a matter of weeks. . They couldnt reach Kyiv so they tried to do a full blown invasion which immediately failed and Russia had to conscript people and then move most its unit to the south east where the battle is still happening as we speak, more than 865 days later. Now russia temporarily control few kilometers of mined and unusable wheat fields. How do you you see any kind of win in that story is mind blowing. Its quite literally a russian doll of failure. Failure within failure within failure. No, truly, they lost the second the Ukrainian decided to fight back. Now Russia is exposed to what it really was; a shadow of its former self. Dead are the days of the red glory."""
northkorea,Levbendy281,t2fklwltkww,t1lceyz2c,t1lcbnkpy,07/09/24 17:39,4,-2,0,1,"""I don  think they ""lost"" it. Id say that they already took what they wanted. After all, russia has the 2nd best military in the world. I think that they know that if they try to take Kiev, theyll unleash a world war, and theyre probably saving troops for something like that, too."""
northkorea,P-LStein,t211utglhdmo,t1lcbnkpy,t1lcaf0q8,07/09/24 17:26,3,11,0,1,"""Same thing.  Russia is struggling hard against Ukraine right now. Theyve even lost some of the occupied territory that cost then tens of thousands of lives in the last couple days. Its not easy being in the position of Russia at the moment. Cant afford to piss of the west even more, cant afford to piss off China, cant afford to lose a single of their African country ally. And thats only with Ukraine, a poorer, smaller, less equipped country than South Korea. No, truly, its laughable to think Russia can take on any real country within the next few generations at least. They expected a quick defeat of Kyiv in the first few days of the war but they fucked up and now theyve obviously lost the war and failed all their other objectives of pushing back NATO."""
northkorea,Block-Busted,t215ieu8,t1lcaf0q8,t1lcaepld,07/08/24 21:59,2,-33,0,1,"""Well, have you checked all those sources that Ive posted?. Also, youve posted this comment twice."""
northkorea,EastProfessional385,t2p06ee4em,t1lcaepld,t31dyqgos,07/08/24 21:57,1,32,0,1,"""Nom they cant. Its an NK wet dream but Russia is not in a position to invade a better equipped nation and so does NK."""
northkorea,15926028,t2r66ccsd,t1lcdf098,t1lcamrq4,07/09/24 12:29,0,2,0,0,"""Thank you for this!"""
northkorea,BeingACat,t24gatcxjw,t1lcgxfol,t1lcguraz,,1,1,0,0,""">I dont think they really want to take more territory. They obviously want to, they have to at least finish capturing the 4 oblasts they want to annex. In 3 of those oblasts they lack significant territory while in the 4th one they only needs minor gains. Theyre not going to stop until at minimum they finish capturing those areas, but they simply cant. >Ill use the Mexican-American war as an example. The US could have taken the whole country, but they only took certain key regions that they needed, and then pulled back. A 1,75 years war where America swfitly stomped the Mexican military and captured Mexico City before forcing them to accept peace on their conditions is in no way comparable to this 2,5 years debacle with no end on sight, where Russia cannot take neither the whole country nor Kyiv nor even the full areas they want to annex, and they also cannot force Ukraine to sign a peace treaty giving them those areas. A Mexican-American War that actually mirrors the Russo-Ukrainian War would look like this, and it would be absolutely embarrassing for the US:  . . >I honestly dont think Russia is even taking this war seriously. The Russian government has spent the last 2,5 years painting this war as an existential fight for Russia from which they cannot retreat, so they clearly disagree with you. >Seriously how do you do that thing of answering quotes :v. Use a before the text."""
northkorea,Levbendy281,t2fklwltkww,t1lcguraz,t1lcgt5co,07/10/24 01:33,6,1,0,1,"""I dont think they really want to take more territory. Ill use the Mexican-American war as an example. The US could have taken the whole country, but they only took certain key regions that they needed, and then pulled back. I honestly dont think Russia is even taking this war seriously. And on the other stuff yeah youre right. Seriously how do you do that thing of answering quotes :v"""
northkorea,BeingACat,t24gatcxjw,t1lcgt5co,t1lcgikwm,07/10/24 01:08,5,1,0,1,""">They have taken like 20% of their territory. Right, they can  take 100% of Ukraine after more than 2 years. At this point theyre also unable to get significant advantaces despite having massive losses. This is a clownish loss for a country larping as a superpower. >They said they could reach kiev in 3 days, not that they would do that. This is an insane cope. They went straight for Kyiv, spent a month accomplishing nothing and then retreated. They obviously wanted to capture it but were unable to. Anyway, you didn  say anything about the overall picture of Russia failing miserably so heres a breakthrough of their objectives:. -""Denazify"" (i.e. regime change) and demilitarize Ukraine: Total failure, both the Zelenskyy administration and the Ukrainian army still exist. -Occupy Ukraine: Partial failure, they can  stomp Ukraine and occupy the whole country. -Prevent NATO expansion: Total failure, Finland and Sweden joined NATO, dramatically increasing Russias border with them. -Take Ukraine out of the Wests orbit and bring her back to Russias: Total failue, Russo-Ukrainian relations have crashed while Ukrainian resistance has become a cause célèbre in the West. -Destroy the notion of Ukraine as an independent nation from Russia: Total failure, their invasion has only strenghtened Ukrainian nationalism and resistance. -Protect the Russians in Ukraine from ""genocide"" (obviously an excuse but what the hell): Total failure as Russian Ukrainians are dying a lot more than in January 2024. Saying that Russia has accomplished what she wanted is blatantly untrue as of July 9th 2024. >Its not me thats saying they got the 2nd best military, its the ranking, go ask them. Riiiiiiiiight and the analysts also thought that Russia was a potential superpower before they begun taking L after L against Ukraine, a corrupt literally who armed with NATO hand downs. No one takes either claim seriously in 2024. >Yeah sure they did, can I see your source? (Not trying to be aggresive im just curious). Literally as simple as googling Kyiv 2022. . >They have loads of men, definitely theyre not spending everything on Ukraine, they have millions in reserve bruh :v. They have MEN, they don  have SOLDIERS. Hundreds of thousands of reservists have already left Russia after a partial mobilization, a full mobilization would lead to many hundreds of thousands more, hence why no full mobilization and why they have to rely on prisoners for the actual soldiers they can send."""
northkorea,Levbendy281,t2fklwltkww,t1lcjd2ci,t1lcherzb,07/10/24 00:54,4,1,0,0,"""I dont think Russia makes the military ranking, its an international organization."""
northkorea,ThoseguysNick,t212gri8bgh6,t1lcherzb,t1lcgikwm,07/10/24 13:01,5,1,0,1,""">. 3. Its not me thats saying they got the 2nd best military, its the ranking, go ask them. No it was Russia itself that said so. And with that I mean, they lie about their equipment and the level of readiness, so outside observers that cant look into the information themself have to trust it"""
northkorea,Levbendy281,t2fklwltkww,t1lcgikwm,t1lcgh0n0,07/10/24 04:42,4,1,0,2,"""How do you do that lol. 1. They have taken like 20% of their territory. 2. They said they could reach kiev in 3 days, not that they would do that. 3. Its not me thats saying they got the 2nd best military, its the ranking, go ask them. 4. Yeah sure they did, can I see your source? (Not trying to be aggresive im just curious). 5. They have loads of men, definitely theyre not spending everything on Ukraine, they have millions in reserve bruh :v"""
northkorea,BeingACat,t24gatcxjw,t1lcgh0n0,t1lcezgny,07/09/24 23:27,3,2,0,1,""">I dont think theyre being incomtetent at Ukraine. Then youre not paying attention at all. >Id say that they already took what they wanted. Their 3 days to Kyiv adventure turned into a 2,5+ years war with no end on sight, where they can only hold 20% or so of Ukraine while the Ukrainian leadership remains strong and with closer ties to the West than before. They are fighting hard for 10% of what they wanted. >After all, russia has the 2nd best military in the world. Russia has the second best military in Ukraine. >I think that they know that if they try to take Kiev, theyll unleash a world war,. They literally already tried to take Kyiv and failed miserable. >and theyre probably saving troops for something like that, too. Literally just a baseless conspiracy. Theyre sending Africans to die in Ukraine, theyre not saving anything."""
northkorea,CertifiedDad,t2ahqtmqdp,t1lcg97en,t1lcezgny,07/09/24 23:16,2,1,0,0,"""Sure, I agree I was being somewhat hyperbolic. They aren’t wholly incompetent but I would say they are unskilled at conventional and modern warfare. They haven’t had to genuinely participate in modern warfare on a large scale for quite some time now so there’s a bit of rust that needs to be knocked off."""
northkorea,Levbendy281,t2fklwltkww,t1lcezgny,t1lcamrq4,07/09/24 17:29,2,2,0,2,"""Just gonna copy-paste another comment are made, just for the last bit of Ukraine. I dont think theyre being incomtetent at Ukraine. Id say that they already took what they wanted. After all, russia has the 2nd best military in the world. I think that they know that if they try to take Kiev, theyll unleash a world war, and theyre probably saving troops for something like that, too. Other than that, I 100% agree with your comment."""
northkorea,CertifiedDad,t2ahqtmqdp,t1lcciolx,t1lcbbnw7,,1,10,0,0,"""Kid, you’re single source reporting. That’s not the way to do research. . If you want to make a genuine point, you need to find reputable sources that don’t have a warning on them like the front page of Namu “Namuwiki is a wiki that anyone can contribute to.  It may contain unverified or biased content.”."""
northkorea,Block-Busted,t215ieu8,t1lcbbnw7,t1lcamrq4,07/09/24 02:24,2,-7,0,1,"""So I suppose that youve read this page about Soviet intervention in the United States or something? Its in Korean:. . Just in case, heres the English-translation version:. """
northkorea,CertifiedDad,t2ahqtmqdp,t1lcamrq4,t31dyqgos,07/08/24 22:51,1,18,0,3,"""Kid, ya gotta stop with the doom and gloom. . You keep posting the end of Korea and stringing it together in a convoluted series of half-supporting articles from what I would consider to be ‘questionable’ sources at best. And yes, I can read Korean. . Is there concern for the strengthening bond between Russia and North Korea? Sure. . Is Russia the Soviet Union? No. It hasn’t been in that same political spectrum for a long time. Namely, Russia has better geopolitical navigation than the Soviet Union did. . What you’ve got to start asking yourself is ‘why’ and ‘then what’. What’s happening here is you see ‘Russia talks to NK. Russia hates US and has military. Naturally they would give that to NK and they would take over SK, it would be so easy.’ And then you stop your train of thought here. . Why would Russia try to increase its diplomatic relations with NK? Well, for one, to really piss off the NATO. It’s happening at a time when Ukraine is being considered for joining an organization that Russia has been against forever. Could there be an underlying threat that they could ‘misplace’ some military stuff and NK happens to garner some resources? Sure. This isn’t the whole picture though nor the real point of the move. . You’ve also missed the mark on NK’s military standing. Can Russia insinuate NK could help in Ukraine? Sure. Will they call them in? Maybe, it would be a bold political move but not outside of reasonability. Would they actually help the war effort? Absolutely not. NK has basically no military prowess nor proficiency to conduct a conflict outside of the Korean Peninsula. . Would Russia consider overtly aiding NK and pushing into SK? Absolutely not. For one, it would trigger NATO support since they would have to push through US military forces. It would be considered an act of war against the US and given how incompetent they are at campaigning against Ukraine, they would quickly realize fighting a war on two fronts was a horrible idea. . Additionally, Russia isn’t dumb. It knows it can’t go toe to toe with the US, let alone NATO which could push in from literally all sides of its border minus the China/-stan regions. Please, just stop doomsaying whatever apocalyptic event you keep stringing together."""
northkorea,Block-Busted,t215ieu8,t1lcbcqv6,t1lcb914o,07/09/24 02:36,10,1,0,0,"""Well, have you checked rest of that comment of mine?"""
northkorea,Luckychatt,t25eaud,t1lcb914o,t1lcalax4,07/09/24 01:57,9,6,0,1,"""100% guaranteed? More like 50% guaranteed."""
