Poster,Date,Tweet,No of Likes,No of Retweets,No of Replies,No of Views
SteveSchmidtSES,"December 15, 2023 06:40 PM",More than 100 people participated in a flash hora in Toronto to celebrate Jewish culture in the midst of a significant rise in antisemitism in both Canada and worldwide. What a great show of solidarity.  #stopantisemitism #neveragain,742,119,41,103161
SteveSchmidtSES,"October 10, 2023 01:01 PM","""The prime minister, who has prided himself on his vast political experience and irreplaceable wisdom in security matters, completely failed to identify the dangers he was consciously leading Israel into when establishing a government of annexation and dispossession.""  These",13223,4037,810,1048489
SocialistMMA,"July 24, 2024 01:43 PM",Netanyahu is getting peace loving Jewish people arrested for protesting the war crimes he was found guilty committing by the ICC  Another example of how Zionism is the height of antisemitism   Zionism makes Jewish people LESS SAFE,4085,2035,24,80952
SocialistMMA,"July 24, 2024 12:45 AM",Jews in the United States getting arrested on behalf of Israels Netanyahu,513,235,19,14489
SocialistMMA,"May 09, 2024 01:11 AM",Israel commits crime of the century as they slaughter Palestinians in Rafah  Zionism is currently the most barbaric ideology in the world,677,263,56,54065
SocialistMMA,"October 09, 2023 07:58 PM",Israel announces war crimes and atrocities are planned for Gaza  Critical support for the Palestinians  #FreePalestine,278,118,5,8446
SocialistMMA,"November 03, 2023 03:26 PM","“The United States is controlling the war in Gaza, and it is the United States that must pay the price for the crimes perpetrated by the Israelis in Gaza and by the Americans in Iraq and elsewhere.”  Address by Hezbollah Chief Nasrallah that was viewed by millions around the",243,66,4,7716
SocialistMMA,"May 22, 2024 01:34 PM",Hamas has utterly defeated Israel. Israel getting buried on the battlefield AND diplomatically,221,47,17,6593
SocialistMMA,"May 22, 2024 08:33 AM","Ireland, Norway and Spain announce they are officially recognizing Palestine as an independent state.",279,104,14,9401
ajamubaraka,"November 04, 2023 04:33 PM",Exactly. Especially dont fall for the hustle of conflating opposition to the criminality of the Israeli state with antisemitism. The veil has been lifted & everyone now sees the reality of the Israeli settler state. There is no reversal back to the mythology of Israel.,329,134,4,11409
ajamubaraka,"November 04, 2023 01:47 PM","Its not necessary to ""condemn Hamas and antisemitism"" in your support for Palestinian liberation. These disclaimers only feed into the propaganda and distract from the real issue at hand: Israels 75-year occupation, ethnic cleansing, illegal expansion, apartheid, and genocide.",398,145,7,13482
ajamubaraka,"October 09, 2023 03:16 AM","The issue is the murderous occupation that Israel has been allowed to imposed now for 75 years. The ""collective West"" has been silent as the apartheid state waged war on Palestinians. Now that the war has been brought to Israel, we are supposed to be outraged.",337,160,6,14186
ajamubaraka,"October 08, 2023 07:30 PM","When a murderous occupation makes peaceful resistance impossible, it makes violent resistance inevitable.   #Israel #FreePalestine #EndApartheid x.com/ProudSocialist…",463,206,11,12910
ajamubaraka,"August 05, 2024 10:12 PM",The Houthis say stop the slaughter in Gaza and they stop interrupting shipping in the Red Sea. Hezbollah says the people of Northern Israel can return home when Israel stops killing Palestinians in Gaza. Why does the U.S. continue supporting the racist terror in Gaza?,320,131,5,7840
ajamubaraka,"August 05, 2024 07:31 PM",We demand @JoeBiden and @KamalaHarris avert the impending Middle East war by ending Israel’s genocide in Gaza now.  The long-feared regional war is looming in the Middle East and could easily spin out of control into a wider conflict. The Biden-Harris administration is pouring,270,148,5,10168
ajamubaraka,"May 12, 2024 01:43 AM",Since the Israeli fascist correctly understand that the Palestinian resistance resides in the hearts and minds of the people their strategy is simple - kill as many of the people as possible. Genocide and settler colonialism cannot be separated.,234,102,4,6450
ajamubaraka,"May 11, 2024 07:46 PM",Terrifying footage captured by Aljazeera’s cameraman in Jabaliya tonight -where IOF pounded the camp with over 100 bombs as quadcopters fired at civilians taking shelter in nearby schools. Safety is an illusion. Humanitarian zones a deception.,593,283,24,13895
gtconway3d,"November 11, 2023 07:34 AM",".@DouglasKMurray to @piersmorgan:  “The thing that struck me, Piers, about seeing the 7th of October footage, was that even the Nazis were actually ashamed of what they did.  SS battalions who spent their days shooting Jews in the back of the head and pushing them into trenches,",5825,2058,752,1651043
gtconway3d,"November 02, 2023 01:06 AM",“There is no moral equivalency here. Lets be clear: Hamas shares no values with any Western academic institution. Hamas is an organization that has repeatedly pledged to annihilate Israel and its people.  “Its ideology is antithetical to the values of human life and the liberal,1819,520,53,299509
gtconway3d,"October 09, 2023 04:48 PM","“The IDF issued rare public statements in recent months, warning that military deterrence was deteriorating. Netanyahu and radical members of his cabinet derided the officials as part of the protest movement, and the protesters as ‘anarchists,’ asserting that the status quo with",2416,623,78,602142
gtconway3d,"October 09, 2023 03:38 PM",Israel amassed troops in the West Bank. Then Hamas attacked from Gaza.,2528,294,106,389445
gtconway3d,"October 10, 2023 07:20 PM","I apologize for using the word “fighters” here. I should have used the word “terrorists.”  We have been reading and listening to too many news reports referring to Hamas members as “fighters” or “militants,” and it’s easy to pick up the bad habit.   But the attackers were not",1819,520,53,299509

|RUN STATISTICS|
"Time Processed: September 30, 2024 01:43 AM",Number of discards: 219,"List of accounts processed: ['fred_guttenberg', 'LeeCamp', 'JordanChariton', 'mmpadellan', 'charliekirk11', 'davidsirota', 'blacks4peace', 'kylegriffin1', 'PalmerReport', 'StatusCoup', 'POLITICO', 'TuckerCarlson', 'elonmusk', '1819News', 'itsJeffTiedrich', 'bluestein', 'OccupyDemocrats', 'krystalball', 'SarcasmStardust', 'GunnelsWarren', 'ABC', 'LeverNews', 'AnnCoulter', 'SteveSchmidtSES', 'SocialistMMA', 'ajamubaraka', 'gtconway3d']","List of accounts coming in: ['denverpost', 'action_4assange', 'CapitolJournal', 'politicallyga', 'fred_guttenberg', 'AmpedUpPodcast', 'LeeCamp', 'JordanChariton', 'TheDemCoalition', 'DworkinReport', 'WarOnDumb', 'NPR', 'TPUSA', 'mmpadellan', 'charliekirk11', 'robreiner', 'davidsirota', 'blacks4peace', 'people4liberty', 'HouseDemocrats', 'TeamWarnock', 'BadFaithPod', 'kylegriffin1', 'PalmerReport', 'StatusCoup', 'POLITICO', 'marceelias', 'TuckerCarlson', 'DworkinWeekly', 'elonmusk', 'EliasLawGroup', 'JoyAnnReid', '1819News', 'itsJeffTiedrich', 'RacePowerPolicy', 'chkbal', 'wabenews', 'bluestein', 'UALawSchool', 'OccupyDemocrats', 'toddcstacy', 'krystalball', 'SarcasmStardust', 'GunnelsWarren', 'ABC', 'LeverNews', 'AnnCoulter', 'TexasTribune', 'RedState', 'DemocracyDocket', 'SteveSchmidtSES', 'TheWeekendMSNBC', 'SocialistMMA', 'ajamubaraka', 'AJC', 'gtconway3d']","List of accounts needed to be rerun: ['action_4assange', 'CapitolJournal', 'politicallyga', 'AmpedUpPodcast', 'NPR', 'people4liberty', 'TeamWarnock', 'BadFaithPod', 'EliasLawGroup', 'JoyAnnReid', 'RacePowerPolicy', 'UALawSchool']","List of accounts with parsed but only irrelevant tweets: ['denverpost', 'TheDemCoalition', 'DworkinReport', 'WarOnDumb', 'TPUSA', 'robreiner', 'HouseDemocrats', 'marceelias', 'DworkinWeekly', 'chkbal', 'wabenews', 'toddcstacy', 'TexasTribune', 'RedState', 'DemocracyDocket', 'TheWeekendMSNBC', 'AJC']"
