Poster,Date,Tweet,No of Likes,No of Retweets,No of Replies,No of Views
JordanChariton,"July 18, 2024 12:27 AM","The Mayor of East Palestine, OH just spoke at the RNC and did not mention the fact that East Palestine is STILL a chemical petri dish, its residents are growing sicker, and the EPA is helping Norfolk Southern cover it up.",11017,3003,40,544959
JordanChariton,"April 24, 2024 05:26 PM","I know there’s a lot going on, but I want to remind folks what the govt & media are covering up—the latest sacrifice zone. Jenna is an 18 year old East Palestine OH resident. Before Norfolk Southern unnecessarily detonated toxic cancerous chemicals over EP, she was healthy….",1201,316,22,58869
mmpadellan,"March 31, 2024 07:04 PM","While Democrats push for ceasefire and humanitarian aid in Gaza, Republicans like Rep. Tim Walberg call for the slaughters of Palestinian children, ""It should be like Nagasaki and Hiroshima.""  This should be a much bigger story.",3901,2149,1216,248025
mmpadellan,"May 06, 2024 04:55 PM",BREAKING: Hamas has tentatively accepted the ceasefire proposal!!!!!,5852,612,954,251080
mmpadellan,"October 09, 2023 04:04 PM","As a Muslim,  a father,  a brother, a son, an American, and a human being  I am APPALLED at the heinous, horrendous attacks against civilians in Israel this weekend. You dont need to fit neatly into ANY category besides ""decent human being"" to condemn the atrocities we saw",15884,2544,1898,689734
mmpadellan,"November 17, 2023 01:14 AM","Israel has a right to exist. Palestine has a right to exist. A two-state solution is the ONLY way forward. BOTH need to be free of terrorist violence, retaliatory violence, settler violence, and occupier violence. Free of violence, PERIOD.  Both sides have suffered tremendous",5008,1192,406,123302
mmpadellan,"March 14, 2024 03:55 PM","WOW.  Senator Chuck Schumer called Benjamin Netanyahu ""an obstacle to peace,"" and ""too willing to tolerate the civilian toll in Gaza,"" and called for Israel to hold new elections to replace him.  Senator Schumer is 100% right.",29184,7337,2881,730899
charliekirk11,"May 06, 2024 04:58 PM","BREAKING: According to AP, Hamas has told Qatar and Egyptian mediators that it will accept terms of a ceasefire and prisoner swap with Israel. This comes as Israel was preparing a ground siege on Rafah, the last Hamas stronghold in Gaza.",1733,361,425,236487
charliekirk11,"October 07, 2023 03:56 PM","Hundreds of Israelis dead and injured. 50+ Israeli hostages. Hamas militias killing innocents in their homes, 2,200 missiles launched in an unprovoked, surprise attack.   MSNBC: ""I couldn’t think of a better gift for Benjamin Netanyahu right now than this kind of incursion. """,7159,3176,1643,751683
charliekirk11,"December 02, 2023 12:06 AM","Six days after Oct. 7th, I went on the PBD Podcast and asked a series of questions about what Israeli intelligence failures happened that allowed Hamas to massacre 1,200 civilians. The clip went viral and I was attacked as an antisemite and called worse than a ""Holocaust denier.""",2543,614,279,529645
charliekirk11,"December 05, 2023 02:41 AM","Days before the Oct. 7 Hamas attack on Israel, stock traders magically began anticipating events to come:  Research by law professors Robert Jackson Jr from NYU and Joshua Mitts of Columbia reveals MASSIVE short-selling leading up to the attacks:  The short-selling before Oct. 7",17060,5977,908,2171970
charliekirk11,"October 19, 2023 03:01 PM","Son of Hamas leader, Mosab Hassan Yousef, denounced Hamas and converted to Christianity after witnessing their savagery:   ""They dont care for the Palestinian people. They dont regard human life. I saw their brutality firsthand If they succeed in destroying Israel and",27338,10495,1184,2560230
davidsirota,"November 14, 2023 07:06 PM","MUST READ: Right-wing Israel advocacy groups intervened in Democratic primaries to crush progressives, including a pro-Israel Jewish Democratic congressman.  The tactic has helped deter Democratic congressional opposition to Israels war in Gaza.",1125,421,42,36599
blacks4peace,"November 04, 2023 10:45 PM","The Black Alliance for Peace was at the #March4Palestine rally in Washington, DC today  #FreePalestine",1882,574,29,61569
blacks4peace,"April 26, 2024 09:14 PM",MIT student organizers at the Students Against Genocide Encampment join the call to stand firm against foreign interference in Haiti. Haitians deserve self-determination to address their own political affairs without external meddling. @mitcaa #HandsOffHaiti #FreePalestine,1632,931,25,102770
kylegriffin1,"March 01, 2024 12:25 AM",Sen. Raphael Warnock is now calling for a ceasefire in Gaza.,2740,327,97,158065
kylegriffin1,"March 21, 2024 09:50 AM","Secretary of State Antony Blinken says the U.S. has submitted a draft resolution to the UN Security Council calling ""for an immediate ceasefire"" in Gaza — ""tied to the release"" of hostages held by Hamas.",1773,496,55,111688
kylegriffin1,"May 08, 2024 10:25 PM","Breaking:  WASHINGTON (AP) — Biden says Im not supplying the weapons if Israel launches assault on Gazas Rafah, after US paused bomb shipment.",3974,741,123,192238
kylegriffin1,"April 03, 2024 12:05 AM","President Biden: ""I am outraged and heartbroken by the deaths of seven humanitarian workers from World Central Kitchen, including one American, in Gaza yesterday. They were providing food to hungry civilians in the middle of a war. They were brave and selfless. Their deaths are a",2749,653,141,141160
kylegriffin1,"July 25, 2024 11:30 PM","BREAKING. Vice President Harris on Israel-Gaza:  ""Israel has a right to defend itself, and how it does so matters.""  ""The images of dead children and desperate, hungry people fleeing for safety, sometimes displaced for the second, third or fourth time — we cannot look away in the",4118,995,65,202784
PalmerReport,"July 12, 2024 04:12 PM",President Biden says Israel and Hamas have agreed to the framework for a ceasefire. Congrats to Biden on a huge diplomatic victory on the world stage.,10952,2931,106,172212
StatusCoup,"July 15, 2024 12:12 AM","Zionists follow Pro-Palestine Jewish protesters to their car, harassing and threatening them the entire way. ""All your beards, all fake! Cut them off btch! Cut them off!"" One yells at one point.  Via @JonFarinaPhoto",7396,3880,340,2956497
POLITICO,"July 19, 2024 12:42 PM","These trauma surgeons thought they’d seen the worst of the worst. But nothing they’d experienced prepared them for the horrors they found in Gaza, as civilians and children suffer under Israel’s bombing campaign.  Two weeks inside a Gaza hospital",10906,7632,188,3879389
POLITICO,"January 21, 2024 11:57 AM","Palestinian death toll in Gaza surpasses 25,000",2181,2195,284,3472159
TuckerCarlson,"January 08, 2024 10:38 PM","The attacks by the Houthis are hurting people around the world – especially the poorest and most vulnerable populations, including in Yemen and Gaza.",111304,24205,7100,8258920
TuckerCarlson,"October 23, 2023 10:02 PM",(2:00) Col. Douglas Macgregor (4:20) Threats to the homeland (6:12) Iran & its missiles (13:00) Going into Gaza (19:40) American hostages (22:45) Impact on the American economy,14031,2094,597,2369955
TuckerCarlson,"October 19, 2023 02:42 AM",(0:00) Vivek attacked for opposing World War III (3:00) The potential for disaster in America (5:00) What does an Israeli ground invasion mean? (9:30) The appropriate response to Hamas (14:25) The real threat of nuclear war,58791,25467,3490,9274010
TuckerCarlson,"June 07, 2024 05:03 PM","Rep. Thomas Massie doesn’t care what you think of him, which is pretty great.  (3:19) Where Does US Debt End? (10:32) Why Massie Voted 15 Times Against Funding Israel (14:53) AIPAC (34:04) Mitch McConnell (42:25) Area 51 (50:32) Massies Relationship with Trump (57:09) Kill",54664,18329,4104,11631844
elonmusk,"April 28, 2024 03:42 AM","If you teach that “weak makes right”, then the perceived stronger party – in this case, Israel – is wrong.  Morals should be taught in the absolute, meaning that it is possible for either the strong or weak to be morally good, depending on their actions.",148075,26071,17949,25440223
elonmusk,"October 08, 2023 04:23 PM","Khamenei’s official position is clear that the eradication of Israel is the actual goal, not just supporting Palestinians.  That will not happen. All that actually happens, decade after decade, is a never-ending cycle of violence and vengeance.  Stoking the fires of hatred isn’t",44171,10486,8362,6449765
elonmusk,"July 23, 2024 09:29 PM",Starlink is now active in a Gaza hospital with the support of @UAEmediaoffice and @Israel,261387,28151,18156,85680598
elonmusk,"November 15, 2023 11:42 PM","Yes, “decolonization” necessarily implies a Jewish genocide, thus it is unacceptable to any reasonable person",34204,7055,5066,48395909
itsJeffTiedrich,"October 07, 2023 03:51 PM","hey, remember when Jared Kushner brought peace to the Middle East? me neither",19943,3345,1082,325181
itsJeffTiedrich,"April 13, 2024 09:50 PM","hey, remember when Jared Kushner brought lasting peace to the Middle East? me neither",19332,3442,941,240803
itsJeffTiedrich,"October 12, 2023 03:49 PM",Donald Trump praising Hamas is all the proof you need that the family of raccoons that live inside his head have finally chewed through all the wires,19262,3570,643,473972
OccupyDemocrats,"May 22, 2024 06:56 PM","BREAKING: Second Gentleman Doug Emhoff unleashes a brutal attack on Donald Trump, ripping into him as a ""known antisemite"" after his MAGA campaign releases a Nazi dog whistle video referencing a ""unified Reich.""  And it gets even better.   Emhoff, who is Jewish, posted a video",4418,1923,302,56700
OccupyDemocrats,"October 18, 2023 04:41 PM","BREAKING: President Biden scores a huge foreign policy win as he finally convinces Israel to allow humanitarian aid to flow across the border from Egypt into Gaza — giving relief to the embattled, starving, thirsty Palestinians.  Israeli Prime Minister Benjamin Netanyahu said",9453,3028,800,396671
OccupyDemocrats,"November 17, 2023 06:22 PM","BREAKING: President Biden slams Republican billionaire Elon Musk for his recent shocking antisemitism, calling it ""unacceptable"" and a ""hideous lie.""  This is EXACTLY how you stand up to MAGA bigotry.   It all started when Musk responded to a jaw-dropping tweet that alleged that",14653,4910,1263,614863
OccupyDemocrats,"October 09, 2023 07:05 PM","BREAKING: Republican 2024 presidential candidate Donald Trump launches a dangerous, vile, and racist attack against President Obama over the Hammas attacks against Israel.   On Truth Social today, Trump posted, “The same people that raided Israel are pouring into our once",6290,2738,3854,879435
krystalball,"July 26, 2024 11:10 AM",Bibi’s been the main obstacle to a ceasefire the entire time so he can fuck right off with this hissy fit over some long overdue mild criticism.,3408,591,137,114093
krystalball,"July 26, 2024 04:05 AM","Israeli Prime Minister Benjamin Netanyahu was upset by Vice President Kamala Harris on camera statement after their meeting & is concerned it will harm negotiations over a Gaza hostage & ceasefire deal, per Israeli official. My story on @axios …",1704,520,145,98755
krystalball,"November 01, 2023 07:43 PM",This is exactly the sort of abhorrent logic Hamas used to justify their slaughter of innocent Israelis,8826,2242,537,713310
GunnelsWarren,"May 02, 2024 10:13 PM","You wanna talk about destruction? Israel has destroyed 84% of Gaza’s healthcare facilities & all of Gaza’s universities. Instead of parroting Netanyahu’s talking points, maybe you could interview just one of the hundreds of thousands of children in Gaza who are facing starvation.",18123,4521,87,368720
ABC,"October 14, 2023 05:26 PM","People have taken to the streets of Tel Aviv in protest of the Israeli government, blaming Israeli Prime Minister Netanyahu for not protecting Israels citizens.  Follow live updates on the Israel-Gaza conflict:",2359,924,163,486463
AnnCoulter,"October 13, 2023 10:11 PM","They are here, chanting “Death to Jews…”  This is on the @UCLA campus.",1466,201,688,193743
SteveSchmidtSES,"October 24, 2023 06:08 PM","""The corruption of one man in Israel has brought the whole world to the brink of war because his corruption and weakness stirred evil, and when evil sees weakness, it strikes.""  More on how corrupt politicians like Netanyahu and Trump threaten the world:",4259,1586,314,228247
SteveSchmidtSES,"October 10, 2023 01:01 PM","""The prime minister, who has prided himself on his vast political experience and irreplaceable wisdom in security matters, completely failed to identify the dangers he was consciously leading Israel into when establishing a government of annexation and dispossession.""  These",13223,4037,810,1048489
SocialistMMA,"July 24, 2024 01:43 PM",Netanyahu is getting peace loving Jewish people arrested for protesting the war crimes he was found guilty committing by the ICC  Another example of how Zionism is the height of antisemitism   Zionism makes Jewish people LESS SAFE,4085,2035,24,80952
gtconway3d,"November 11, 2023 07:34 AM",".@DouglasKMurray to @piersmorgan:  “The thing that struck me, Piers, about seeing the 7th of October footage, was that even the Nazis were actually ashamed of what they did.  SS battalions who spent their days shooting Jews in the back of the head and pushing them into trenches,",5825,2058,752,1651043
gtconway3d,"November 02, 2023 01:06 AM",“There is no moral equivalency here. Lets be clear: Hamas shares no values with any Western academic institution. Hamas is an organization that has repeatedly pledged to annihilate Israel and its people.  “Its ideology is antithetical to the values of human life and the liberal,1819,520,53,299509
gtconway3d,"October 09, 2023 04:48 PM","“The IDF issued rare public statements in recent months, warning that military deterrence was deteriorating. Netanyahu and radical members of his cabinet derided the officials as part of the protest movement, and the protesters as ‘anarchists,’ asserting that the status quo with",2416,623,78,602142
gtconway3d,"October 09, 2023 03:38 PM",Israel amassed troops in the West Bank. Then Hamas attacked from Gaza.,2528,294,106,389445
gtconway3d,"October 10, 2023 07:20 PM","I apologize for using the word “fighters” here. I should have used the word “terrorists.”  We have been reading and listening to too many news reports referring to Hamas members as “fighters” or “militants,” and it’s easy to pick up the bad habit.   But the attackers were not",1819,520,53,299509

"|RUN STATISTICS|
"
"Time Processed: November 19, 2024 11:36 PM
","Number of discards: 288
","List of accounts processed: ['JordanChariton', 'mmpadellan', 'charliekirk11', 'davidsirota', 'blacks4peace', 'kylegriffin1', 'PalmerReport', 'StatusCoup', 'POLITICO', 'TuckerCarlson', 'elonmusk', 'itsJeffTiedrich', 'OccupyDemocrats', 'krystalball', 'GunnelsWarren', 'ABC', 'AnnCoulter', 'SteveSchmidtSES', 'SocialistMMA', 'gtconway3d']
","List of accounts coming in: ['denverpost', 'action_4assange', 'CapitolJournal', 'politicallyga', 'fred_guttenberg', 'AmpedUpPodcast', 'LeeCamp', 'JordanChariton', 'TheDemCoalition', 'DworkinReport', 'WarOnDumb', 'NPR', 'TPUSA', 'mmpadellan', 'charliekirk11', 'robreiner', 'davidsirota', 'blacks4peace', 'people4liberty', 'HouseDemocrats', 'TeamWarnock', 'BadFaithPod', 'kylegriffin1', 'PalmerReport', 'StatusCoup', 'POLITICO', 'marceelias', 'TuckerCarlson', 'DworkinWeekly', 'elonmusk', 'EliasLawGroup', 'JoyAnnReid', '1819News', 'itsJeffTiedrich', 'RacePowerPolicy', 'chkbal', 'wabenews', 'bluestein', 'UALawSchool', 'OccupyDemocrats', 'toddcstacy', 'krystalball', 'SarcasmStardust', 'GunnelsWarren', 'ABC', 'LeverNews', 'AnnCoulter', 'TexasTribune', 'RedState', 'DemocracyDocket', 'SteveSchmidtSES', 'TheWeekendMSNBC', 'SocialistMMA', 'ajamubaraka', 'AJC', 'gtconway3d']
","List of accounts needed to be rerun: ['action_4assange', 'CapitolJournal', 'politicallyga', 'AmpedUpPodcast', 'NPR', 'people4liberty', 'TeamWarnock', 'BadFaithPod', 'EliasLawGroup', 'JoyAnnReid', 'RacePowerPolicy', 'UALawSchool']
","List of accounts with parsed but only irrelevant tweets: ['denverpost', 'fred_guttenberg', 'LeeCamp', 'TheDemCoalition', 'DworkinReport', 'WarOnDumb', 'TPUSA', 'robreiner', 'HouseDemocrats', 'marceelias', 'DworkinWeekly', '1819News', 'chkbal', 'wabenews', 'bluestein', 'toddcstacy', 'SarcasmStardust', 'LeverNews', 'TexasTribune', 'RedState', 'DemocracyDocket', 'TheWeekendMSNBC', 'ajamubaraka', 'AJC']"
