Poster,Date,Tweet,No of Likes,No of Retweets,No of Replies,No of Views
itsJeffTiedrich,"September 01, 2024 08:08 PM","hey, remember when you phoned up your despot bestie Netanyahu and told him not to accept a cease fire deal? ace job, homeslice. good thing your meddling caused no serious consequences, am I right",17257,2079,432,428383
bluestein,"November 01, 2023 04:19 PM",A large crowd gathered at Georgia Tech today to rally for Jewish students who feel threatened by recent campus demonstrations. Similar rallies are being held all over Georgia campuses now.,411,103,4,16664
bluestein,"May 19, 2024 02:59 PM","Biden’s speech ends after he speaks of the Israel-Hamas war in broad terms, saying the conflict is “heartbreaking” and that he’s working to bring it to an end. His address is well received by students, alumni and their families — who cheer as he’s given an honorary degree.",835,298,31,112105
bluestein,"July 30, 2024 08:34 PM",The VP briefly addressed the growing conflict in the Middle East after Israel retaliated for rocket attacks by targeting a Hezbollah commander.,264,44,16,22405
bluestein,"October 08, 2023 12:36 AM","Democratic @SenOssoff, the first Jewish US senator in Georgia history, condemns the “indiscriminate and murderous assault on our Israel allies.” #gapol #gasen",238,74,3,21824
krystalball,"May 22, 2024 10:10 AM","“With Gods help, children in Gaza will die thanks to us.”  Right wing activists in Israel are getting inside info from the military and organizing on WhatsApp to block and torch aid trucks and assault truck drivers. Police stand by and watch making no arrests.",907,482,52,44042
krystalball,"November 12, 2023 02:26 PM","The targeting of Al Shifa hospital, is also likely to make it even more difficult (impossible?) to track Palestinian deaths and injuries as the office of the person who tracks and reports this data is located at the hospital. …",1753,670,182,147212
krystalball,"June 09, 2024 12:11 PM",274 Palestinians killed in a bloody massacre to rescue 4 Israelis (and possibly kill others) and this is being celebrated by US politicians as a win. Depraved.,10846,3168,7373,1591146
krystalball,"January 08, 2024 06:17 PM","The only time the word ""Israel"" is even mentioned is in a statement from the IDF denying that they target civilians. Guess that IDF censor CNN chooses to operate under is doing their job.",238,46,17,18788
SarcasmStardust,"May 06, 2024 03:33 PM","It shouldn’t escape anyone that on Holocaust Remembrance Day Zionists are bombing the fuck out of hundreds of thousands of completely defenseless civilians living in tents in a refugee camp. They’re likely hoping you won’t call them out, out of respect. Zionists deserve ZERO",233,105,3,5344
SarcasmStardust,"October 11, 2023 01:37 AM",Israel wasn’t attacked. Israel isn’t real. The occupiers of Palestine were attacked.,578,144,56,13945
SarcasmStardust,"July 31, 2024 05:17 PM",Israel has targeted and murdered over 130 journalists in the past 9 months.   Fuck Israel.,203,61,3,3326
SarcasmStardust,"May 07, 2024 04:30 PM",People trying to make genocide about any other issue except the genocide need to shut the fuck up. It’s not about gay rights. Or trans rights. Or covid. Or women’s rights. Or anything other than Israel is slaughtering innocent civilians en masse for the purpose of eliminating the,425,143,20,8979
SarcasmStardust,"October 07, 2023 03:50 PM",“But more people will die”  Palestinians BEEN dying. And that’s not going to stop. The fact that there are people who think they should just sit around and continue to take it blows my mind. There’s only one aggressor and occupier here. And it ain’t Palestine.,712,195,39,11653
SarcasmStardust,"December 16, 2023 03:36 PM",You don’t end Hamas by slaughtering a bunch of innocent people. That’s how you recruit for Hamas.,976,262,69,15417
AnnCoulter,"January 05, 2024 04:35 PM","I dont like Ramaswamys conspiracy theories, but none of them hold a candle to Nikki Haleys claim that Hamas attacked Israel on Oct 7 because its Putins birthday.    #WarmongerMadness",481,62,85,45563
AnnCoulter,"January 31, 2024 11:30 PM","Well, I know how to recognize a future Palestinian state. Itll be the one lobbing rockets across the border at Israeli civilians.",347,69,62,28088
AnnCoulter,"January 26, 2024 03:09 PM",Nikki Haley explains the Hamas attack on Israel:   “I told you about that brutality on Oct. 7 in Israel. Right? Oct. 7 is Putin’s birthday.”  This is the nitwit the donors are trying to foist on us.,305,61,38,25631
AnnCoulter,"July 24, 2024 09:50 PM",Today’s Pro Hamas protestors in DC could use make-overs and Ozempic.,1605,127,128,74326
AnnCoulter,"January 31, 2024 07:05 PM","NEW COLUMN!  The Fall of Rome, Updated  Americans killed by Islamic terrorists in Islamic lands so far this year: 3.  Americans killed by third-worlders who entered our country illegally so far this year: 150.",848,283,63,46492
AnnCoulter,"November 27, 2023 01:48 AM","Interesting article by David Cole.  <<And before you give me that claptrap about “Well, the people of Gaza are traumatized! What do you expect?” remember that the polls I cited of Muslims and their love of civilian-killing come from Muslims living safely in their own nations and",328,74,45,93222
SteveSchmidtSES,"December 15, 2023 06:40 PM",More than 100 people participated in a flash hora in Toronto to celebrate Jewish culture in the midst of a significant rise in antisemitism in both Canada and worldwide. What a great show of solidarity.  #stopantisemitism #neveragain,742,119,41,103166
SteveSchmidtSES,"October 10, 2023 09:37 PM","""Israel will defend itself and America will stand firm by her side because the lessons of history are clear. Never again wasnt a slogan. It was the most essential moral lesson in human history.""  More of my thoughts on what the American response should be to Hamas attack:",798,190,70,99071
SteveSchmidtSES,"October 14, 2023 01:01 PM","""If Israel doesnt win this war and doesnt do what is necessary to defend civilization, then we will have another ISIS and they will come for us.""  More on why we must stand shoulder to shoulder with Israel to defeat the evil of Hamas:",887,256,180,78056
SteveSchmidtSES,"October 24, 2023 06:08 PM","""The corruption of one man in Israel has brought the whole world to the brink of war because his corruption and weakness stirred evil, and when evil sees weakness, it strikes.""  More on how corrupt politicians like Netanyahu and Trump threaten the world:",4262,1588,314,228271
SteveSchmidtSES,"January 27, 2024 04:01 PM","""Today is International Holocaust Remembrance Day. The greatest crime in human history, industrialized genocide is remembered on the day the Russian army discovered what the Nazis created in Poland.""  Never forget. Never again.",209,33,8,23220
SocialistMMA,"May 09, 2024 01:11 AM",Israel commits crime of the century as they slaughter Palestinians in Rafah  Zionism is currently the most barbaric ideology in the world,511,235,19,14513
SocialistMMA,"November 07, 2023 03:02 PM",Israeli settlers are attacking and lynching Palestinians in the West Bank   Every single adult Israeli is a willing agent and tool of colonialism,332,149,10,7943
SocialistMMA,"December 05, 2023 10:32 PM",Violent Israeli settlers were committing so many terrorist acts on Palestinians in the west bank that the United States is revoking their visas   Everything Zionists accuse Palestinians of is pure projection. Israeli settlers are terrorists,393,159,15,9123
SocialistMMA,"October 09, 2023 07:58 PM",Israel announces war crimes and atrocities are planned for Gaza  Critical support for the Palestinians  #FreePalestine,677,261,56,54065
SocialistMMA,"March 12, 2024 01:06 PM","Weird how the media pretended Hamas targeted civilians on Oct 7th, but now it comes out all their victims where military personnel while the IDF killed Israeli civilians",357,125,22,6629
SocialistMMA,"October 19, 2023 06:03 PM",What the corporate media and their shills will never tell you   Hamas is NOT the terrorist group in this conflict  Israel is the party that has been out of compliance under International Law for YEARS  They are only protected by the United States veto power.   Palestinians,1315,518,95,51714
SocialistMMA,"November 03, 2023 03:26 PM","“The United States is controlling the war in Gaza, and it is the United States that must pay the price for the crimes perpetrated by the Israelis in Gaza and by the Americans in Iraq and elsewhere.”  Address by Hezbollah Chief Nasrallah that was viewed by millions around the",242,65,4,7717
gtconway3d,"November 11, 2023 07:34 AM",".@DouglasKMurray to @piersmorgan:  “The thing that struck me, Piers, about seeing the 7th of October footage, was that even the Nazis were actually ashamed of what they did.  SS battalions who spent their days shooting Jews in the back of the head and pushing them into trenches,",5826,2057,752,1651064
gtconway3d,"November 18, 2023 03:40 PM","“‘If Hamas remains on the scene, Iran, the state of the ayatollahs, will be poised on Egypt’s borders, threatening security in Sinai and the entire Egyptian republic,” writes Algerian journalist and author Hamid Zinar.  “‘This threat will intensify when Hamas declares that it is",293,96,29,80381
gtconway3d,"January 21, 2024 07:39 AM",“Hamas weaved its vast tunnel networks into the society on the surface. Destroying the tunnels is virtually impossible without adversely impacting the population living in Gaza.”,249,54,21,82381
gtconway3d,"January 19, 2024 04:40 PM","""Before the Israel-Hamas war. The Israel Defense Forces (IDF) and scholars estimated. that there were three hundred miles of tunnels ranging from fifteen feet to over two hundred feet below the surface. The estimates were wrong."" @WarInstitute …",726,149,134,203814
ProudSocialist,"October 08, 2023 03:35 PM","You cannot occupy, colonize, and steal people’s land and then expect peace.  You kill peace the moment you subjugate an entire group of people.  Conversely, you create peace when all people are liberated and free.  #Israel #FreePalestine #EndApartheid",6880,2353,600,658908
LaraLeaTrump,"November 15, 2023 01:00 AM","WATCH: @ErinElmore & @AnnabellaRockw1 join me to discuss the rise in antisemitism, the migrant crisis impacting New York City, Joe Bidens internet takeover, Fake News CNN, AND MUCH MORE! #TheRightView",417,87,47,59875
LaraLeaTrump,"October 18, 2023 12:21 AM","WATCH: @LibbyEmmons & @BriannaLyman2 join me to discuss Israel, BLM supporting Hamas, Biden family corruption, AND MUCH MORE! #TheRightView",434,108,104,69097

|RUN STATISTICS|
"Time Processed: October 05, 2024 05:28 PM",Number of discards: 145,"List of accounts processed: ['benshapiro', 'IngrahamAngle', 'RealSpikeCohen', 'briebriejoy', 'ComicDaveSmith', 'TheRickWilson', 'FreemansMind96', 'HannahDCox', 'KyleKulinski', 'seanhannity', 'funder', 'fred_guttenberg', 'LeeCamp', 'JordanChariton', 'mmpadellan', 'charliekirk11', 'davidsirota', 'kylegriffin1', 'TuckerCarlson', 'elonmusk', 'itsJeffTiedrich', 'bluestein', 'krystalball', 'SarcasmStardust', 'AnnCoulter', 'SteveSchmidtSES', 'SocialistMMA', 'gtconway3d', 'ProudSocialist', 'LaraLeaTrump']","List of accounts coming in: ['benshapiro', 'IngrahamAngle', 'RealSpikeCohen', 'briebriejoy', 'ComicDaveSmith', 'TheRickWilson', 'FreemansMind96', 'HannahDCox', 'KyleKulinski', 'seanhannity', 'funder', 'fred_guttenberg', 'LeeCamp', 'JordanChariton', 'mmpadellan', 'charliekirk11', 'davidsirota', 'kylegriffin1', 'TuckerCarlson', 'elonmusk', 'itsJeffTiedrich', 'bluestein', 'krystalball', 'SarcasmStardust', 'AnnCoulter', 'SteveSchmidtSES', 'SocialistMMA', 'gtconway3d', 'ProudSocialist', 'checkmatestate', 'Josh_Moon', 'EricTrump', 'LaraLeaTrump', 'WarOnDumb', 'robreiner', 'marceelias', 'toddcstacy']",List of accounts needed to be rerun: [],"List of accounts with parsed but only irrelevant tweets: ['checkmatestate', 'Josh_Moon', 'EricTrump', 'WarOnDumb', 'robreiner', 'marceelias', 'toddcstacy']"
