Poster,Date,Tweet,No of Likes,No of Retweets,No of Replies,No of Views
benshapiro,"April 05, 2024 01:55 PM",Those seeking an internal moral logic to Joe Bidens actions in protecting Hamas will be searching in vain. This is very simple: he thinks his only path to victory runs through pro-Hamas voters in Dearborn and blue-haired gender studies majors in Ann Arbor.,7389,1082,2000,541550
benshapiro,"April 08, 2024 08:27 PM",The Biden administration is now effectively preparing to make aid to Israel contingent on. unspecified changes to Israeli policy. Which means that Israel can do little or nothing to appease the White House. Hamas is now in control of the Biden administration.,10247,2635,5394,2993367
benshapiro,"April 09, 2024 04:31 PM","So much of our politics is about deliberately ignoring the underlying question. For those who want a ceasefire in Gaza, the underlying question is: do you want Hamas to survive as an operational entity? For those who want defunding of Ukraine, the underlying question is: do you want Russia to ingest Ukraine?",8104,1320,5107,2512390
benshapiro,"April 09, 2024 04:31 PM","So much of our politics is about deliberately ignoring the underlying question. For those who want a ceasefire in Gaza, the underlying question is: do you want Hamas to survive as an operational entity? For those who want defunding of Ukraine, the underlying question is: do you",8104,1320,5107,2512390
benshapiro,"April 15, 2024 05:06 PM","Irans attack on Israel is unprecedented. It is obviously and definitionally an act of direct war, after years of using proxies to attack Israel. The scale of the success of the allied defense against Irans assault is near-miraculous.",5354,941,3493,1196440
benshapiro,"April 16, 2024 05:22 PM","America doesn’t need to go to war with Iran. All America has to have is the credible threat of military force, or allow Israel to leverage its own such credible threat. But Biden is so afraid of third-world enemies that he’s allowed America to be deterred.",3950,595,2138,717718
benshapiro,"April 18, 2024 07:12 PM","Foreign aid should be treated like defense spending: if its good for US interests, its worthwhile. Strong, robust allies are in Americas interest. Someone should explain why it is in Americas interest to cut off aid such that Russia overruns Ukraine and Iran dominates the Middle East.",5784,1268,3557,2781808
benshapiro,"April 18, 2024 12:28 AM","BIDEN: ""I made it clear to the Israelis — dont move on Haifa!""  Haifa is a major city IN Israel.",1111,178,442,347114
benshapiro,"April 19, 2024 08:04 PM","Israel just struck back at Iran. The limited strike was designed to show Iran that Israel has the capacity to strike wherever it wants, including nuclear facilities, thus re-establishing deterrence.",3615,429,1362,655098
benshapiro,"April 25, 2024 11:40 PM","Free speech must be protected on public college campuses. Also, violation of the law is violation of the law. These are illegal protests that are designed to intimidate, obstruct, and harass Jewish students in violation of Title VI of the Civil Rights Act. As everyone knows, if",12564,1792,1945,1222578
benshapiro,"April 25, 2024 07:09 PM",These pro-Hamas protests are being fostered by the faculty and patted on the head by the administration. Thats because these colleges have been completely eaten by the evil intersectional ideology that crosses streams with Jew-hatred.,5576,1148,3739,1097909
benshapiro,"April 25, 2024 11:40 PM",Dont like Title VI of the Civil Rights Act? Think its over-restrictive? Fine. I likely even agree! But I noticed that those who are suddenly standing up for the pro-Hamas students are nowhere to be found when the shoe is on the other foot. They use Title VI as a weapon against,2267,189,91,233816
benshapiro,"April 26, 2024 07:37 PM","Khymani James is the perfect poster child for our dangerous and empty college generation. A professional victim and aggressive Jew-hater and white-hater, James hides behind intersectional titles to promote actual murder. He seeks to destroy the system that gave him every single privilege. And Columbia humors him.",7862,1290,1072,632778
benshapiro,"April 26, 2024 07:37 PM","Khymani James is the perfect poster child for our dangerous and empty college generation. A professional victim and aggressive Jew-hater and white-hater, James hides behind intersectional titles to promote actual murder. He seeks to destroy the system that gave him every single",7862,1290,1072,632778
benshapiro,"May 01, 2024 11:39 PM","When the most privileged young people on earth, bored by their wealth and status and given zero moral guidance by their society, look for meaning, they look to revolution. This isnt about Israel or Gaza. These protesters hate America. They hate the meritocracy. There is a reason they are replacing the American flag with the Palestinian flag.",9568,1673,1608,1281063
benshapiro,"May 01, 2024 11:39 PM","When the most privileged young people on earth, bored by their wealth and status and given zero moral guidance by their society, look for meaning, they look to revolution. This isnt about Israel or Gaza. These protesters hate America. They hate the meritocracy. There is a reason",9568,1673,1608,1281063
benshapiro,"May 01, 2024 12:48 PM","No. The answer is no. Theres a reason Egypt wont take them, Saudi wont take them, Jordan wont take them: the civilian population of Gaza supported Hamas by every available metric. Why would we possibly import them to the United States? Totally insane.",32421,5780,2787,2187260
benshapiro,"April 30, 2024 09:12 PM","BREAKING: The Biden administration is considering ""welcoming"" refugees from Gaza into the United States …",1375,59,121,92482
benshapiro,"May 02, 2024 02:31 AM",Our campuses are Left-wing activism training centers. Remove their taxpayer funding. WV miners should not subsidize gender studies major Hamas fans. The solution is NOT to pass a bad bill adding yet more free speech violations to the giant free speech violation that is Title VI.,14900,2109,1640,1803948
benshapiro,"May 03, 2024 07:31 PM","On the one side, there are moral idiot protesters who love Hamas, deface statues of George Washington, and hate the American flag. On the other side, there are protesters who sing the Star-Spangled Banner and protect the flag from desecration. Joe Bidens having a tough time choosing.",6208,1025,2243,1000559
benshapiro,"May 03, 2024 07:31 PM","On the one side, there are moral idiot protesters who love Hamas, deface statues of George Washington, and hate the American flag. On the other side, there are protesters who sing the Star-Spangled Banner and protect the flag from desecration. Joe Bidens having a tough time",6208,1025,2243,1000559
benshapiro,"May 06, 2024 05:48 PM",Joe Biden dissociating from flag-hating pro-Hamas protesters should be an easy political call. So why isnt he doing it? Follow the $$$.,2694,610,766,1015647
benshapiro,"May 06, 2024 06:18 PM","Israel: Here are the terms of our proposed ceasefire. Hamas: No. We will fire rockets at your soldiers at a humanitarian aid entry. Israel: Okay, were going into Rafah. Hamas: We accept a ceasefire we negotiated with ourselves. Media: Hamas accepts ceasefire! They want peace!",20333,4031,2668,1700975
benshapiro,"May 06, 2024 06:32 PM","So Hamas ""accepts"" the one thing not offered: ""stopping military operations permanently,"" leaving Hamas intact. And the media say Hamas has ""accepted"" a ceasefire.  I hereby accept Jeff Bezos offer for a $2 billion annual salary. …",6240,894,716,649450
benshapiro,"May 08, 2024 05:08 PM",Im sorry u being hungry because ur choosing not to eat in order to defend terrorists is happening to u,5840,417,873,564522
benshapiro,"May 09, 2024 11:26 AM","The predictable results of Bidens disgusting weapons cut-off threat: 1. Hamas refuses any deal. The hostages, including Americans, remain. Hamas knows theyve got Biden on their side. 2. Israel MUST go into Rafah because of (1).  3. Biden is cutting off targeted munitions, which means more civilians will die when (2). 4. Bidens threat will embolden Hezbollah to open up in the north. Which makes broader war MORE likely, not less 5. All of this will forestall Saudi normalization while endangering Israel on multiple borders. Biden isnt just a moral blot, hes a fing moron.",16621,3202,1550,1985818
benshapiro,"May 09, 2024 11:22 AM","First off, it was an Iraqi reactor in 1981. And the US government later thanked Israel. Second, how do those US decisions look in retrospect? Is Lebanon now a flourishing multicultural democracy? Or is it a proxy state for Iran run by Hezbollah?",3113,431,353,415357
benshapiro,"May 09, 2024 02:04 AM","Ronald Reagan paused the delivery of F-16s to Israel after it bombed an Iranian nuclear reactor in 1981. Then, after Israel invaded Lebanon and bombed Beirut in 1982, Reagan refused to deliver 75 F-16s and limited military aid until Israel withdrew its troops from Lebanon. x.com/MittRomney/sta…",6787,825,590,591295
benshapiro,"May 09, 2024 04:00 PM",He said as he left behind five American hostages in Gaza,5569,630,194,294931
benshapiro,"May 10, 2024 06:24 PM","Greta Thunberg is now 21 years old, so we can say what was always true: she is a morally vacuous cretin formerly utilized as a child-sized Trojan Horse in the war on the West. Today, she is an excellent representative of the Army of Losers now rallying on behalf of Hamas.",17657,3107,1672,1706706
benshapiro,"May 13, 2024 02:03 PM",This means the United States has been actively protecting Hamas leadership until now. This is insane and morally disgusting if true. Imagine if a US ally withheld the location of Osama Bin Laden in 2002 to leverage George W. Bush.,9367,2106,1316,769640
benshapiro,"May 15, 2024 12:57 PM","BREAKING:  “Don’t assume that Israel will stop in Gaza. If not stopped, this rogue state, this terrorist state, will sooner or later set its sights on Turkey with its delusions about a promised land”  - President Erdogan",12510,2340,4843,2784517
benshapiro,"May 17, 2024 01:50 PM","Which ""religions in the Middle East"" is she referring to? Double dare her to say it out loud and see how her friends on ""The View"" take it.",2595,389,268,285529
benshapiro,"May 22, 2024 07:12 PM","Democrats are trying to claim that Donald Trump is a crypto-Nazi because he posted a dumb video that contained a rather illegible reference to a “unified reich.” Which he then deleted. Meanwhile, Joe Biden and many in his party are giving aid and comfort to today’s Nazis – the Iranian regime and their terror proxies like Hamas. Who’s more of a threat to Jews?",2404,536,418,967113
benshapiro,"May 22, 2024 11:56 AM",None of these countries recognized a phantom State of Palestine on October 6. These countries are literally making the case that slaughtering Jews wholesale and then getting your asses kicked by the IDF earns you a state.,11285,2373,4351,1285992
benshapiro,"May 22, 2024 07:14 AM","""Today, Ireland, Norway and Spain are announcing that we recognise the state of Palestine.""  Irish Prime Minister Simon Harris says this is a ""historic day for Palestine"".    Sky 501, Virgin 602, Freeview 233 and YouTube",1557,190,366,129766
benshapiro,"May 22, 2024 11:59 AM","The Unicorn State of Palestine has no government and no borders. Furthermore, none of these countries will stop calling Palestinian cities ""refugee camps"" or deny the absurd Palestinian claim of a ""right to return"" to the state of Israel. Its all Israel-hating posturing.",1557,190,366,129767
benshapiro,"May 24, 2024 01:47 PM","This week, Israel found the corpses of hostages in a tunnel in an UNRWA building. The ICJ is trash, just as the UN is trash. Their judgments mean less than nothing.",7382,1301,1510,553997
benshapiro,"May 26, 2024 11:19 PM",Update on the Biden admins Gaza pier to nowhere: Parts of it have broken free and washed up in Israel. And virtually all of the aid that was delivered was stolen by Hamas. A $320M fleecing of the US taxpayer. There should be hearings.  …,11663,1393,687,515763
benshapiro,"May 31, 2024 07:07 PM","Biden saying that Israel must not pursue ""total victory"" over Hamas is absolutely outrageous. Those are the words of an imbecile and a moral coward. Stating that leaving Hamas in place somehow brings ""enduring peace"" is Orwellian in its evil.",4365,579,124,188538
benshapiro,"May 31, 2024 07:04 PM","Bidens outline of the supposed hostages/ceasefire deal, as proposed, is clearly trash. There is literally zero chance that the Israeli government proposed this deal in the form Biden articulates. No Israeli government could propose leaving Hamas as the government of Gaza, as",9926,1427,464,649763
benshapiro,"June 04, 2024 01:51 PM","Shes a perfect Leftist AsAJew -- no actual relationship with Judaism or Jewishness, but gets to say that shes a groundbreaking Jewish figure while criticizing Israel and/or claiming diverse bona fides",1472,174,233,313047
benshapiro,"June 04, 2024 01:41 PM","First, a word about Sheinbaum’s Jewish heritage. No one should expect her to become an outspoken advocate for Israel on the world stage. Back in 2009, she wrote to a Mexican newspaper, ""I join the cry of millions around the world who are calling for a ceasefire and the immediate",2660,480,649,407726
benshapiro,"June 06, 2024 11:54 AM","UAE foreign minister called the Palestinian leadership ""Ali Baba and the forty thieves"" and claimed senior officials in the Palestinian Authority are ""useless"" and therefore ""replacing them with one another will only lead to the same result."" …",33475,3934,4550,1645309
benshapiro,"June 10, 2024 05:48 PM","Israel just carried out one of the most heroic hostage rescues in history. Leave it to the moral trash of the Left to weep for Hamas and its civilian collaborators, and to blame Israel for civilian deaths.",10672,1932,2411,1493978
benshapiro,"June 11, 2024 12:27 AM","An anti-Israel mob surrounded me for nearly an hour, tearing up my notebook, pushing me, calling me names, blowing an air horn in my ear, boxing me in to restrict my movement, but I refused to leave.   I did, however, file a police report. It’s now in NYPD’s hands.",5972,1281,823,1112161
benshapiro,"June 11, 2024 06:48 AM","In other words, Hamas is counting on you, legacy media! Dont let them down!",4415,662,812,319979
benshapiro,"June 11, 2024 12:31 AM","An anti-Israel mob surrounded me for nearly an hour, tearing up my notebook, pushing me, calling me names, blowing an air horn in my ear, boxing me in to restrict my movement, but I refused to leave.   I did, however, file a police report. It’s now in NYPD’s hands. x.com/TheFP/status/1…",2460,309,149,316622
benshapiro,"June 21, 2024 06:33 AM","My old shul. Used to walk here with the kids.   BTW, if people protested Hamas by going to a random mosque and shouting at the constituents, it would be national news and Joe Biden would make a statement about the evils of Islamophobia.",8542,1591,637,625736
benshapiro,"June 21, 2024 01:27 AM",HAPPENING NOW   Outside the school at Shaarey Zedek Congregation in Valley Village  Protestors yelling in loudspeaker at Jewish school: “FREE FREE PALESTINE!” Parent: “You’re coming to our school?!” Protestors: “Go across the street if you’re going to be an agitator!”,2592,93,112,310971
benshapiro,"June 24, 2024 10:15 PM","Jamaal Bowman and AOC are the emissaries of the Democratic Party future: elected dullards somehow considered visionaries because they spout intersectional Jew-hating bullshit and are racially diverse. If thats what Democrats think a winning coalition looks like, good luck to them.",4928,785,512,372707
benshapiro,"June 24, 2024 10:15 PM","Jamaal Bowman and AOC are the emissaries of the Democratic Party future: elected dullards somehow considered visionaries because they spout intersectional Jew-hating bullshit and are racially diverse. If thats what Democrats think a winning coalition looks like, good luck to",4928,785,512,372707
benshapiro,"June 26, 2024 05:35 PM","Jamaal Bowman got his ass kicked because he is a clownish moron who stans for Hamas and doesn’t know how doors work. You can blame AIPAC all you want, but his constituents despised him. Intersectional radicalism is a hell of a drug, and the comedown is brutal.",6866,758,610,475470
benshapiro,"June 26, 2024 05:00 PM",Because it is good for the country when conspiracy-addled Hamas supporters arent in our elected legislature,1376,119,84,195893
benshapiro,"July 01, 2024 02:32 PM",Well thanks Supreme Court. Now King Biden I can officially declare Trump a terrorist and officially imprison him officially without trial (and without consequences),9127,1381,256,576977
benshapiro,"July 02, 2024 04:55 PM","Another note for the Democratic Party: if you go ahead with Biden and he loses, your next nominee is going to be from the Hamas wing of your party (see 1972 election). So good luck with that.",1311,89,47,168011
benshapiro,"July 08, 2024 05:11 PM","In interview with The Nation, Harris on pro-Palestinian protests: “They are showing exactly what the human emotion should be.  There are things some of the protesters are saying that I absolutely reject, so I don’t mean to wholesale endorse their points."" …",3208,279,96,261434
benshapiro,"July 09, 2024 05:05 PM","Director of National Intelligence Avril Haines says ""actors tied to Iran’s government"" are ""providing financial support"" to U.S. anti-Israel protesters …",1099,68,95,196216
benshapiro,"July 23, 2024 12:29 PM","Remember, the obstacle to peace in the Middle East is very simple: Palestinian rejection of Israel, and heartfelt support for murderous terrorism. The supposedly ""moderate"" Palestinian Authority has now formed a unity government with HAMAS.",10994,1779,475,715453
benshapiro,"July 24, 2024 10:24 PM","You are morally despicable. Netanyahu isnt the obstacle to peace. The terrorist group currently holding Israeli hostages, including a baby, is. The fact that you cant figure that out demonstrates just how vacuous you are.",37821,5061,2274,1350979
benshapiro,"July 24, 2024 08:26 PM",Benjamin Netanyahu’s presentation in the House Chamber today was by far the worst presentation of any foreign dignitary invited and honored with the privilege of addressing the Congress of the United States.  Many of us who love Israel spent time today listening to Israeli,7626,1164,876,450798
benshapiro,"July 24, 2024 07:38 PM","BREAKING: Anti-Israel protesters BURN American flag in the middle of a crowd, chant ""BURN THAT SHT!""",1334,109,102,323258
benshapiro,"July 24, 2024 10:30 PM",Your clownish #asaJew routine -- designed specifically to prop up anti-Israel Democratic policies -- has been over since October 7. Give up the act.,40206,2168,1507,1846736
benshapiro,"July 24, 2024 07:46 PM","Prime Minister Netanyahu’s speech today was a narcissistic and unproductive act of political theater, heavy on spin and saber-rattling - cynically using soldiers and hostages as props. 1/8",3900,538,141,310372
benshapiro,"July 25, 2024 10:59 PM","BREAKING: VP Harris speaks after meeting with Israeli PM Netanyahu  Harris calling for an immediate cease-fire deal to free the hostages.   The VP saying she “will not be silent"" about the suffering in Gaza, the ""devastating"" loss of life and the ""dire"" humanitarian crisis.",25736,7067,3967,5999580
benshapiro,"July 25, 2024 01:13 AM","Maybe your party should have attended the speech of the Prime Minister of Israel, then, rather than declaring their emotional support for people who have been doing this shit for months",6046,1079,498,383736
benshapiro,"July 24, 2024 09:35 PM",These images are deeply disturbing. The glorification of Hamas – a terrorist organization backed by the Iranian regime and holding over a hundred hostages in Gaza – is unacceptable and has no place in our country. x.com/MaeveSheehey/s…,5722,572,965,416284
benshapiro,"July 25, 2024 05:11 PM","Please explain, VP Harris, why you declared that such protesters are ""showing exactly what the human emotion should be, as a response to Gaza."" You cant have it both ways.",5722,572,965,416285
benshapiro,"July 30, 2024 01:40 PM","Kamala Harris is running her entire campaign on the basis of identity politics. She is running away from every single progressive position she used to hold, with the exception of union giveaways and anti-Israel rhetoric. Hold her accountable. Expose her lies.",16771,2886,868,416787
benshapiro,"July 31, 2024 02:03 PM",Sorry your friends are getting killed for being terrorists,7595,554,659,495108
benshapiro,"July 31, 2024 03:48 AM","As if genocide wasn’t enough, Israel is outdoing even itself. Assassination in Lebanon (w/o Lebanese consent), assassination of Ismail Haniyeh in Iran (w/o Iranian consent),& massive movement from ground 2 top of govt in upheaval 2 defend the Israeli right to rape. All just today",4906,261,188,374615
benshapiro,"July 31, 2024 08:49 AM","The criminal, terrorist Zionist regime martyred our dear guest in our territory and has caused our grief, but it has also prepared the ground for a severe punishment.",1018,28,88,131521
benshapiro,"July 31, 2024 12:12 PM","Dont worry, these are the fabled moderates favored by the Biden administration, just lowering the flag for an arch-terrorist.",7255,751,348,404654
benshapiro,"July 31, 2024 09:23 AM",President Abbas declares a day of mourning and ordered that flags be flown at half-mast in mourning of the assassination of Hamas leader Ismail Haniyeh.,1964,115,157,271726
benshapiro,"July 31, 2024 12:09 PM","Of course. Because if Israel had told the Biden administration, the Biden administration immediately would have thwarted it and threatened Israel.",1508,91,219,237844
benshapiro,"July 31, 2024 10:58 AM",Blinken says the U.S. was unaware and not involved in the assassination of Hamas leader Haniyeh,8336,1457,241,398306
benshapiro,"August 05, 2024 05:35 PM",War in the Middle East. A plummeting stock market. Joe Biden and Kamala Harris did it. And we are now on Day 16 of Kamala not being asked a SINGLE SERIOUS QUESTION from our professional journalismers.,5120,1096,369,845542
benshapiro,"August 05, 2024 01:40 PM",Josh Shapiro desperately trying to un-Jewish himself to make himself sufficiently palatable to the pro-Hamas wing of the Democratic Party. Pathetic.,20982,3444,1502,1870400
benshapiro,"August 05, 2024 12:53 PM","Massive war in the Middle East. Crashing stock market without extraneous rationale. Cost of living up dramatically over the last three years. Thanks, Kamala and Joe. You did it.",28403,5755,1080,923114
benshapiro,"August 05, 2024 01:38 PM",Harris is a target rich environment. Middle East exploding thanks to Biden-Harris pro-Iran tilt. Massive inflation thanks to historic spending. Stock market crash thanks to bursting bubble. >10 million illegals thanks to open border. The Trump campaign MUST fire away.,11823,2108,588,395598
benshapiro,"August 05, 2024 12:04 PM","Iran was contained, deterred and increasingly isolated by the burgeoning Sunni-Israeli alliance while Trump was president. Iran is unconstrained and aggressively threatening American assets and allies all over the region under Biden-Harris. That is not a coincidence.",2111,160,178,281541
benshapiro,"August 06, 2024 01:01 PM","Picking Walz is a massive gift to the Republicans. Hes a radical Leftist from a non-swing state with a long history of insane statements, who presided over the burning down of his state in 2020. Kamala picked him because hes not a Jew, and shes Too Online.",53216,7515,3741,4229438
benshapiro,"August 06, 2024 02:36 PM","Im not going to lie: Im pleased as punch that Josh Shapiro, who spent the last week trying to slowly and softly back into the bushes on his Zionism to placate the pro-Hamas Democratic base, just got face-planted. Clarity is good. Kamala chose the Squad.",17576,1829,513,494772
benshapiro,"August 06, 2024 01:07 PM","As someone who wants Kamala to lose, picking Walz is wonderful! Its political malpractice! Why?  1. Not from a swing state. 2. Radical, underscoring her radicalism. 3. She rejected (((Shapiro))) to please the pro-Hamas caucus.  Shes not competent. And this pick shows it.",35499,4679,2010,1265243
benshapiro,"August 07, 2024 12:45 PM",Condolences to Hamas on the loss of both its political leader and its Congresswoman from Missouri.,30665,2261,610,965083
benshapiro,"August 12, 2024 05:07 PM","The Democrat-media human centipede is absolutely horrifying. We have a comatose president; a VP who stole his nomination, switched all her positions, and is campaigning on “vibes”; and possible war in the Middle East. And the media are focused on “cat ladies.”",5008,1107,371,871006
benshapiro,"August 13, 2024 01:14 PM","Hamas does not have the capacity anymore for serious offensive action. But theyve roped Iran and Hezbollah into sympathy action that neither Iran nor Hezbollah can afford. Iran and Hezbollah are desperately attempting to get to a ceasefire offramp so they can claim that they arent weak, they couldnt go hard because of the ceasefire. And Sinwar is like, ""Nope. Gonna suck you guys in. You bought the ticket, you take the ride.""",1961,223,117,296090
benshapiro,"August 13, 2024 01:36 PM",Hamas does not have the capacity anymore for serious offensive action. But theyve roped Iran and Hezbollah into sympathy action that neither Iran nor Hezbollah can afford. Iran and Hezbollah are desperately attempting to get to a ceasefire offramp so they can claim that they,1961,223,117,296090
benshapiro,"August 13, 2024 01:14 PM",#BREAKING Hamas claims to have fired two rockets at Tel Aviv.  Residents report hearing explosions.,5192,920,270,315203
benshapiro,"August 12, 2024 11:54 PM","and always remember, free palestine.",2947,526,227,266219
