Poster,Date,Tweet,No of Likes,No of Retweets,No of Replies,No of Views
benshapiro,"August 19, 2024 06:21 PM","Tonight, the DNC begins. We will watch Democrats proclaim that JOY is here, as they put an old man out of his misery, kowtow to pro-Hamas radicals, and provide free abortions and vasectomies. SO. MUCH. JOY!",3186,665,386,750409
benshapiro,"August 19, 2024 12:50 PM","Blinken: Were close to a deal! Hamas: Nope. Blinken: The deal isnt dead! Hamas: ::sends suicide bomber to Tel Aviv:: Blinken: We can still make a deal!  The WH is trying to delay action beyond the DNC. In doing so, its telegraphing weakness to Iran, Hezbollah, and Hamas.",11625,2005,861,490950
benshapiro,"August 19, 2024 02:32 PM",Josh Shapiro pushed back on Trump’s claim that he wasn’t chosen as VP bc he is Jewish.  Shapiro: “Trump is completely full of it & hes trying to use me & hes trying to use other Jews to divide Americans further…antisemitism played absolutely no role in my dialog with” the VP.,21718,6019,1594,1999236
benshapiro,"August 20, 2024 05:51 PM","Night #1 of the DNC! Democrats faking tears for Biden – thanking him for his sacrifice after shivving him directly in the spleen – was pretty hilarious. Then there was Biden himself, who said pro-Hamas protesters have a point. If you believe the Kamala campaign is about JOY!!!!, you’re a moron.",2764,624,306,743999
benshapiro,"August 20, 2024 05:51 PM","Night #1 of the DNC! Democrats faking tears for Biden – thanking him for his sacrifice after shivving him directly in the spleen – was pretty hilarious. Then there was Biden himself, who said pro-Hamas protesters have a point. If you believe the Kamala campaign is about JOY!!!!,",2764,624,306,743999
benshapiro,"August 21, 2024 05:25 PM","Michelle and Barack and Bernie all showed up to rip into wealth – as extraordinarily wealthy people who made their money after mooching off a taxpayer-funded salary for years. Meanwhile, Doug “I Banged The Nanny” Emhoff showed up to talk Jewishness and romance. So yeah, it sucked.",4094,1058,428,752298
benshapiro,"August 21, 2024 05:25 PM","Michelle and Barack and Bernie all showed up to rip into wealth – as extraordinarily wealthy people who made their money after mooching off a taxpayer-funded salary for years. Meanwhile, Doug “I Banged The Nanny” Emhoff showed up to talk Jewishness and romance. So yeah, it",4094,1058,428,752298
benshapiro,"August 21, 2024 02:12 PM","Your soft-on-Hamas wife making brisket for your Hamas-front-group-donating daughter on Passover, a holiday you dont understand -- just before you go to some rainbow flag church for Easter -- doesnt make you a fighter against anti-Semitism. Or particularly Jewish.",1353,109,73,82367
benshapiro,"August 27, 2024 01:31 PM","Remember, Israel is supposedly a racist apartheid state, in which IDF troops just went into a Gaza terror tunnel to rescue a Bedouin Muslim",6597,846,726,473348
benshapiro,"August 27, 2024 12:28 PM","BREAKING In an operation by the IDF and the Shin Bet, Farhan Kadi, 52 years old from Mahrat, who was kidnapped by the terrorist organization Hams to the Gaza Strip on October 7, was rescued today (Tuesday).   The hostage was rescued by IDF fighters from the Shaytet 13 Unit,",15943,1646,456,435161
benshapiro,"August 28, 2024 01:11 AM",Perhaps the lesson here is that Hamas shouldnt have kidnapped her. …,38691,2059,2720,2526139
benshapiro,"September 02, 2024 03:52 PM","President Biden: ""Netanyahu is not doing enough.""  It is beyond concerning that after Hamas executed an American and 5 Israelis, any blame falls on Netanyahu, with no words of criticism for Hamas.  The statement should be, ""Hamas will pay.""",3527,801,593,769536
benshapiro,"September 02, 2024 07:20 PM",And Bidens response is to push Israel to concede.,2656,273,147,311106
benshapiro,"September 02, 2024 06:56 PM",Hamas is ratcheting up the pressure on Israel. Psychological warfare at a level not seen since the start of this war.  Hamas military spokesman Abu Obeida says that “Mujahideen assigned to guard the prisoners” were given new instructions for if the Israeli army approaches a place,16495,2394,845,559632
benshapiro,"September 02, 2024 07:12 PM","Hamas shoots six hostages including an American point blank in the head, and Biden blames Israel for its intransigence in not surrendering to Hamas. The best hope for the world is that he goes back to the beach and sleeps for the rest of his presidency.",2656,272,147,311106
benshapiro,"September 03, 2024 06:57 PM","Six Israeli hostages, including an American, were found murdered this weekend in Hamas terror tunnels. Hamas shot them point-blank in the head after 300 days in captivity. And Joe Biden’s first response was to pressure Israel to make more concessions. There is a reason the West hasn’t won a war in generations.",7631,1286,989,450041
benshapiro,"September 03, 2024 06:57 PM","Six Israeli hostages, including an American, were found murdered this weekend in Hamas terror tunnels. Hamas shot them point-blank in the head after 300 days in captivity. And Joe Biden’s first response was to pressure Israel to make more concessions. There is a reason the West",7631,1286,989,450041
benshapiro,"September 03, 2024 02:44 PM","And if you do, you should be calling for Hamas to be completely extirpated, since civilians on both sides are dying solely because of Hamas",4265,420,427,371471
benshapiro,"September 03, 2024 11:20 AM",You can have empathy for Israeli civilians and Palestinian civilians. You should have empathy for Israeli civilians and Palestinian civilians.   Don’t lose your humanity.,26020,4794,1216,931428
benshapiro,"September 04, 2024 09:22 AM",Greta Thunberg was reportedly arrested at an anti-Israel protest in Denmark blocking the entrance to a Danish university which cooperates with Israel for the development of new green technology.  Not parody.,9530,1559,391,342429
benshapiro,"September 04, 2024 11:42 PM","The pro-terror mob is standing outside a kosher NYC restaurant and screaming ""shame on you"" at the Jews inside.   This isn’t about Israel or the war, this is about people believing that it is acceptable to intimidate and harass Jews in America.",2280,290,46,428211
benshapiro,"September 17, 2024 01:40 PM",Breaking: Tens of Hezbollah communication devices are exploding during the past hour. Initial reports state that over one hundred Hezbollah terrorists already injured.  Heres footage from two such explosion,9925,953,1422,886601
benshapiro,"September 17, 2024 09:16 PM","No. A war crime is when Hezbollah fires 8,000 missiles at civilians, forcing the evacuation of northern Israel. An amazingly awesome military operation is when you pinpoint target Hezbollah terrorists by blowing up their pagers.",4906,276,222,468997
benshapiro,"September 18, 2024 05:15 PM","Israel just carried out the most pinpoint anti-terrorism operation in history, and its enemies are still complaining. Which suggests that their complaints have nothing to do with humanitarianism and everything to do with hating Israel. Also, none of this would be necessary if Biden-Harris weren’t weak and pathetic.",14206,2224,1328,1246557
benshapiro,"September 18, 2024 05:15 PM","Israel just carried out the most pinpoint anti-terrorism operation in history, and its enemies are still complaining. Which suggests that their complaints have nothing to do with humanitarianism and everything to do with hating Israel. Also, none of this would be necessary if",14206,2224,1328,1246557
benshapiro,"September 18, 2024 04:41 PM",Tweeted from a device that undoubtedly has Israeli technology in it,10841,807,797,522525
benshapiro,"September 18, 2024 03:18 PM",Now Israel has blown up walkie talkies in Lebanon. Buyer beware: If you buy anything from Israel it might have a bomb in it. I don’t see how anyone would ever trust an Israeli made product again.,4024,285,308,277196
benshapiro,"September 18, 2024 04:48 PM","More likely, people might think twice before buying beepers while being members of genocidal terrorist groups",29323,3002,1616,1906591
benshapiro,"September 18, 2024 09:09 AM",The amount of triumphalism at the mass terrorist attack against the Lebanon is heart-rending.  Israel has just destroyed its own vital tech sector. Nobody in their right mind is going to buy Israeli electronics or software again. Let that sink in.,26299,2878,1364,851849
benshapiro,"September 18, 2024 01:41 PM","Sure! Every person who was given one of these pagers worked for Hezbollah. The explosives were absolutely tiny, and designed to damage the user. The ratio of terrorists to civilians harmed is unprecedented in the history of warfare.   But you probably knew that. Which suggests an",29323,3002,1616,1906591
benshapiro,"September 17, 2024 05:22 PM","Um. Can someone explain to me how causing hundreds of pagers to explode, regardless of where the people were at the time, and thus endangering the lives of thousands of civilians, is not a terrorist attack?",26299,2878,1364,851849
benshapiro,"September 18, 2024 04:39 PM","Israel’s pager attack in Lebanon detonated thousands of handheld devices across of a slew of public spaces, seriously injuring and killing innocent civilians.  This attack clearly and unequivocally violates international humanitarian law and undermines US efforts to prevent a",5710,538,532,442277
benshapiro,"September 23, 2024 11:00 AM",Ta-Nehisi Coates’s writing on race fueled a reckoning in America. Now he wants to change the way we think about Israel and Palestine.   Read our new cover story now:,1661,118,102,330144
benshapiro,"September 25, 2024 04:00 PM","Biden/Harris say they want a deal between Hamas, Hezbollah and Israel. And they want a pause in the war to allow Hezbollah to recover to achieve that goal. Insane. Heres the actual deal: Hezbollah moves north of the Litani and Hamas releases all hostages, or they get wrecked.",7285,1154,293,376435
benshapiro,"September 27, 2024 10:15 PM",FAFO is an excellent military and foreign policy strategy currently being implemented by Israel. It should be adopted immediately by the United States. The fact that the White House doesnt understand this is why the world is currently on fire.,7586,911,443,515944
benshapiro,"September 27, 2024 08:45 PM",Lloyd Austin speaking to reporters just now: The U.S. had nothing to do with Israeli strikes and did not get a heads up. His aggravation is clear.,20516,2758,652,750362
benshapiro,"September 30, 2024 10:40 PM",Israel’s breathtakingly ballsy strike on Hasan Nasrallah has opened up the possibility of a brand new Middle East: one where Iran doesn’t call the shots. Israel is making the moves the West hasn’t for decades: demonstrating that aggression will be countered with complete evisceration. There is no substitute for victory.,16008,1712,1933,1701566
benshapiro,"September 30, 2024 10:40 PM",Israel’s breathtakingly ballsy strike on Hasan Nasrallah has opened up the possibility of a brand new Middle East: one where Iran doesn’t call the shots. Israel is making the moves the West hasn’t for decades: demonstrating that aggression will be countered with complete,16008,1712,1933,1701566
benshapiro,"September 30, 2024 03:47 PM",Journalist: Israel may now launch a limited ground operation in Lebanese territory. Are you aware of this? Are you comfortable with their plans?  Biden: Im more aware of that than you think. Im comfortable with them stopping. We need a ceasefire now.  x.com/JewishWarrior1…,15358,2180,647,580433
benshapiro,"September 30, 2024 01:06 PM","You were handed a functional border, a recovering economy, no wars in the Middle East, and no Russia-Ukraine war. Then you let in 10 million illegal immigrants, created 40-year inflation, set the Middle East on fire, and ushered in the worst war in Europe since WWII.",60744,11642,1668,2228394
benshapiro,"October 01, 2024 07:30 PM",An amazing way to get real time information on the current situation in Israel,1640,94,120,393844
benshapiro,"October 01, 2024 05:08 PM",Iran has launched a massive ballistic missile attack on Israel. Join me now for live analysis of the potential U.S. and Israeli response and the far-reaching consequences of this escalating conflict.,4279,858,1172,1226906

"|RUN STATISTICS|
"
"Time Processed: November 27, 2024 04:06 AM
","Number of discards: 3912
","List of accounts processed: []
","List of accounts coming in: ['TuckerCarlson', 'benshapiro']
","List of accounts needed to be rerun: ['TuckerCarlson', 'TuckerCarlson', 'TuckerCarlson', 'TuckerCarlson', 'TuckerCarlson', 'TuckerCarlson', 'benshapiro', 'benshapiro', 'benshapiro', 'benshapiro', 'benshapiro', 'benshapiro']
",List of accounts with parsed but only irrelevant tweets: []
