Poster,Date,Tweet,No of Likes,No of Retweets,No of Replies,No of Views
benshapiro,"November 06, 2023 01:58 PM","Jordan is 70% Palestinian Arab. Rania is a queen because she married into the Hashemite dynasty, a true colonialist holdover from the British Mandate. Any time she wants to form a Palestinian state, all she has to do is surrender power.",16915,3833,4564,2423797
benshapiro,"November 06, 2023 02:02 PM","Once again, the images from Gaza are awful and heartbreaking and entirely the fault of Hamas. The minute Hamas gives up the hostages and surrenders, this is all over. Everyone knows it. And everyone calling for a ceasefire is doing Hamas dirty work.",2436,311,938,586885
benshapiro,"November 07, 2023 08:16 PM","""I don’t know, frankly, who should control Gaza when or if Hamas is wiped out. But I do know it cant be Benjamin Netanyahu.""  Piers Morgan criticises the Israeli Prime Ministers plans to occupy Gaza after the bombing is done.  @piersmorgan. @TalkTV. #PMU",2557,589,1536,1356978
benshapiro,"November 08, 2023 02:43 PM","Good news, then: the IDF will have security control, and the current government is a unity government including his opposition. The post-Hamas plans for Gaza have literally nothing to do with Netanyahu personally.",2485,286,876,597720
benshapiro,"November 07, 2023 09:59 PM","Benjamin Netanyahu, Israel’s right-wing prime minister, said yesterday that Israel would oversee Gaza’s security for “an indefinite period” after the war. Really? Should US funds support a long-term military occupation over an already battered & impoverished people? I think not.",1678,95,357,559277
benshapiro,"November 09, 2023 05:02 PM","I understand Israels anger, but it is morally wrong and a political mistake to target journalists who rushed to cover a story. Possibly some of them are complicit, I dont know. But Israel should give them the benefit of the doubt. x.com/DanielCohenTV/…",13716,2635,4389,1975589
benshapiro,"November 09, 2023 10:30 PM","The last time Palestinians ""determined their own future"" they elected Hamas. The right to ""determine your own future"" is completely conditional on not supporting genocidal terrorist groups. Thats the entire problem.",14842,3744,5125,1628557
benshapiro,"November 09, 2023 12:36 AM",Netanyahu claims that Israel could control Gaza for an “indefinite period.” No. Palestinians have a right to determine their own future. Israeli military occupation of Gaza undermines efforts to build two independent states that advance respect for every human being.,13307,2952,5410,1924724
benshapiro,"November 09, 2023 12:26 PM","The distinction between the ""press"" and Hamas in Gaza is extremely vague. All ""journalists"" in Gaza are either propagandists for Hamas or threatened by them. There is no press freedom in Gaza.",13716,2635,4389,1975590
benshapiro,"November 09, 2023 09:37 AM","Yo, @AP, @Reuters, @cnn - what your freelancer in Gaza Hassan Eslaiah is doing on a motorbike with a grenade, on his way to the massacre of women and babies? Is a grenade part of the equipment you provide?",13307,2952,5410,1924724
benshapiro,"November 09, 2023 04:15 PM",Dress up like terrorists and hit inanimate objects. Our universities are truly doing a magnificent job.,13307,2952,5410,1924726
benshapiro,"November 09, 2023 05:53 AM",Students at University of California @ucla in Los Angeles taking out their anger at Israel on a piñata.,16448,2518,2638,1398672
benshapiro,"November 12, 2023 09:20 PM","Hamas hides its military targets among civilians and brags about it. Israel points this out. BBC: Isnt it rather CONVENIENT that when you hit civilians, its because youre targeting military targets, hmmmmmmm??????  Gawd, the utter immorality and idiocy of these people.",19734,4246,4117,1861280
benshapiro,"November 13, 2023 01:10 PM","The great sin in Britain isnt rallying for Hamas. Its noticing that people are rallying for Hamas, and suggesting that action be taken. Thats a fireable offense if youre Home Secretary. …",6841,1068,1500,563375
benshapiro,"November 13, 2023 09:01 PM",The media knew this was true all the time. That did not stop them from implying or stating outright that Israel was attacking civilian targets when the IDF targeted Hamas-run hospitals. Because the media are filled with morally bankrupt liars.,21178,5616,3503,1967059
benshapiro,"November 15, 2023 07:50 AM","Good god, this is blood libel from the BBC.  The IDF said it entered the hospital with its own medical teams and Arabic speakers, so it can help people.  BBC reports the IDF is targeting medical teams and Arabic speakers.  That’s not a coincidence.",10430,3574,1174,2825752
benshapiro,"November 15, 2023 02:45 AM","Justin Trudeau, in an intoned voice and citing reports from Hamas, warns Israel to stand down.     Benjamin Netanyahu responds to Justin.  x.com/netanyahu/stat…",4467,663,1128,756018
benshapiro,"November 20, 2023 06:44 AM","This is Manchester…  I don’t understand how, despite the massive global support for Palestinians, Israeli allies are not doing more to reach a ceasefire.  What am I missing?",38096,12279,14203,5226028
benshapiro,"November 20, 2023 10:14 PM",Hamas And Its Media Allies Baffle With Bulls,1712,282,1303,319274
benshapiro,"November 20, 2023 03:14 PM",That the massive global support for Hamas is an excellent reason not to make concessions to Hamas,8092,844,2718,1182629
benshapiro,"November 21, 2023 03:06 PM","If the Israeli security cabinet approves a temporary pause in order to return some of the hostages, the world will undoubtedly take this as the first step toward cessation of hostilities. Nope. Israels mission will not and should not change: the utter destruction of Hamas.",14355,1865,5727,1171047
benshapiro,"November 22, 2023 01:01 PM","Hamas is making a trade for terrorists and a pause in fighting, hoping Western idiots cudgel Israel into accepting Hamas survival. Nope. You cannot ""de-escalate"" with a genocidal terror group committed to your destruction.",2317,246,769,251024
benshapiro,"November 22, 2023 01:00 PM","All who are now proclaiming that because Israel was able to obtain the release of 50 hostages at the cost of 150 terrorists, ""de-escalation"" is now possible -- youre out of your minds. Israel will not stop until Hamas is destroyed. That is Israels political and moral duty.",21428,2962,8680,2227057
benshapiro,"November 25, 2023 05:11 PM","Greta Thunberg chanting in Sweden:  “What are we going to do? We will crush Zionism”   Greta and both her parents are militant extreme-left activists and always have been.  Some people tried to tell the world years ago, but were silenced by the media.",19737,6495,2691,4519608
benshapiro,"November 29, 2023 11:19 PM","Thats an evil agenda, but it wont even work -- because the oppressor/oppressed matrix DEI represents cant include outlying disproportionately successful groups like Asian-Americans and Jews. DEI delenda est.",2519,324,225,358382
benshapiro,"November 30, 2023 02:48 PM","Kissingers realpolitik was largely about avoiding the worst case scenario by embracing the second-worst scenario.   There are legitimate and real critiques here: sometimes this meant engaging in support of hideous activity to avoid creation of Soviet satellites (Indonesia vs. East Timor), sometimes it meant getting it right in the short term to get it wrong in the long-term (opening China), sometimes it meant ignoring human rights abuses in order to foster other priorities (Soviet dissident Jews). There have been serious critiques on these and other issues from both the Left and the Right.  But the most fundamental ideological critique of Kissinger -- that foreign policy isnt a series of choices between awful alternatives, and that there is a ""family of nations"" in which ""international law"" governs; that ""blowback"" against American foreign policy is the chief driver of foreign policy problems, as though no other country or polity has independent agency and priorities of its own; that America can have clean hands or that Amercan isolationism is a true option in a multipolar world -- is totally wrong.",1335,132,232,535557
benshapiro,"November 30, 2023 01:57 PM","Maybe theyre angry at the Christmas tree because it is a reminder that a rather important Jew was born 2000 years ago in Judea, some six centuries before Mohammed was born. And Jesus was born 1200 years after the Jews arrived in Canaan.",16878,3034,6906,3074520
benshapiro,"November 29, 2023 11:12 PM",The “Flood The Tree Lighting For Gaza” protest is starting out in front of Fox News’ HQ in NYC.   Crowd chants “Shut it down!”,1335,132,232,535557
benshapiro,"December 01, 2023 01:41 PM","UNICEF, like all other UN agencies operating in Gaza, is a tool of Hamas. The UN remains one of the worst institutions on the planet.",6861,1233,3982,1255961
benshapiro,"December 01, 2023 01:14 PM","""There was a bomb 15 minutes from here,"" said UNICEF Spokesperson James Elder from Al-Naser Hospital in Gaza, on the ongoing Israeli aggression on the Gaza Strip.",6861,1233,3982,1255962
benshapiro,"December 07, 2023 03:12 PM","Chanukkah is a celebration of victory over anti-Semites who sought to wipe Judaism out and wrest control of Israel from the Jews. Not much has changed in two millennia on this score, and neither will the outcome. The lights of Chanukkah burn on.",11980,1546,2155,869842
benshapiro,"December 11, 2023 02:51 PM",Rather amazed by the argument that the Biden White House should go softer on Hamas and the Houthis and Hezbollah if Biden wishes to retain votes in Muslim votes in Michigan. That says a lot about media and political perception of Muslim voters.,5220,651,726,401392
benshapiro,"December 15, 2023 02:41 PM","Saying ""two-state solution"" over and over does not actually manifest a peace partner with which Israel can make a deal. Foreign policy isnt Beetlejuice. A Palestinian state would be a terrorist entity on Israels borders.",8834,1272,4499,1203473
benshapiro,"December 18, 2023 01:42 PM","Jews had a lot of goodwill and sympathy after the Holocaust, too. Turns out that goodwill and sympathy for Jews largely exists until precisely the point at which Jews stop dying en masse and start defending themselves.",8592,1221,2944,1399539
benshapiro,"January 09, 2024 06:26 PM",Biden is playing the race card and caving to radical pro-Hamasniks - and there are still 10 months to go until the election.,1263,174,560,367600
benshapiro,"January 10, 2024 03:34 PM",Hamas would literally murder every single one of these people,47535,4823,6963,4764151
benshapiro,"January 12, 2024 06:02 PM","The West is doing what it must to maintain freedom of shipping through the Red Sea. Also, none of this would be happening if Joe Biden hadn’t appeased Iran and undercut America’s Middle East allies for years.",2912,540,1837,873031
benshapiro,"January 12, 2024 02:23 AM","The Houthi slogan: ""Allahu Akbar, Death to America, Death to Israel, A Curse Upon the Jews, Victory to Islam.""  Biden cut off arms sales for Saudi against them and removed the Houthis terrorist designation in 2021, then started negotiating with Iran.  All that worked out great.",15313,2799,2490,1114418
benshapiro,"January 12, 2024 02:55 PM","Weakness breeds aggression. Biden unleashed Iranian proxy Robert Malley to negotiate with Iran, hammered the Saudis even as Saudi tried to engage with Israel, de-listed the Houthis as a terror organization. Iran saw an opening and took it. Now its cleanup on Aisle Biden.",4427,675,611,458268
benshapiro,"January 22, 2024 02:42 PM",January 2024 European Jewish Association Delegation to Auschwitz,1210,385,278,1430790
benshapiro,"January 29, 2024 01:35 PM","These Americans are dead because Joe Bidens Middle East policy is vacillating cowardice. Hes been allowing the Houthis to push us around in the Red Sea, Iranian terror proxies to attack American targets in Iraq and Syria with impunity, and now this. Dont. Appease. Terrorists. …",11356,1709,2790,1601170
benshapiro,"January 29, 2024 01:35 PM","These Americans are dead because Joe Bidens Middle East policy is vacillating cowardice. Hes been allowing the Houthis to push us around in the Red Sea, Iranian terror proxies to attack American targets in Iraq and Syria with impunity, and now this. Dont. Appease. Terrorists.",11356,1709,2790,1601170
benshapiro,"January 31, 2024 08:39 PM","BREAKING: After months of protest, Chicago becomes the largest city in the country to call for a ceasefire after passing a city council resolution.   City council voted 23-23 on the resolution and mayor Brandon Johnson broke the tie in favor of ceasefire.",34285,10840,6730,6118912
benshapiro,"February 01, 2024 12:58 AM",You should call for a ceasefire in your city,24627,2008,1885,2265123
benshapiro,"February 02, 2024 01:27 AM","Oh, how convenient! It turns out that Biden wont have to do anything after all because Iran isnt in control of, you know, the terrorist groups it sponsors.",1310,176,210,203199
benshapiro,"February 05, 2024 01:43 PM","Perhaps you should talk to Hamas. Oh wait, you are Hamas.",16768,1954,3093,1716173
benshapiro,"February 05, 2024 11:52 AM",We CANNOT deliver humanitarian aid under fire.   Safe and sustainable #humanitarian access is URGENTLY needed everywhere including to the North of #Gaza x.com/TomWhiteCW8/st…,2288,125,153,516726
benshapiro,"February 12, 2024 12:17 PM",Biden warns Israel not to go into Rafah. The IDF promptly goes into Rafah and saves two hostages. The problem isnt just that Biden is senile. Its that hes always been a fool.,30777,4210,3058,1510511
benshapiro,"February 13, 2024 07:28 PM",When an allegedly trans shooter sporting a “free Palestine” sticker on her gun shoots up a church…it’s time for the media to talk about other things.,6436,914,797,597020
benshapiro,"February 21, 2024 04:30 PM","As a survivor of rape, AIPAC’s tactic of exploiting rape is outright vile and appalling.  Their playbook relies on bullying, lying, harassing, belittling & intimidation to try to manipulate the public & force those calling for a ceasefire into submission. It won’t stop us.",12228,3396,3312,2295372
benshapiro,"February 21, 2024 07:51 PM","In 1982, Ronald Reagan knew how to arm-twist Menachem Begin to get him to stop the bombing of Lebanon. In 2024, Joe Biden offers only empty words with no consequences, so Benjamin Netanyahu ignores him and keeps bombing Gaza. …",6323,229,275,629487
benshapiro,"February 22, 2024 09:19 PM","So theyre really going to go with this angle: as an alleged rape victim, shes standing with a terrorist group filled with mass-murdering rapists, and anyone who stands against her opposes rape victims",6481,893,588,521874
benshapiro,"February 22, 2024 03:35 PM","As a survivor of rape, AIPAC’s tactic of exploiting rape is outright vile and appalling.  Their playbook relies on bullying, lying, harassing, belittling & intimidation to try to manipulate the public & force those calling for a ceasefire into submission. It won’t stop us. x.com/AIPAC/status/1…",2022,295,177,260714
benshapiro,"February 22, 2024 11:42 PM","I wont mince words.   The overwhelming majority of Palestinians are not Hamas. And Hamas does not represent the Palestinian people.   In fact, theyre also suffering as a result of Hamas terrorism. We need to be clear-eyed about that reality.",44350,16870,26227,14564794
benshapiro,"February 23, 2024 02:45 PM",The insane manipulation of the House of Commons through threat of radical Islamic violence will be commonplace throughout Europe if the ongoing cult of multiculturalism has its way.,3821,460,588,293654
benshapiro,"February 23, 2024 01:07 PM","Hamas is overwhelmingly popular in both Gaza and the West Bank, as were the terrorist attacks of October 7. So hes lying.",27574,3581,806,1418345
benshapiro,"February 27, 2024 06:01 PM",There is something deeply sick about a civilization in which large swaths of people cheer a disturbed anarchists self-immolation on behalf of a lie propagated by a terrorist group.,6356,1037,2453,693125
benshapiro,"February 28, 2024 02:40 PM","Everyone is ignoring this basic truth about 2024: Donald Trump occupies the moderate middle on MANY more issues than Joe Biden. Thats true on abortion (16-week abortion ban is more popular than abortion up to birth), the border, Ukraine, Israel, China, trans, and ""equity.""",5693,766,497,540642
benshapiro,"March 03, 2024 07:41 AM",The playwright Victor I. Cazares is 3 months into a protest during which he refuses to take his daily HIV medicine until the Broadway theater he works for officially condemns Israel.  He is willing to risk contracting AIDS for a ceasefire,7242,979,158,319476
benshapiro,"March 04, 2024 10:44 PM","Judith Butler describing the October 7 massacre as armed resistance: “We can have different views about Hamas as a political party, we can have different views about armed resistance. But .  the uprising of October 7th was an act of armed resistance  This was an uprising”",9393,780,412,419822
benshapiro,"March 05, 2024 10:50 PM","I get this question regularly, and I acknowledge that Israel faced a difficult challenge: It was hard to target Hamas without risking civilians. But my answer is: what I would not do is kill 31,000 people in Vancouver, including 12,500 children, and starve the entire population. x.com/rjherber/statu…",2953,435,524,489945
benshapiro,"March 08, 2024 03:02 PM","I also wonder whether Joe Biden would have a ""come to Jesus"" talk with, say, Hamas or the PA. Or is he too busy telling them how much he respects Ramadan as they fire rockets at civilians?",1063,123,99,85652
benshapiro,"March 08, 2024 02:53 PM",Absolutely pathetic. Hamas is currently holding six American citizens hostage and Biden is saying he wants to pressure Israel. And that Israel should give the Hamas/PA/Islamic Jihad government a state. …,7169,1451,803,645271
benshapiro,"March 08, 2024 03:05 PM",": Pro-Palestinian protesters a part of a group called “ ,” vandalized a historic painting of Arthur James Balfour at Trinity College Cambridge in England.   Arthur Balfour wrote the Balfour Declaration of 1917 when he",11403,1582,350,378100
benshapiro,"March 11, 2024 05:03 PM","The Oscars had some high points (John Mulaney) and some low points (Jimmy Kimmel). But the true moral blot was Jonathan Glazer, who became the bad guy in his own film, “Zone of Interest”: a villain stripping the bodies of the dead for gold while ignoring the Jews being murdered next door.   …",5083,548,505,645825
benshapiro,"March 11, 2024 08:49 PM","An absolutely insane comment. ""If Hamas cares about the Palestinian people""? They have spent the last two decades proving they dont give a shit about the Palestinian people, and they wont surrender now, which would end the conflict today.",2554,306,225,329874
benshapiro,"March 11, 2024 02:59 PM","Absolutely stunning Q&A from Fridays Pentagon press briefing.  Q: Does the DoD anticipate that Hamas will try to fire on them, on the operation (inaudible)?  GEN. RYDER: Look, I mean, thats certainly a risk, again, but if Hamas truly does care about the Palestinian people, then",4030,556,662,466910
benshapiro,"March 11, 2024 08:46 PM","Weird, she could create a Palestinian state literally tomorrow by abdicating her crown, along with the crowns of the rest of her family",5083,548,505,645825
benshapiro,"March 11, 2024 07:24 PM","NEW   Queen Rania of Jordan, in her second interview with Christiane Amanpour since October 7, has offered her harshest condemnation of the Israeli government yet.   “I blame hardline Israeli leaders for keeping their people in this perpetual state of fear of an existential",8052,1298,902,905719
benshapiro,"March 11, 2024 05:03 PM","The Oscars had some high points (John Mulaney) and some low points (Jimmy Kimmel). But the true moral blot was Jonathan Glazer, who became the bad guy in his own film, “Zone of Interest”: a villain stripping the bodies of the dead for gold while ignoring the Jews being murdered",18548,2897,832,930729
benshapiro,"March 11, 2024 11:47 AM","In Jonathan Glazers ""Zone of Interest,"" you dont see one Jew. Those are the best Jews, according to Glazer: the faceless victims screaming in the distance. Ironically, hes the villain: picking up awards from the bodies of those anonymous dead Jews while ignoring the living",3351,495,527,419214
benshapiro,"March 12, 2024 02:34 PM","By ""never stop working to bring your loved ones home,"" he means ""we will blame Israel for any attempt to bring your loved ones home, and keep doing Hamas PR""",1426,184,90,172092
benshapiro,"March 12, 2024 02:25 PM","President Biden says he was devastated to learn that American-Israeli citizen Itay Chen was killed by Hamas.  “I reaffirm my pledge to all the families of those still held hostage: we are with you. We will never stop working to bring your loved ones home. Today, as we join",2677,334,1401,624692
benshapiro,"March 25, 2024 07:38 PM",The fact that Hamas is ecstatic about the current Biden course tells you what you need to know. It was only a matter of time before Biden listened to his radical wing and decided that the support of pro-Hamas voters in Michigan was worth undermining Israels war for survival.,5965,1154,1284,617597
benshapiro,"March 25, 2024 05:59 PM",Hamas knew it could rely on Biden. Biden pulled through. x.com/omriceren/stat…,2488,441,418,411072
benshapiro,"March 31, 2024 11:50 AM","According to the Biden White House, it is disrespectful and wrong to kill terrorists during Ramadan, but Trans Day of Visibility must be celebrated on Easter.",21473,3130,2818,1203416
benshapiro,"April 03, 2024 01:45 PM",Totally insane that Joe Biden keeps attempting to appease his unappeasable radical Left pro-Hamas base. Cornel West is earning approximately 1% of the vote. RFK Jr. is running at 10% by running as a moderate Democrat. Bidens aiming at Wests crowd. Its political malpractice.,2579,232,627,377929
benshapiro,"April 04, 2024 08:42 PM","Joe Biden will cause WWIII through his utter and complete stupidity.   Here is his current position:  1. The United States is willing to go to direct war with a nuclear power by admitting Ukraine to NATO. The minute Ukraine joins NATO, Article 5 will be invoked and we are then in a shooting war with Russia.  2. The United States is demanding a ceasefire from an ally, Israel, in a war with a terrorist group holding hostages including Americans, in a conflict involving precisely ZERO US troops. Iran and its terror proxies now know that if they murder over a thousand citizens of an American ally, take hundreds of hostages, and then hide among civilians, Joe Biden will save them.  It is nearly impossible to believe one human being could be so stupid. But Joe Biden always surpasses expectations.",34369,7342,4742,3192935
benshapiro,"April 04, 2024 08:37 PM",There is literally no more lenient position to be had. Hamas demands a complete Israeli withdrawal from Gaza with Hamas still in place.,1850,231,510,306200
benshapiro,"April 04, 2024 05:55 PM",Biden tells Bibi he wants an “immediate ceasefire in Gaza” and a more lenient position in negotiations with Hamas to achieve a hostage exchange deal.,6060,1727,5371,2999993
benshapiro,"April 04, 2024 01:25 AM","World Central Kitchen does good work, but this is a blood libel unsupportable by logic or evidence. Also, Andres has been accusing Israel of targeting civilians and hospitals for months on Twitter, and called for a ceasefire on October 13, less than a week after October 7.",3989,722,614,538591
benshapiro,"April 03, 2024 09:20 PM","Chef José Andrés said the 7 aid workers killed by an Israeli airstrike were ""targeted deliberately,"" and he believes the conflict in Gaza is ""not a war against terrorism anymore"" and instead, its a ""war against humanity itself."" Israel blamed the strike on ""misidentification.""",3247,586,335,220230
benshapiro,"April 04, 2024 08:43 PM","""Empower his negotiators to conclude a deal""? What deal, precisely, does Biden think is on the table? Hamas literally just rejected a six-week ceasefire with a 40-terrorist-to-one-hostage ratio.",6060,1727,5371,2999994
benshapiro,"April 05, 2024 10:35 PM","Candace, I can see why youd want to hide behind a moderator -- particularly one who said we should rename our company the ""Daily Jewish Wire"" just yesterday.  No.  One on one. Monday at 5 PM.   We can sit down and have a healthy debate like adults, and well live-stream it on X and YouTube. Take it or leave it.  As to the ""true reason"" you didnt respond to my offer to sit down with you and discuss these issues publicly or privately back in February, I have no idea what the hell youre talking about.",12967,1690,5001,9136921
benshapiro,"April 05, 2024 07:08 PM","Bidens foreign policy, seemingly shaped by pro-Hamas voters in Dearborn, risks WWIII with Russia.",3101,485,959,391064
benshapiro,"April 05, 2024 10:52 PM","Candace, I can see why youd want to hide behind a moderator -- particularly one who said we should rename our company the ""Daily Jewish Wire"" just yesterday.  No.  One on one. Monday at 5 PM.   We can sit down and have a healthy debate like adults, and well live-stream it on X",12967,1690,5001,9136921
benshapiro,"April 05, 2024 02:36 PM","Actually, the world is making clear that it is happy to reward terrorism. If Hamas were a conventional army (a la Russia), Israel would be able to do whatever it wanted with US approval. Hamas is an evil terrorist group, so it must be rewarded and Palestinians given a state.",7389,1082,2000,541550
benshapiro,"April 05, 2024 01:48 PM","Joe Bidens logic when it comes to foreign conflicts not involving the United States: if you are an American ally fighting a semi-traditional war with a uniformed enemy, well back you to the hilt (Ukraine). If you are an American ally battling a terrorist group that takes",5973,258,1180,841343
