Poster,Date,Tweet,No of Likes,No of Retweets,No of Replies,No of Views
TuckerCarlson,"October 09, 2023 09:37 PM","Ep. 29  After the Hamas attacks, what’s the wise path forward?",135334,37588,9120,11911271
TuckerCarlson,"October 19, 2023 02:42 AM",(0:00) Vivek attacked for opposing World War III (3:00) The potential for disaster in America (5:00) What does an Israeli ground invasion mean? (9:30) The appropriate response to Hamas (14:25) The real threat of nuclear war,13948,2074,593,2371194
TuckerCarlson,"October 23, 2023 10:02 PM",(2:00) Col. Douglas Macgregor (4:20) Threats to the homeland (6:12) Iran & its missiles (13:00) Going into Gaza (19:40) American hostages (22:45) Impact on the American economy,13094,2332,574,2370113
TuckerCarlson,"November 15, 2023 10:55 PM",Ep. 39  Candace Owens responds to Ben Shapiro.  TIMESTAMPS: (00:00) Candace is attacked – even when she’s right (4:27) Ben Shapiro’s comments (12:50) The emotional response to news out of Israel (23:05) Nikki Haley vs. free speech (30:34) 2024 predictions,119978,29768,8296,14691160
TuckerCarlson,"April 09, 2024 08:46 PM","Ep. 91  How does the government of Israel treat Christians? In the West, Christian leaders don’t seem interested in knowing the answer. They should be. Here’s the view of a pastor from Bethlehem.",83542,29734,10855,19340845
TuckerCarlson,"June 07, 2024 05:03 PM","Rep. Thomas Massie doesn’t care what you think of him, which is pretty great.  (3:19) Where Does US Debt End? (10:32) Why Massie Voted 15 Times Against Funding Israel (14:53) AIPAC (34:04) Mitch McConnell (42:25) Area 51 (50:32) Massies Relationship with Trump (57:09) Kill Switches in Cars (1:05:58) Mike Johnson and the Deep State (1:14:34) How Massie Got Into Politics (1:18:29) Living off the Grid",55431,18597,4155,12695759
TuckerCarlson,"June 07, 2024 05:03 PM","Rep. Thomas Massie doesn’t care what you think of him, which is pretty great.  (3:19) Where Does US Debt End? (10:32) Why Massie Voted 15 Times Against Funding Israel (14:53) AIPAC (34:04) Mitch McConnell (42:25) Area 51 (50:32) Massies Relationship with Trump (57:09) Kill",55431,18597,4155,12695759
TuckerCarlson,"September 02, 2024 05:00 PM","Darryl Cooper may be the best and most honest popular historian in the United States. His latest project is the most forbidden of all: trying to understand World War Two.  (1:20) History of the Israel-Palestine Conflict (12:39) The Jonestown Cult (32:10) World War Two (45:04) How Would You Assess Winston Churchill? (1:17:17) How History Is Rewritten and Propagandized (1:24:39) Mass Immigration in Europe (1:42:25) The Civil Rights Movement and BLM (1:48:17) Viktor Orban, Vladimir Putin, and Donald Trump (1:58:30) Christianity (2:10:58) Hate Blinds You  Includes paid partnerships.",55142,16171,5798,34879592
TuckerCarlson,"September 02, 2024 05:00 PM",Darryl Cooper may be the best and most honest popular historian in the United States. His latest project is the most forbidden of all: trying to understand World War Two.  (1:20) History of the Israel-Palestine Conflict (12:39) The Jonestown Cult (32:10) World War Two (45:04) How,55142,16171,5798,34879592
TuckerCarlson,"September 04, 2024 05:01 PM",Jason Aldean survived the 2017 Las Vegas massacre only to have his character assassinated by the media. He’s bigger than ever.  (0:47) Jason Aldean’s Viral Song That Upset the Left (15:45) Do Artists Talk Politics Behind the Scenes? (22:01) Gender Ideology (26:56) What Does Aldean Think about Donald Trump? (32:50) Aldean’s Song Pulled From CMT (38:21) The Las Vegas Shooting (52:11) What Does Aldean Think about Gavin Newsom? (58:21) Is Trump Going to Win? (1:01:41) Aldean’s Writing Process (1:07:51) The Most Admired Country Artists  Includes paid partnerships.,17523,4636,837,2327929
TuckerCarlson,"September 04, 2024 05:01 PM",Jason Aldean survived the 2017 Las Vegas massacre only to have his character assassinated by the media. He’s bigger than ever.  (0:47) Jason Aldean’s Viral Song That Upset the Left (15:45) Do Artists Talk Politics Behind the Scenes? (22:01) Gender Ideology (26:56) What Does,17523,4636,837,2327932
benshapiro,"October 09, 2023 01:10 AM","Raping, mutilating, kidnapping -- all of these are war crimes. So is hiding behind civilians. Every ounce of blood spilled in Gaza is on Hamas and its Iranian paymasters. Every single ounce.",67002,9248,3240,4941712
benshapiro,"October 09, 2023 11:30 PM",You literally asked terrorists to film their war crimes using a different camera angle …,30088,3033,1208,3425632
benshapiro,"October 09, 2023 10:13 AM",Evil does not sleep.  But neither does the justice of the God of Israel.,27824,3141,2545,1647727
benshapiro,"October 09, 2023 09:03 PM","All Americans should be horrified and outraged by the brazen terrorist attacks on Israel and the slaughter of innocent civilians. We grieve for those who died, pray for the safe return of those who’ve been held hostage, and stand squarely alongside our ally, Israel, as it",3527,476,250,763381
benshapiro,"October 09, 2023 02:35 AM","The key element of this interview begins at around 3:35 when this supposed ""moderate"" suggests that Hamas isnt targeting civilians.",8583,1183,733,735601
benshapiro,"October 08, 2023 05:38 PM","The Palestinian view from the West Bank: my conversation with Palestinian activist and legislator @MustafaBarghoti, who is not connected to Hamas, about the terrorist group’s offensive in southern Israel",32987,4489,5951,4386288
benshapiro,"October 09, 2023 11:15 AM",Terrorists hide behind civilians. This is what Hamas does. Every ounce of blood is on their hands.,20707,3445,1561,2034592
benshapiro,"October 08, 2023 06:44 PM","And the inventible furtherance of death and destruction, with more innocent lives taken: Israeli airstrike kills 13 family members in Gaza, including four toddlers: …",34508,5323,3474,3802868
benshapiro,"October 09, 2023 10:13 AM","If you ""both sides"" this. if you ""but insert fault history"" this. if you ""its time for a ceasefire"" this. YOU are part of the problem.",3527,476,250,763381
benshapiro,"October 10, 2023 01:58 PM","If you cant see the difference between terrorists who behead babies, celebrate it, and hide behind their own children to avoid consequence, and soldiers who attempt to avoid civilian casualties, you are not ""morally sophisticated."" You are a fool, and a dangerous fool at that.",44199,4035,2858,6138481
benshapiro,"October 10, 2023 12:00 PM",A Jewish man speaking of the “eradication” of a race of people.  2023 is a scary time to be alive.  I wonder how many of the women and kids who are soon to be obliterated kidnapped or raped anybody.  My guess is zero.  This is nihilistic and evil.,4916,459,359,551060
benshapiro,"October 10, 2023 06:29 PM","What, precisely, would the appropriate ""proportion"" be here? How many dead terrorists make up for how many babies they beheaded? Absolutely meaningless and stupid horseshit.",9642,2824,1080,1482948
benshapiro,"October 10, 2023 04:45 PM",U.S. calls for ‘proportionate’ Israeli response while not openly setting red lines,1764,161,320,168607
benshapiro,"October 10, 2023 05:13 PM","Why, it turns out when genocidal Jew-hating maniacs proclaim that they want to wipe Jews off the planet, they actually mean it, and its not merely a ""cry of the dispossessed""! Who knew?",33713,5247,3934,4757269
benshapiro,"October 10, 2023 04:12 PM","""The day of your slaughter, extermination and annihilation is clear until near. ""   ""We will totally exterminate you. We will not leave a single one of you alive.""  Hamas, in its own words.",33713,5247,3934,4757270
benshapiro,"October 11, 2023 02:14 AM","Here’s what we’re not going to do:  We will not allow bigotry to destroy our community and city in this devastating moment.  Islamophobia, antisemitism, and victim blaming cannot be tolerated.  We can + will reject it all. Not hard. We must focus on the lives currently at stake. …",52247,7738,15046,15720851
benshapiro,"October 11, 2023 09:01 AM","Senior Hamas Official Ali Baraka: We Have Been Secretly Planning the Invasion for Two Years; Russia Sympathizes with Us, Benefits from U.S. Embroilment in This War; Any Swap Deal Should Include Hamas Prisoners in Europe and the U.S. #Hamas #Russia #Israelunderattack",6585,646,485,774840
benshapiro,"October 11, 2023 04:20 PM",Unclear that Hezbollah has joined the war at this moment in any official way. They are certainly testing things at the border. It may well be an attempt to redirect Israeli resources toward the north and away from Gaza. Will update as information emerges.,21342,3843,3201,2241870
benshapiro,"October 11, 2023 02:11 PM","The peculiar narcissism of Westerners leads to carnage. Not everyone thinks like you do. Hamas does not share your values or even your general outlook on a worthy life. They do not value children the way you do, including their own children.",10781,4271,1648,1945414
benshapiro,"October 11, 2023 11:16 AM",This is a video interrogation of a Hamas terrorist taken alive. He is saying that Hamas took women to rape them.,16563,2762,1791,2217715
benshapiro,"October 11, 2023 11:13 AM","Its the worst pogrom since the Holocaust, and this pathetic human has tweeted once on the topic -- and its moral equivalence between baby murderers and their ""gas the Jews"" supporters, and idiots on a street corner saying terrible crap at odds with Israeli policy",14487,1557,1483,3286592
benshapiro,"October 11, 2023 02:14 AM","Here’s what we’re not going to do:  We will not allow bigotry to destroy our community and city in this devastating moment.  Islamophobia, antisemitism, and victim blaming cannot be tolerated.  We can + will reject it all. Not hard. We must focus on the lives currently at stake. x.com/loffredojeremy…",6585,646,485,774841
benshapiro,"October 12, 2023 04:46 PM","This is collective punishment and a violation of international law.  We cannot starve nearly a million children to death over the horrific actions of Hamas, whose disregard for Israeli, Palestinian, and human life overall could not be more clear.  We must draw a line. …",66934,12297,17761,14137102
benshapiro,"October 12, 2023 05:49 PM","Hamas: We love death more than the Jews love life. We want to kill every Jew. Watch, were going to kill babies and kidnap and rape women and murder 1,300 people now. Media: But what do they really want?",28220,6020,3503,1956289
benshapiro,"October 12, 2023 03:05 PM","If you were fooled by Hamas, its because you wanted to be fooled. There are only two possible reasons you wanted to be fooled: 1. You think everyone thinks like you, and cant imagine people who think like Hamas, so you blame Israel for Hamas barbarity. Or.  2. You hate Jews.",29237,5394,8449,4218619
benshapiro,"October 12, 2023 02:48 PM","Hamas murders Jewish babies in their beds. Media: ""It must be the occupation."" Hamas digs up water pipes and uses them for rockets. Media: ""Water shortages are Israels fault."" Hamas stations civilians in direct line of fire. Media: ""Why wont Israel protect civilians?""",41254,10203,4616,3034566
benshapiro,"October 12, 2023 01:22 AM",The idea that anyone has ever considered Thomas Friedman to be something other than a bloviating fool and moral coward is astonishing. His very sophisticated take: its basically Netanyahus fault Hamas murdered babies.,1236,142,258,246723
benshapiro,"October 12, 2023 05:50 PM","Why its almost as though all the water and power would be back on tomorrow if Hamas -- the government of Gaza -- turned over the children, women and men it is holding hostage. But you dont care about that, of course.",24795,4067,2887,3119301
benshapiro,"October 12, 2023 04:46 PM","This is collective punishment and a violation of international law.  We cannot starve nearly a million children to death over the horrific actions of Hamas, whose disregard for Israeli, Palestinian, and human life overall could not be more clear.  We must draw a line. x.com/AliVelshi/stat…",15187,3070,2519,1890525
benshapiro,"October 13, 2023 01:51 PM",".@AOC is a perverse human being. Here are her words yesterday: ""The United States has a responsibility. to ensure that horrors do not happen in the names of victims who do not want their tragedy used to justify further violence and injustice.""   Yes, she is now attempting to speak in the names of Jews murdered for being Jews in order to shield their murderers.  Democrats, defend her. Go ahead, do it. Sick.  …",37634,5851,4555,5430123
benshapiro,"October 13, 2023 09:47 PM","This letter to President Biden on Israel and Hamas, from @rondesantis and 18 other Republican governors, is excellent and necessary.",4197,914,796,815147
benshapiro,"October 13, 2023 05:38 PM",BREAKING: Hamas publishes footage of its fighters keeping Israeli children as human shields in Gaza.,37634,5851,4555,5430123
benshapiro,"October 16, 2023 01:56 PM","It is amazing that so many people think that they are acting morally when they suggest Israel use more restraint because Hamas is hiding behind civilians. That policy INCENTIVIZES hiding behind civilians, obviously.",18679,3018,5309,3077222
benshapiro,"October 16, 2023 02:05 PM",Israel will use care to avoid civilian casualties. Hamas will maximize those casualties. Israel must achieve its aim of deposing Hamas. Every ounce of blood spilled is on Hamas hands.,2260,321,974,240239
benshapiro,"October 16, 2023 12:36 PM",We ought to have sympathy for both. And we ought to recognize that both are dead because of Hamas.,24023,3499,4509,3813257
benshapiro,"October 16, 2023 09:06 AM","If you feel no sympathy for innocent Israelis murdered or kidnapped by Hamas terrorists last weekend, you have no humanity.  If you feel no sympathy for innocent Palestinians killed in Israels revenge attacks on Gaza, you have no humanity.  Be human.",2260,321,974,240240
benshapiro,"October 17, 2023 10:47 PM","So, just to be clear about this, Palestinian terrorists tried to fire a rocket at Israel, it fell short and hit a hospital killing hundreds of Palestinian Arabs, Hamas claimed that it was Israel. and the media immediately ran with Hamas story. Sounds about right.",71582,15485,25979,22376583
benshapiro,"October 17, 2023 10:48 PM","Who wouldnt trust the genocidal Jew-hating terrorists who just murdered 1,400 civilians in cold blood and openly flaunt that they shield their weapons with civilians?",9693,1089,2468,1581031
benshapiro,"October 17, 2023 02:07 PM","Reminder: in 1948, Israel took in 800,000 Jewish refugees from Muslim countries surrounding it.",15381,3695,5139,3451625
benshapiro,"October 17, 2023 02:00 PM",King Abdullah II of Jordan on Palestinian refugees: “There will be no refugees in Jordan and there will be no refugees in Egypt.”,9693,1089,2468,1581032
benshapiro,"October 18, 2023 05:12 PM",How To Bomb Your Own Hospital And Blame The Jews,14625,4580,13530,4336837
benshapiro,"October 18, 2023 11:34 AM","Watching the news since October 7 is like watching all of Jew-hating history condensed into a 12-day period: Holocaust-level pogrom, Holocaust denial, blood libel, assurance by ""all the right people"" that the Jews ought not defend themselves.",21617,4615,8883,2907229
benshapiro,"October 18, 2023 11:41 AM",The not-so-latent anti-Semitism of rushing to parrot an actual honest to God terrorist group in order to push a blood libel is astonishing - and it came from nearly EVERY major legacy media outlet.,8485,1548,2408,690302
benshapiro,"October 18, 2023 12:11 PM","Media reported a Hamas lie. Mass protests/riots erupted in multiple Muslim countries, Muslim governments bought the lie and parroted it and decided to cancel all negotiations surrounding an end to the conflict. Really, well done, you truth-seeking peace lovers in the media.",26380,5392,4388,1752940
benshapiro,"October 18, 2023 02:18 PM",If you work in the media and uncritically and reflexively parrot the genocidal Jew-hating terrorist liars Hamas you should be fired.,16175,2805,7087,2479667
benshapiro,"October 19, 2023 01:45 PM","Hamas wont allow civilians to evacuate because they know that if they do, Israel will then bomb the network of terror tunnels they have built beneath civilian areas. Israel MUST take out those tunnels before a ground incursion or risk the lives of thousands of its soldiers.",13482,2616,5540,1440106
benshapiro,"October 19, 2023 02:57 PM",Good of the Hamas supporters to list their names,4943,1066,2419,1282454
benshapiro,"October 19, 2023 02:09 PM","New open letter to @Harvard President Claudine Gay signed by over 70 faculty members:  “We call on you, and the Harvard leadership, to publicly and unequivocally condemn the intimidation and harassment of Palestinian, Arab, Black, and Muslim students and other supporters of",14891,2427,6412,3147881
benshapiro,"October 19, 2023 12:37 PM","Useful idiots for Hamas. Plus, these trash people dont know how to wear a tallit. They look like Nancy Pelosi in kente cloth. …",14891,2427,6412,3147886
benshapiro,"October 19, 2023 10:48 PM","EXCLU: State Dept officials are preparing a dissent cable over Bidens Israel-Palestine policy  ""A mutiny is brewing within State at all levels,” one official said, as staff describe anger, depression, tears in meetings + rumors more colleagues will quit",16385,7220,1443,4868196
benshapiro,"October 20, 2023 12:04 AM",Good to see Hamas members sidelining as writers for The Onion,2714,374,1778,1552321
benshapiro,"October 19, 2023 05:45 PM",‘So Horny For This’ Tweets Official Israeli Twitter Account With Picture Of Dead Civilians,5765,831,1312,432252
benshapiro,"October 20, 2023 01:51 PM",Shes probably doing this because the Palestinians care so much about environmentalism.  Or maybe its because the radical environmentalist movement was never about the environment. It was about destroying fundamental institutions in the West.,3612,488,1018,922058
benshapiro,"October 19, 2023 10:48 PM","EXCLU: State Dept officials are preparing a dissent cable over Bidens Israel-Palestine policy  ""A mutiny is brewing within State at all levels,” one official said, as staff describe anger, depression, tears in meetings + rumors more colleagues will quit …",2714,374,1778,1552321
benshapiro,"October 25, 2023 01:26 PM","Jordan cares so much about Palestinian statehood that they occupied the West Bank from 1948-1967 and never even considered setting up an independent Palestinian state. Then, in 1970-71, Jordan killed some 3,000 Palestinians associated with Arafat and exiled another 20,000.",11793,3670,2348,1268672
benshapiro,"October 24, 2023 05:55 PM","In a world exclusive, @QueenRania of Jordan spoke with me about the ongoing bombing of Gaza, civilian deaths, the massacres of October 7, and what she calls “a glaring double standard” in the west’s reaction to all this. Watch our full conversation.",18006,3591,4186,3858381
benshapiro,"October 25, 2023 03:57 PM","If only there was a government in Gaza for 20 years -- call it Hamas, just for the sake of argument -- that could have spent a dime on water supply rather than spending it all on rockets and tunnels",10273,2189,3674,1464082
benshapiro,"October 25, 2023 03:01 PM","Clean drinking water is running out in Gaza, forcing people in the region to drink or cook with tainted water.  That water is likely to be rife with bacteria that can lead to violent intestinal diseases, such as dysentery and cholera. …",1520,285,478,485128
benshapiro,"October 25, 2023 01:48 PM",They wont stop linking anti-Semitism and Islamophobia. Thats an attempt to redirect away from the fact that anti-Semitism is predominantly coming from radical Muslims and their allies.,2299,497,1600,567355
benshapiro,"October 25, 2023 12:30 PM","We must, without equivocation, denounce antisemitism. We must, without equivocation, denounce Islamophobia.   To all of you hurting: You belong.  You’re all America.",8299,1685,5331,1753932
benshapiro,"October 27, 2023 01:56 PM",There is only one end to the current Gaza situation: Hamas must surrender.,14838,2171,7458,1585572
benshapiro,"October 27, 2023 01:44 AM","Nothing says ""loving and protective"" like stanning for a genocidal Jew-hating terror group",11199,1766,2176,1223536
benshapiro,"October 29, 2023 07:37 PM","No ceasefire with Hamas evil. If the world is truly concerned about Palestinian life, the answer is simple: Hamas must surrender.",23107,4601,10080,2180754
benshapiro,"October 29, 2023 07:34 PM","Dont worry, they probably just object to the building of additional Israeli bathrooms in Efrat",10560,1810,1927,1322536
benshapiro,"October 29, 2023 06:04 PM","Mobs break into the Makhachkala airport, in Russia’s north Caucasus, looking to lynch Jews after rumors spread about the arrival of Jewish refugees from Israel.",7730,1171,3424,1226380
benshapiro,"October 30, 2023 05:03 PM","Thomas Friedman continues to be the stupidest pseudo-intellectual on foreign policy on the planet. In his latest piece, he recommends that Israel essentially leave Hamas in place, and then says this:",4758,751,935,520019
benshapiro,"October 30, 2023 05:04 PM","""Yes, a good round of public shame for the genocidal Jew-hating terrorist group that just murdered 1,500 Jews, kidnapped 200 more, and stole billions from its own citizens ought to do it! Well done, once again, Thomas Friedman!"" -- Thomas Friedman",1021,80,102,110042
benshapiro,"November 01, 2023 11:00 AM","If you say that you dont understand the moral difference between:  (1) Hamas murdering babies, raping women and killing them, beheading men, and kidnapping hundreds; and  (2) Israel telling civilians to leave, killing Hamas members, and hitting civilians because Hamas keeps them",38504,8011,12777,3885122
benshapiro,"November 01, 2023 05:33 PM",The Hamas Caucus busting out all the Jew-hating canards at once.,2698,579,1688,529695
benshapiro,"November 01, 2023 09:46 PM","Taking on hate is a national priority.  Today, @POTUS and I are announcing the countrys first National Strategy to Counter Islamophobia.  This action is the latest step forward in our work to combat a surge of hate in America.",14706,11555,28870,39551285
benshapiro,"November 02, 2023 12:03 PM","Pretty solid ""Republicans pounce"" energy here from the NYT. Campuses replete with intersectionality and decolonization ideology are rife with Jew-hatred -- and the story is that Republicans are noticing that.",2543,398,525,283047
benshapiro,"November 02, 2023 09:26 PM",The resource most likely to prolong Hamas terror campaign and prevent their surrender is fuel. We know that Hamas is stealing the fuel that is moving into the Gaza Strip. The State Department essentially admits as much.,4300,750,1848,564112
benshapiro,"November 02, 2023 07:19 PM",It is truly shocking how many Hamas influencers are given full credibility by the Western press.,5115,1113,4200,985512
benshapiro,"November 02, 2023 11:35 AM","No one is in favor of people being targeted because they are Muslim. Meanwhile, we are seeing mass marches in favor of Hamas and Jews hiding their identities on college campuses.",2186,219,487,177078
benshapiro,"November 02, 2023 11:36 AM","The purpose of this narrative is to create pressure not to talk about radical Muslims marching in favor of Hamas across the West, lest you be accused of ""Islamophobia."" Silencing that conversation allows the world to slide back into the utterly false ""cycle of violence"" story.",2166,294,394,172867
benshapiro,"November 02, 2023 11:31 AM","The worst slaughter of Jews and the greatest spike in global anti-Semitism in 80 years, and the White House is rushing to talk about Islamophobia.",32699,6545,8071,3980490
benshapiro,"November 03, 2023 01:53 PM","Nasrallahs speech seems to be Iranian lip service to Hamas. Which makes sense, since at the end of all of this, Hamas will be gone, and Iran does not wish Hezbollah to join them.",3921,465,1457,568778
benshapiro,"November 03, 2023 12:35 PM","There is a reason I told this pathetic human being back in 2014 ""Hamas celebrates every time youre on television.""",3363,398,1129,671618
benshapiro,"November 05, 2023 04:23 PM","The protesters are protecting the right of Hamas to murder Jews.   They should at least have the decency to tell the truth:  They don’t love Palestinians,  They hate Jews.",11371,3768,1765,2431659
benshapiro,"November 05, 2023 09:42 PM","Here is the Palestinian ambassador to the UK, representative of the PLO, refusing to condemn Hamas attacks.",1671,536,2337,601719
benshapiro,"November 05, 2023 09:51 PM",This line from the WaPo Editorial Board is laughable. They damn well did think of building tunnels for civilians. And then they rejected that thought because Hamas wants civilians to die.,3916,880,1168,433254
benshapiro,"November 05, 2023 04:15 PM","Obama was certainly complicit. His cudgeling of Israel, his enrichment of Iran. all of that was a huge part of a policy that led directly to October 7. His clownish arrogance about the Middle East set the place on fire once. Now hes doing it again.",17804,3867,2920,1972336
benshapiro,"November 04, 2023 02:52 PM","Obama: “What Hamas did was horrific, and there is no justification for it. And what is also true is that the occupation, and what’s happening to Palestinians, is unbearable…  “You have to admit that all of us are complicit to some degree.”",12996,2798,2125,3325337
benshapiro,"November 05, 2023 04:45 PM","Yair Lapid, for those who dont know, is on the Left of the Israeli political spectrum, the chief rival to Netanyahu. This is clear and concise language from him. All attempts to paint Israels response to Hamas as a partisan right-wing exercise are lies.",2430,240,2194,817239
